### ISSUE TITLE
Transport CQL Connections number only increases - never drops

### ISSUE THREAD

**Issue by slivne** [scylladb/scylla#143]
Running cassandra-stress with "-mode cql3 native" toward urchin and monitoring collectd transport.connections.cql-connections - it seems the number only increases
- killing cassandra-stress - the number does not drop to 0
- running it again - the number just goes up

trying to check this with tshark it seems we are leaking connections

sudo tshark -i enp2s0f0 -Y "(tcp.flags.syn == 1 || tcp.flags.fin == 1) && tcp.port == 9042"

```
 31   5.871434 192.168.10.185 -> 192.168.10.101 TCP 74 34483→9042 [SYN] Seq=0 Win=29200 Len=0 MSS=1460 SACK_PERM=1 TSval=1408032904 TSecr=0 WS=128
 32   5.871493 192.168.10.101 -> 192.168.10.185 TCP 62 9042→34483 [SYN, ACK] Seq=0 Ack=1 Win=29200 Len=0 MSS=1460 WS=128
 34   5.873740 192.168.10.185 -> 192.168.10.101 TCP 74 34484→9042 [SYN] Seq=0 Win=29200 Len=0 MSS=1460 SACK_PERM=1 TSval=1408032907 TSecr=0 WS=128
 35   5.873768 192.168.10.101 -> 192.168.10.185 TCP 62 9042→34484 [SYN, ACK] Seq=0 Ack=1 Win=29200 Len=0 MSS=1460 WS=128
 37   5.874139 192.168.10.185 -> 192.168.10.101 TCP 74 34485→9042 [SYN] Seq=0 Win=29200 Len=0 MSS=1460 SACK_PERM=1 TSval=1408032907 TSecr=0 WS=128
 38   5.874201 192.168.10.101 -> 192.168.10.185 TCP 62 9042→34485 [SYN, ACK] Seq=0 Ack=1 Win=29200 Len=0 MSS=1460 WS=128
 40   5.876750 192.168.10.185 -> 192.168.10.101 TCP 74 34486→9042 [SYN] Seq=0 Win=29200 Len=0 MSS=1460 SACK_PERM=1 TSval=1408032910 TSecr=0 WS=128
 41   5.876802 192.168.10.101 -> 192.168.10.185 TCP 62 9042→34486 [SYN, ACK] Seq=0 Ack=1 Win=29200 Len=0 MSS=1460 WS=128
 46   5.893985 192.168.10.185 -> 192.168.10.101 TCP 74 34487→9042 [SYN] Seq=0 Win=29200 Len=0 MSS=1460 SACK_PERM=1 TSval=1408032927 TSecr=0 WS=128
 47   5.894018 192.168.10.101 -> 192.168.10.185 TCP 62 9042→34487 [SYN, ACK] Seq=0 Ack=1 Win=29200 Len=0 MSS=1460 WS=128
163   5.954238 192.168.10.185 -> 192.168.10.101 TCP 74 34488→9042 [SYN] Seq=0 Win=29200 Len=0 MSS=1460 SACK_PERM=1 TSval=1408032987 TSecr=0 WS=128
164   5.954284 192.168.10.101 -> 192.168.10.185 TCP 62 9042→34488 [SYN, ACK] Seq=0 Ack=1 Win=29200 Len=0 MSS=1460 WS=128
166   5.960016 192.168.10.185 -> 192.168.10.101 TCP 74 34489→9042 [SYN] Seq=0 Win=29200 Len=0 MSS=1460 SACK_PERM=1 TSval=1408032993 TSecr=0 WS=128
167   5.960156 192.168.10.101 -> 192.168.10.185 TCP 62 9042→34489 [SYN, ACK] Seq=0 Ack=1 Win=29200 Len=0 MSS=1460 WS=128
169   5.960219 192.168.10.185 -> 192.168.10.101 TCP 74 34490→9042 [SYN] Seq=0 Win=29200 Len=0 MSS=1460 SACK_PERM=1 TSval=1408032993 TSecr=0 WS=128
170   5.960651 192.168.10.101 -> 192.168.10.185 TCP 62 9042→34490 [SYN, ACK] Seq=0 Ack=1 Win=29200 Len=0 MSS=1460 WS=128
172   5.966942 192.168.10.185 -> 192.168.10.101 TCP 74 34491→9042 [SYN] Seq=0 Win=29200 Len=0 MSS=1460 SACK_PERM=1 TSval=1408033000 TSecr=0 WS=128
173   5.966979 192.168.10.101 -> 192.168.10.185 TCP 62 9042→34491 [SYN, ACK] Seq=0 Ack=1 Win=29200 Len=0 MSS=1460 WS=128
179   5.971836 192.168.10.185 -> 192.168.10.101 TCP 74 34492→9042 [SYN] Seq=0 Win=29200 Len=0 MSS=1460 SACK_PERM=1 TSval=1408033005 TSecr=0 WS=128
180   5.971936 192.168.10.101 -> 192.168.10.185 TCP 62 9042→34492 [SYN, ACK] Seq=0 Ack=1 Win=29200 Len=0 MSS=1460 WS=128
186   5.975403 192.168.10.185 -> 192.168.10.101 TCP 74 34493→9042 [SYN] Seq=0 Win=29200 Len=0 MSS=1460 SACK_PERM=1 TSval=1408033008 TSecr=0 WS=128
187   5.975456 192.168.10.101 -> 192.168.10.185 TCP 62 9042→34493 [SYN, ACK] Seq=0 Ack=1 Win=29200 Len=0 MSS=1460 WS=128
188   5.975480 192.168.10.185 -> 192.168.10.101 TCP 74 34494→9042 [SYN] Seq=0 Win=29200 Len=0 MSS=1460 SACK_PERM=1 TSval=1408033008 TSecr=0 WS=128
190   5.975551 192.168.10.101 -> 192.168.10.185 TCP 62 9042→34494 [SYN, ACK] Seq=0 Ack=1 Win=29200 Len=0 MSS=1460 WS=128
220   5.984006 192.168.10.185 -> 192.168.10.101 TCP 74 34495→9042 [SYN] Seq=0 Win=29200 Len=0 MSS=1460 SACK_PERM=1 TSval=1408033017 TSecr=0 WS=128
221   5.984051 192.168.10.101 -> 192.168.10.185 TCP 62 9042→34495 [SYN, ACK] Seq=0 Ack=1 Win=29200 Len=0 MSS=1460 WS=128
297   6.000895 192.168.10.185 -> 192.168.10.101 TCP 74 34496→9042 [SYN] Seq=0 Win=29200 Len=0 MSS=1460 SACK_PERM=1 TSval=1408033034 TSecr=0 WS=128
298   6.000933 192.168.10.101 -> 192.168.10.185 TCP 62 9042→34496 [SYN, ACK] Seq=0 Ack=1 Win=29200 Len=0 MSS=1460 WS=128
319   6.005186 192.168.10.185 -> 192.168.10.101 TCP 74 34497→9042 [SYN] Seq=0 Win=29200 Len=0 MSS=1460 SACK_PERM=1 TSval=1408033038 TSecr=0 WS=128
321   6.005626 192.168.10.101 -> 192.168.10.185 TCP 62 9042→34497 [SYN, ACK] Seq=0 Ack=1 Win=29200 Len=0 MSS=1460 WS=128
353   6.012751 192.168.10.185 -> 192.168.10.101 TCP 74 34498→9042 [SYN] Seq=0 Win=29200 Len=0 MSS=1460 SACK_PERM=1 TSval=1408033046 TSecr=0 WS=128
354   6.012807 192.168.10.101 -> 192.168.10.185 TCP 62 9042→34498 [SYN, ACK] Seq=0 Ack=1 Win=29200 Len=0 MSS=1460 WS=128
385   6.020147 192.168.10.185 -> 192.168.10.101 TCP 74 34499→9042 [SYN] Seq=0 Win=29200 Len=0 MSS=1460 SACK_PERM=1 TSval=1408033053 TSecr=0 WS=128
386   6.020208 192.168.10.101 -> 192.168.10.185 TCP 62 9042→34499 [SYN, ACK] Seq=0 Ack=1 Win=29200 Len=0 MSS=1460 WS=128
406   6.023600 192.168.10.185 -> 192.168.10.101 TCP 74 34500→9042 [SYN] Seq=0 Win=29200 Len=0 MSS=1460 SACK_PERM=1 TSval=1408033056 TSecr=0 WS=128
407   6.023650 192.168.10.101 -> 192.168.10.185 TCP 62 9042→34500 [SYN, ACK] Seq=0 Ack=1 Win=29200 Len=0 MSS=1460 WS=128
563   6.080653 192.168.10.185 -> 192.168.10.101 TCP 74 34501→9042 [SYN] Seq=0 Win=29200 Len=0 MSS=1460 SACK_PERM=1 TSval=1408033113 TSecr=0 WS=128
564   6.080693 192.168.10.101 -> 192.168.10.185 TCP 62 9042→34501 [SYN, ACK] Seq=0 Ack=1 Win=29200 Len=0 MSS=1460 WS=128
585   6.090759 192.168.10.185 -> 192.168.10.101 TCP 74 34502→9042 [SYN] Seq=0 Win=29200 Len=0 MSS=1460 SACK_PERM=1 TSval=1408033124 TSecr=0 WS=128
586   6.090795 192.168.10.101 -> 192.168.10.185 TCP 62 9042→34502 [SYN, ACK] Seq=0 Ack=1 Win=29200 Len=0 MSS=1460 WS=128
588   6.091633 192.168.10.185 -> 192.168.10.101 TCP 74 34503→9042 [SYN] Seq=0 Win=29200 Len=0 MSS=1460 SACK_PERM=1 TSval=1408033124 TSecr=0 WS=128
589   6.091679 192.168.10.101 -> 192.168.10.185 TCP 62 9042→34503 [SYN, ACK] Seq=0 Ack=1 Win=29200 Len=0 MSS=1460 WS=128
594   6.092770 192.168.10.185 -> 192.168.10.101 TCP 74 34504→9042 [SYN] Seq=0 Win=29200 Len=0 MSS=1460 SACK_PERM=1 TSval=1408033126 TSecr=0 WS=128
598   6.093119 192.168.10.101 -> 192.168.10.185 TCP 62 9042→34504 [SYN, ACK] Seq=0 Ack=1 Win=29200 Len=0 MSS=1460 WS=128
615   6.097643 192.168.10.185 -> 192.168.10.101 TCP 74 34505→9042 [SYN] Seq=0 Win=29200 Len=0 MSS=1460 SACK_PERM=1 TSval=1408033130 TSecr=0 WS=128
616   6.097679 192.168.10.101 -> 192.168.10.185 TCP 62 9042→34505 [SYN, ACK] Seq=0 Ack=1 Win=29200 Len=0 MSS=1460 WS=128
627   6.104097 192.168.10.185 -> 192.168.10.101 TCP 74 34506→9042 [SYN] Seq=0 Win=29200 Len=0 MSS=1460 SACK_PERM=1 TSval=1408033137 TSecr=0 WS=128
628   6.104161 192.168.10.101 -> 192.168.10.185 TCP 62 9042→34506 [SYN, ACK] Seq=0 Ack=1 Win=29200 Len=0 MSS=1460 WS=128
633   6.108612 192.168.10.185 -> 192.168.10.101 TCP 74 34507→9042 [SYN] Seq=0 Win=29200 Len=0 MSS=1460 SACK_PERM=1 TSval=1408033141 TSecr=0 WS=128
634   6.108682 192.168.10.101 -> 192.168.10.185 TCP 62 9042→34507 [SYN, ACK] Seq=0 Ack=1 Win=29200 Len=0 MSS=1460 WS=128
644   6.113499 192.168.10.185 -> 192.168.10.101 TCP 74 34508→9042 [SYN] Seq=0 Win=29200 Len=0 MSS=1460 SACK_PERM=1 TSval=1408033146 TSecr=0 WS=128
645   6.113549 192.168.10.101 -> 192.168.10.185 TCP 62 9042→34508 [SYN, ACK] Seq=0 Ack=1 Win=29200 Len=0 MSS=1460 WS=128
423688  50.602051 192.168.10.185 -> 192.168.10.101 TCP 54 34486→9042 [FIN, ACK] Seq=611 Ack=51259 Win=145536 Len=0
423690  50.602111 192.168.10.101 -> 192.168.10.185 TCP 60 9042→34486 [FIN, ACK] Seq=51259 Ack=612 Win=3737600 Len=0
423692  50.612546 192.168.10.185 -> 192.168.10.101 TCP 54 34483→9042 [FIN, ACK] Seq=611 Ack=51259 Win=145536 Len=0
423694  50.612587 192.168.10.101 -> 192.168.10.185 TCP 60 9042→34483 [FIN, ACK] Seq=51259 Ack=612 Win=3737600 Len=0
423696  50.626485 192.168.10.185 -> 192.168.10.101 TCP 54 34487→9042 [FIN, ACK] Seq=611 Ack=51259 Win=143616 Len=0
423698  50.626538 192.168.10.101 -> 192.168.10.185 TCP 60 9042→34487 [FIN, ACK] Seq=51259 Ack=612 Win=3737600 Len=0
423700  50.630541 192.168.10.185 -> 192.168.10.101 TCP 54 34484→9042 [FIN, ACK] Seq=611 Ack=51259 Win=143616 Len=0
423702  50.630608 192.168.10.101 -> 192.168.10.185 TCP 60 9042→34484 [FIN, ACK] Seq=51259 Ack=612 Win=3737600 Len=0
423704  50.698175 192.168.10.185 -> 192.168.10.101 TCP 54 34495→9042 [FIN, ACK] Seq=611 Ack=51259 Win=143616 Len=0
423706  50.698226 192.168.10.101 -> 192.168.10.185 TCP 60 9042→34495 [FIN, ACK] Seq=51259 Ack=612 Win=3737600 Len=0
423708  50.705860 192.168.10.185 -> 192.168.10.101 TCP 54 34492→9042 [FIN, ACK] Seq=611 Ack=51259 Win=145536 Len=0
423710  50.705900 192.168.10.101 -> 192.168.10.185 TCP 60 9042→34492 [FIN, ACK] Seq=51259 Ack=612 Win=3737600 Len=0
423712  50.706158 192.168.10.185 -> 192.168.10.101 TCP 54 34489→9042 [FIN, ACK] Seq=611 Ack=51259 Win=145536 Len=0
423714  50.706510 192.168.10.101 -> 192.168.10.185 TCP 60 9042→34489 [FIN, ACK] Seq=51259 Ack=612 Win=3737600 Len=0
423716  50.707629 192.168.10.185 -> 192.168.10.101 TCP 54 34490→9042 [FIN, ACK] Seq=611 Ack=51259 Win=145536 Len=0
423718  50.707670 192.168.10.101 -> 192.168.10.185 TCP 60 9042→34490 [FIN, ACK] Seq=51259 Ack=612 Win=3737600 Len=0
423720  50.718417 192.168.10.185 -> 192.168.10.101 TCP 54 34488→9042 [FIN, ACK] Seq=611 Ack=51259 Win=145536 Len=0
423722  50.718465 192.168.10.101 -> 192.168.10.185 TCP 60 9042→34488 [FIN, ACK] Seq=51259 Ack=612 Win=3737600 Len=0
423724  50.718591 192.168.10.185 -> 192.168.10.101 TCP 54 34493→9042 [FIN, ACK] Seq=611 Ack=51259 Win=145536 Len=0
423726  50.719000 192.168.10.101 -> 192.168.10.185 TCP 60 9042→34493 [FIN, ACK] Seq=51259 Ack=612 Win=3737600 Len=0
423728  50.719505 192.168.10.185 -> 192.168.10.101 TCP 54 34491→9042 [FIN, ACK] Seq=611 Ack=51259 Win=143616 Len=0
423730  50.719575 192.168.10.101 -> 192.168.10.185 TCP 60 9042→34491 [FIN, ACK] Seq=51259 Ack=612 Win=3737600 Len=0
423732  50.719615 192.168.10.185 -> 192.168.10.101 TCP 54 34485→9042 [FIN, ACK] Seq=611 Ack=51259 Win=145536 Len=0
423734  50.720001 192.168.10.101 -> 192.168.10.185 TCP 60 9042→34485 [FIN, ACK] Seq=51259 Ack=612 Win=3737600 Len=0
423736  50.722014 192.168.10.185 -> 192.168.10.101 TCP 54 34494→9042 [FIN, ACK] Seq=611 Ack=51259 Win=143616 Len=0
423738  50.722068 192.168.10.101 -> 192.168.10.185 TCP 60 9042→34494 [FIN, ACK] Seq=51259 Ack=612 Win=3737600 Len=0
```
