### ISSUE TITLE
[1.2 RC1] Failure to execute 'nodetool cfstats keyspace1'

### ISSUE THREAD

**Issue by lmr** [scylladb/scylla#1306]
*Installation details*
Scylla version (or git commit hash): 1.2 RC1

     sdcm.nemesis.ChaosMonkey: scylla-boost-date-time-1.58.0-11.el7.centos.x86_64
     sdcm.nemesis.ChaosMonkey: scylla-boost-filesystem-1.58.0-11.el7.centos.x86_64
     sdcm.nemesis.ChaosMonkey: scylla-boost-program-options-1.58.0-11.el7.centos.x86_64
     sdcm.nemesis.ChaosMonkey: scylla-boost-system-1.58.0-11.el7.centos.x86_64
     sdcm.nemesis.ChaosMonkey: scylla-boost-test-1.58.0-11.el7.centos.x86_64
     sdcm.nemesis.ChaosMonkey: scylla-boost-thread-1.58.0-11.el7.centos.x86_64
     sdcm.nemesis.ChaosMonkey: scylla-conf-1.2.rc1-20160602.c70faa4.el7.centos.x86_64
     sdcm.nemesis.ChaosMonkey: scylla-env-1.0-1.el7.centos.noarch
     sdcm.nemesis.ChaosMonkey: scylla-gdb-7.10.1-30.el7.centos.x86_64
     sdcm.nemesis.ChaosMonkey: scylla-jmx-1.2.rc1-20160601.b2dff7c.el7.centos.noarch
     sdcm.nemesis.ChaosMonkey: scylla-server-1.2.rc1-20160602.c70faa4.el7.centos.x86_64
     sdcm.nemesis.ChaosMonkey: scylla-tools-1.2.rc1-20160601.7fea5be.el7.centos.noarch
 
Cluster size: i2.4xlarge
OS (RHEL/CentOS/Ubuntu/AWS AMI): CentOS

The execution of the longevity tests on 1.2 RC1 revealed the following error when trying to execute 'nodetool cfstats keyspace1':

    2016-06-02 22:39:04,164 remote           L0785 DEBUG| Remote [centos@52.91.175.5]: Running 'nodetool cfstats keyspace1'
    2016-06-02 22:39:04,164 remote           L0092 INFO | [52.91.175.5] Running '/bin/ssh -a -x  -o ControlPath=/var/tmp/ssh-master6xf1YN/socket -o StrictHostKeyChecking=no -o UserKnownHostsFile=/var/tmp/tmpgPdzpD -o BatchMode=yes -o ConnectTimeout=300 -o ServerAliveInterval=300 -l centos -p 22 -i /var/tmp/chaos_monkey-longevity-test-b226041c.pem 52.91.175.5 "nodetool cfstats keyspace1"'
    2016-06-02 22:39:05,485 remote           L0192 DEBUG| [52.91.175.5] [stdout] Keyspace: keyspace1
    2016-06-02 22:39:05,510 remote           L0192 DEBUG| [52.91.175.5] [stdout] nodetool: Scylla API server HTTP GET to URL '/column_family/metrics/read_latency/moving_average_histogram/keyspace1:standard1' failed: Invalid double value
    2016-06-02 22:39:05,511 remote           L0192 DEBUG| [52.91.175.5] [stdout] See 'nodetool help' or 'nodetool help <command>'.

**Comment by lmr** [comment]
This makes the longevity test to fail, because it depends on the output of said command to evaluate whether it can start executing nemesis disruption functions.

**Comment by penberg** [comment]
Likely related to commit ad34f80e6f3aa1a7c4ffa25e94b9ae0ba270b69e. @amnonh?

**Comment by penberg** [comment]
I am not able to reproduce this locally. @lmr, what exact command do you use to generate load for the cluster?

**Comment by avikivity** [comment]
Alternatively, a tcpdump of port 10000 on the loopback interface when this happens.

**Comment by lmr** [comment]
@penberg, the exact command is:

    2016-06-02 16:20:49,218 remote           L0785 DEBUG| Remote [centos@54.172.65.39]: Running 'cassandra-stress write cl=QUORUM duration=180m -schema 'replication(factor=3)' -port jmx=6868 -mode cql3 native -rate threads=1000 -pop seq=1..10000000 -node 172.30.0.40'

**Comment by lmr** [comment]
@avikivity, after I instrumented the suite's code, this is what I got for the tcpdump of the particular instance that failed:

    [54.85.204.196] [stderr] tcpdump: listening on lo, link-type EN10MB (Ethernet), capture size 65535 bytes
    [54.85.204.196] [stdout] 02:33:29.868911 IP (tos 0x0, ttl 64, id 7773, offset 0, flags [DF], proto TCP (6), length 60)
    [54.85.204.196] [stderr] 155 packets captured
    [54.85.204.196] [stdout]     localhost.37572 > localhost.ndmp: Flags [S], cksum 0xfe30 (incorrect -> 0x4f80), seq 2092113419, win 43690, options [mss 65495,sackOK,TS val 12976214 ecr 0,nop,wscale 7], length 0
    [54.85.204.196] [stderr] 310 packets received by filter
    [54.85.204.196] [stdout] 01:13:35.147208 IP (tos 0x0, ttl 64, id 0, offset 0, flags [DF], proto TCP (6), length 60)
    [54.85.204.196] [stdout]     localhost.ndmp > localhost.37572: Flags [S.], cksum 0xfe30 (incorrect -> 0xaf5a), seq 2840130991, ack 2092113420, win 43690, options [mss 65495,sackOK,TS val 12976214 ecr 12976214,nop,wscale 7], length 0
    [54.85.204.196] [stderr] 0 packets dropped by kernel
    [54.85.204.196] [stdout] 02:33:29.868933 IP (tos 0x0, ttl 64, id 7774, offset 0, flags [DF], proto TCP (6), length 52)
    [54.85.204.196] [stdout]     localhost.37572 > localhost.ndmp: Flags [.], cksum 0xfe28 (incorrect -> 0x819f), seq 1, ack 1, win 342, options [nop,nop,TS val 12976214 ecr 12976214], length 0
    [54.85.204.196] [stdout] 02:33:29.869027 IP (tos 0x0, ttl 64, id 7775, offset 0, flags [DF], proto TCP (6), length 213)
    [54.85.204.196] [stdout]     localhost.37572 > localhost.ndmp: Flags [P.], cksum 0xfec9 (incorrect -> 0xf385), seq 1:162, ack 1, win 342, options [nop,nop,TS val 12976214 ecr 12976214], length 161
    [54.85.204.196] [stdout] 02:33:29.869032 IP (tos 0x0, ttl 64, id 62950, offset 0, flags [DF], proto TCP (6), length 52)
    [54.85.204.196] [stdout]     localhost.ndmp > localhost.37572: Flags [.], cksum 0xfe28 (incorrect -> 0x80f6), seq 1, ack 162, win 350, options [nop,nop,TS val 12976214 ecr 12976214], length 0
    [54.85.204.196] [stdout] 02:33:29.869203 IP (tos 0x0, ttl 64, id 62951, offset 0, flags [DF], proto TCP (6), length 1353)
    [54.85.204.196] [stdout]     localhost.ndmp > localhost.37572: Flags [P.], cksum 0x033e (incorrect -> 0x5ea7), seq 1:1302, ack 162, win 350, options [nop,nop,TS val 12976214 ecr 12976214], length 1301
    [54.85.204.196] [stdout] 02:33:29.869230 IP (tos 0x0, ttl 64, id 7776, offset 0, flags [DF], proto TCP (6), length 52)
    [54.85.204.196] [stdout]     localhost.37572 > localhost.ndmp: Flags [.], cksum 0xfe28 (incorrect -> 0x77ea), seq 162, ack 1302, win 1365, options [nop,nop,TS val 12976214 ecr 12976214], length 0
    [54.85.204.196] [stdout] 02:33:29.884931 IP (tos 0x0, ttl 64, id 7777, offset 0, flags [DF], proto TCP (6), length 213)
    [54.85.204.196] [stdout]     localhost.37572 > localhost.ndmp: Flags [P.], cksum 0xfec9 (incorrect -> 0xe9c0), seq 162:323, ack 1302, win 1365, options [nop,nop,TS val 12976230 ecr 12976214], length 161
    [54.85.204.196] [stdout] 02:33:29.885071 IP (tos 0x0, ttl 64, id 62952, offset 0, flags [DF], proto TCP (6), length 1353)
    [54.85.204.196] [stdout]     localhost.ndmp > localhost.37572: Flags [P.], cksum 0x033e (incorrect -> 0x58c8), seq 1302:2603, ack 323, win 359, options [nop,nop,TS val 12976230 ecr 12976230], length 1301
    [54.85.204.196] [stdout] 02:33:29.921177 IP (tos 0x0, ttl 64, id 7778, offset 0, flags [DF], proto TCP (6), length 240)
    [54.85.204.196] [stdout]     localhost.37572 > localhost.ndmp: Flags [P.], cksum 0xfee4 (incorrect -> 0x68ff), seq 323:511, ack 2603, win 2388, options [nop,nop,TS val 12976266 ecr 12976230], length 188
    [54.85.204.196] [stdout] 02:33:29.921259 IP (tos 0x0, ttl 64, id 62953, offset 0, flags [DF], proto TCP (6), length 194)
    [54.85.204.196] [stdout]     localhost.ndmp > localhost.37572: Flags [P.], cksum 0xfeb6 (incorrect -> 0x9c25), seq 2603:2745, ack 511, win 367, options [nop,nop,TS val 12976266 ecr 12976266], length 142
    [54.85.204.196] [stdout] 02:33:29.927369 IP (tos 0x0, ttl 64, id 7779, offset 0, flags [DF], proto TCP (6), length 279)
    [54.85.204.196] [stdout]     localhost.37572 > localhost.ndmp: Flags [P.], cksum 0xff0b (incorrect -> 0x139b), seq 511:738, ack 2745, win 2388, options [nop,nop,TS val 12976272 ecr 12976266], length 227
    [54.85.204.196] [stdout] 02:33:29.927899 IP (tos 0x0, ttl 64, id 62954, offset 0, flags [DF], proto TCP (6), length 1926)
    [54.85.204.196] [stdout]     localhost.ndmp > localhost.37572: Flags [P.], cksum 0x057b (incorrect -> 0xfeb8), seq 2745:4619, ack 738, win 375, options [nop,nop,TS val 12976273 ecr 12976272], length 1874
    [54.85.204.196] [stdout] 02:33:29.933805 IP (tos 0x0, ttl 64, id 7780, offset 0, flags [DF], proto TCP (6), length 278)
    [54.85.204.196] [stdout]     localhost.37572 > localhost.ndmp: Flags [P.], cksum 0xff0a (incorrect -> 0xf0ff), seq 738:964, ack 4619, win 3411, options [nop,nop,TS val 12976279 ecr 12976273], length 226
    [54.85.204.196] [stdout] 02:33:29.973732 IP (tos 0x0, ttl 64, id 62955, offset 0, flags [DF], proto TCP (6), length 52)
    [54.85.204.196] [stdout]     localhost.ndmp > localhost.37572: Flags [.], cksum 0xfe28 (incorrect -> 0x6afe), seq 4619, ack 964, win 384, options [nop,nop,TS val 12976319 ecr 12976279], length 0
    [54.85.204.196] [stdout] 02:33:29.987630 IP (tos 0x0, ttl 64, id 62956, offset 0, flags [DF], proto TCP (6), length 239)
    [54.85.204.196] [stdout]     localhost.ndmp > localhost.37572: Flags [P.], cksum 0xfee3 (incorrect -> 0xf134), seq 4619:4806, ack 964, win 384, options [nop,nop,TS val 12976332 ecr 12976279], length 187
    [54.85.204.196] [stdout] 02:33:30.026735 IP (tos 0x0, ttl 64, id 7781, offset 0, flags [DF], proto TCP (6), length 52)
    [54.85.204.196] [stdout]     localhost.37572 > localhost.ndmp: Flags [.], cksum 0xfe28 (incorrect -> 0x5e06), seq 964, ack 4806, win 3411, options [nop,nop,TS val 12976372 ecr 12976332], length 0
    [54.85.204.196] [stdout] 02:33:39.870255 IP (tos 0x0, ttl 64, id 7782, offset 0, flags [DF], proto TCP (6), length 52)
    [54.85.204.196] [stdout]     localhost.37572 > localhost.ndmp: Flags [F.], cksum 0xfe28 (incorrect -> 0x3792), seq 964, ack 4806, win 3411, options [nop,nop,TS val 12986215 ecr 12976332], length 0
    [54.85.204.196] [stdout] 02:33:39.870320 IP (tos 0x0, ttl 64, id 62957, offset 0, flags [DF], proto TCP (6), length 52)
    [54.85.204.196] [stdout]     localhost.ndmp > localhost.37572: Flags [F.], cksum 0xfe28 (incorrect -> 0x1cc9), seq 4806, ack 965, win 384, options [nop,nop,TS val 12986215 ecr 12986215], length 0
    [54.85.204.196] [stdout] 02:33:39.870329 IP (tos 0x0, ttl 64, id 7783, offset 0, flags [DF], proto TCP (6), length 52)
    [54.85.204.196] [stdout]     localhost.37572 > localhost.ndmp: Flags [.], cksum 0xfe28 (incorrect -> 0x10f6), seq 965, ack 4807, win 3411, options [nop,nop,TS val 12986215 ecr 12986215], length 0
    [54.85.204.196] [stdout] 02:34:31.364056 IP (tos 0x0, ttl 64, id 16064, offset 0, flags [DF], proto TCP (6), length 60)
    [54.85.204.196] [stdout]     localhost.37576 > localhost.ndmp: Flags [S], cksum 0xfe30 (incorrect -> 0x5469), seq 3612069453, win 43690, options [mss 65495,sackOK,TS val 13037709 ecr 0,nop,wscale 7], length 0
    [54.85.204.196] [stdout] 02:35:34.222571 IP (tos 0x0, ttl 64, id 0, offset 0, flags [DF], proto TCP (6), length 60)
    [54.85.204.196] [stdout]     localhost.ndmp > localhost.37576: Flags [S.], cksum 0xfe30 (incorrect -> 0x7c85), seq 2309315801, ack 3612069454, win 43690, options [mss 65495,sackOK,TS val 13037709 ecr 13037709,nop,wscale 7], length 0
    [54.85.204.196] [stdout] 02:34:31.364077 IP (tos 0x0, ttl 64, id 16065, offset 0, flags [DF], proto TCP (6), length 52)
    [54.85.204.196] [stdout]     localhost.37576 > localhost.ndmp: Flags [.], cksum 0xfe28 (incorrect -> 0x4eca), seq 1, ack 1, win 342, options [nop,nop,TS val 13037709 ecr 13037709], length 0
    [54.85.204.196] [stdout] 02:34:31.364173 IP (tos 0x0, ttl 64, id 16066, offset 0, flags [DF], proto TCP (6), length 213)
    [54.85.204.196] [stdout]     localhost.37576 > localhost.ndmp: Flags [P.], cksum 0xfec9 (incorrect -> 0xc0b0), seq 1:162, ack 1, win 342, options [nop,nop,TS val 13037709 ecr 13037709], length 161
    [54.85.204.196] [stdout] 02:34:31.364179 IP (tos 0x0, ttl 64, id 44119, offset 0, flags [DF], proto TCP (6), length 52)
    [54.85.204.196] [stdout]     localhost.ndmp > localhost.37576: Flags [.], cksum 0xfe28 (incorrect -> 0x4e21), seq 1, ack 162, win 350, options [nop,nop,TS val 13037709 ecr 13037709], length 0
    [54.85.204.196] [stdout] 02:34:31.364347 IP (tos 0x0, ttl 64, id 44120, offset 0, flags [DF], proto TCP (6), length 1353)
    [54.85.204.196] [stdout]     localhost.ndmp > localhost.37576: Flags [P.], cksum 0x033e (incorrect -> 0x34d0), seq 1:1302, ack 162, win 350, options [nop,nop,TS val 13037709 ecr 13037709], length 1301
    [54.85.204.196] [stdout] 02:34:31.364373 IP (tos 0x0, ttl 64, id 16067, offset 0, flags [DF], proto TCP (6), length 52)
    [54.85.204.196] [stdout]     localhost.37576 > localhost.ndmp: Flags [.], cksum 0xfe28 (incorrect -> 0x4515), seq 162, ack 1302, win 1365, options [nop,nop,TS val 13037709 ecr 13037709], length 0
    [54.85.204.196] [stdout] 02:34:31.378968 IP (tos 0x0, ttl 64, id 16068, offset 0, flags [DF], proto TCP (6), length 213)
    [54.85.204.196] [stdout]     localhost.37576 > localhost.ndmp: Flags [P.], cksum 0xfec9 (incorrect -> 0xb6ec), seq 162:323, ack 1302, win 1365, options [nop,nop,TS val 13037724 ecr 13037709], length 161
    [54.85.204.196] [stdout] 02:34:31.379109 IP (tos 0x0, ttl 64, id 44121, offset 0, flags [DF], proto TCP (6), length 1353)
    [54.85.204.196] [stdout]     localhost.ndmp > localhost.37576: Flags [P.], cksum 0x033e (incorrect -> 0x2ef3), seq 1302:2603, ack 323, win 359, options [nop,nop,TS val 13037724 ecr 13037724], length 1301
    [54.85.204.196] [stdout] 02:34:31.413414 IP (tos 0x0, ttl 64, id 16069, offset 0, flags [DF], proto TCP (6), length 240)
    [54.85.204.196] [stdout]     localhost.37576 > localhost.ndmp: Flags [P.], cksum 0xfee4 (incorrect -> 0x362e), seq 323:511, ack 2603, win 2388, options [nop,nop,TS val 13037758 ecr 13037724], length 188
    [54.85.204.196] [stdout] 02:34:31.413503 IP (tos 0x0, ttl 64, id 44122, offset 0, flags [DF], proto TCP (6), length 194)
    [54.85.204.196] [stdout]     localhost.ndmp > localhost.37576: Flags [P.], cksum 0xfeb6 (incorrect -> 0x7254), seq 2603:2745, ack 511, win 367, options [nop,nop,TS val 13037758 ecr 13037758], length 142
    [54.85.204.196] [stdout] 02:34:31.420251 IP (tos 0x0, ttl 64, id 16070, offset 0, flags [DF], proto TCP (6), length 279)
    [54.85.204.196] [stdout]     localhost.37576 > localhost.ndmp: Flags [P.], cksum 0xff0b (incorrect -> 0xe0ca), seq 511:738, ack 2745, win 2388, options [nop,nop,TS val 13037765 ecr 13037758], length 227
    [54.85.204.196] [stdout] 02:34:31.420781 IP (tos 0x0, ttl 64, id 44123, offset 0, flags [DF], proto TCP (6), length 1926)
    [54.85.204.196] [stdout]     localhost.ndmp > localhost.37576: Flags [P.], cksum 0x057b (incorrect -> 0xd2e1), seq 2745:4619, ack 738, win 375, options [nop,nop,TS val 13037766 ecr 13037765], length 1874
    [54.85.204.196] [stdout] 02:34:31.426314 IP (tos 0x0, ttl 64, id 16071, offset 0, flags [DF], proto TCP (6), length 278)
    [54.85.204.196] [stdout]     localhost.37576 > localhost.ndmp: Flags [P.], cksum 0xff0a (incorrect -> 0xbe2f), seq 738:964, ack 4619, win 3411, options [nop,nop,TS val 13037771 ecr 13037766], length 226
    [54.85.204.196] [stdout] 02:34:31.426553 IP (tos 0x0, ttl 64, id 44124, offset 0, flags [DF], proto TCP (6), length 308)
    [54.85.204.196] [stdout]     localhost.ndmp > localhost.37576: Flags [P.], cksum 0xff28 (incorrect -> 0x428e), seq 4619:4875, ack 964, win 384, options [nop,nop,TS val 13037771 ecr 13037771], length 256
    [54.85.204.196] [stdout] 02:34:31.431924 IP (tos 0x0, ttl 64, id 16072, offset 0, flags [DF], proto TCP (6), length 254)
    [54.85.204.196] [stdout]     localhost.37576 > localhost.ndmp: Flags [P.], cksum 0xfef2 (incorrect -> 0xe5d1), seq 964:1166, ack 4875, win 3411, options [nop,nop,TS val 13037777 ecr 13037771], length 202
    [54.85.204.196] [stdout] 02:34:31.432121 IP (tos 0x0, ttl 64, id 44125, offset 0, flags [DF], proto TCP (6), length 182)
    [54.85.204.196] [stdout]     localhost.ndmp > localhost.37576: Flags [P.], cksum 0xfeaa (incorrect -> 0x4161), seq 4875:5005, ack 1166, win 392, options [nop,nop,TS val 13037777 ecr 13037777], length 130
    [54.85.204.196] [stdout] 02:34:31.436746 IP (tos 0x0, ttl 64, id 16073, offset 0, flags [DF], proto TCP (6), length 256)
    [54.85.204.196] [stdout]     localhost.37576 > localhost.ndmp: Flags [P.], cksum 0xfef4 (incorrect -> 0x7820), seq 1166:1370, ack 5005, win 3411, options [nop,nop,TS val 13037782 ecr 13037777], length 204
    [54.85.204.196] [stdout] 02:34:31.436938 IP (tos 0x0, ttl 64, id 44126, offset 0, flags [DF], proto TCP (6), length 172)
    [54.85.204.196] [stdout]     localhost.ndmp > localhost.37576: Flags [P.], cksum 0xfea0 (incorrect -> 0x0e55), seq 5005:5125, ack 1370, win 400, options [nop,nop,TS val 13037782 ecr 13037782], length 120
    [54.85.204.196] [stdout] 02:34:31.442860 IP (tos 0x0, ttl 64, id 16074, offset 0, flags [DF], proto TCP (6), length 260)
    [54.85.204.196] [stdout]     localhost.37576 > localhost.ndmp: Flags [P.], cksum 0xfef8 (incorrect -> 0xa6f5), seq 1370:1578, ack 5125, win 3411, options [nop,nop,TS val 13037788 ecr 13037782], length 208
    [54.85.204.196] [stdout] 02:34:31.443058 IP (tos 0x0, ttl 64, id 44127, offset 0, flags [DF], proto TCP (6), length 173)
    [54.85.204.196] [stdout]     localhost.ndmp > localhost.37576: Flags [P.], cksum 0xfea1 (incorrect -> 0xdbf2), seq 5125:5246, ack 1578, win 409, options [nop,nop,TS val 13037788 ecr 13037788], length 121
    [54.85.204.196] [stdout] 02:34:31.447785 IP (tos 0x0, ttl 64, id 16075, offset 0, flags [DF], proto TCP (6), length 251)
    [54.85.204.196] [stdout]     localhost.37576 > localhost.ndmp: Flags [P.], cksum 0xfeef (incorrect -> 0xec23), seq 1578:1777, ack 5246, win 3411, options [nop,nop,TS val 13037793 ecr 13037788], length 199
    [54.85.204.196] [stdout] 02:34:31.447864 IP (tos 0x0, ttl 64, id 44128, offset 0, flags [DF], proto TCP (6), length 173)
    [54.85.204.196] [stdout]     localhost.ndmp > localhost.37576: Flags [P.], cksum 0xfea1 (incorrect -> 0xae78), seq 5246:5367, ack 1777, win 417, options [nop,nop,TS val 13037793 ecr 13037793], length 121
    [54.85.204.196] [stdout] 02:34:31.450109 IP (tos 0x0, ttl 64, id 16076, offset 0, flags [DF], proto TCP (6), length 263)
    [54.85.204.196] [stdout]     localhost.37576 > localhost.ndmp: Flags [P.], cksum 0xfefb (incorrect -> 0xf6ef), seq 1777:1988, ack 5367, win 3411, options [nop,nop,TS val 13037795 ecr 13037793], length 211
    [54.85.204.196] [stdout] 02:34:31.450288 IP (tos 0x0, ttl 64, id 44129, offset 0, flags [DF], proto TCP (6), length 182)
    [54.85.204.196] [stdout]     localhost.ndmp > localhost.37576: Flags [P.], cksum 0xfeaa (incorrect -> 0x2f05), seq 5367:5497, ack 1988, win 426, options [nop,nop,TS val 13037795 ecr 13037795], length 130
    [54.85.204.196] [stdout] 02:34:31.454836 IP (tos 0x0, ttl 64, id 16077, offset 0, flags [DF], proto TCP (6), length 274)
    [54.85.204.196] [stdout]     localhost.37576 > localhost.ndmp: Flags [P.], cksum 0xff06 (incorrect -> 0x9c38), seq 1988:2210, ack 5497, win 3411, options [nop,nop,TS val 13037800 ecr 13037795], length 222
    [54.85.204.196] [stdout] 02:34:31.455121 IP (tos 0x0, ttl 64, id 44130, offset 0, flags [DF], proto TCP (6), length 179)
    [54.85.204.196] [stdout]     localhost.ndmp > localhost.37576: Flags [P.], cksum 0xfea7 (incorrect -> 0x3736), seq 5497:5624, ack 2210, win 434, options [nop,nop,TS val 13037800 ecr 13037800], length 127
    [54.85.204.196] [stdout] 02:34:31.458493 IP (tos 0x0, ttl 64, id 16078, offset 0, flags [DF], proto TCP (6), length 275)
    [54.85.204.196] [stdout]     localhost.37576 > localhost.ndmp: Flags [P.], cksum 0xff07 (incorrect -> 0x5b8a), seq 2210:2433, ack 5624, win 3411, options [nop,nop,TS val 13037803 ecr 13037800], length 223
    [54.85.204.196] [stdout] 02:34:31.458691 IP (tos 0x0, ttl 64, id 44131, offset 0, flags [DF], proto TCP (6), length 178)
    [54.85.204.196] [stdout]     localhost.ndmp > localhost.37576: Flags [P.], cksum 0xfea6 (incorrect -> 0x6bc3), seq 5624:5750, ack 2433, win 442, options [nop,nop,TS val 13037803 ecr 13037803], length 126
    [54.85.204.196] [stdout] 02:34:31.463149 IP (tos 0x0, ttl 64, id 16079, offset 0, flags [DF], proto TCP (6), length 282)
    [54.85.204.196] [stdout]     localhost.37576 > localhost.ndmp: Flags [P.], cksum 0xff0e (incorrect -> 0x1395), seq 2433:2663, ack 5750, win 3411, options [nop,nop,TS val 13037808 ecr 13037803], length 230
    [54.85.204.196] [stdout] 02:34:31.463220 IP (tos 0x0, ttl 64, id 44132, offset 0, flags [DF], proto TCP (6), length 172)
    [54.85.204.196] [stdout]     localhost.ndmp > localhost.37576: Flags [P.], cksum 0xfea0 (incorrect -> 0x05f8), seq 5750:5870, ack 2663, win 451, options [nop,nop,TS val 13037808 ecr 13037808], length 120
    [54.85.204.196] [stdout] 02:34:31.465566 IP (tos 0x0, ttl 64, id 16080, offset 0, flags [DF], proto TCP (6), length 261)
    [54.85.204.196] [stdout]     localhost.37576 > localhost.ndmp: Flags [P.], cksum 0xfef9 (incorrect -> 0x4fcc), seq 2663:2872, ack 5870, win 3411, options [nop,nop,TS val 13037810 ecr 13037808], length 209
    [54.85.204.196] [stdout] 02:34:31.465792 IP (tos 0x0, ttl 64, id 44133, offset 0, flags [DF], proto TCP (6), length 182)
    [54.85.204.196] [stdout]     localhost.ndmp > localhost.37576: Flags [P.], cksum 0xfeaa (incorrect -> 0x3c65), seq 5870:6000, ack 2872, win 459, options [nop,nop,TS val 13037811 ecr 13037810], length 130
    [54.85.204.196] [stdout] 02:34:31.470509 IP (tos 0x0, ttl 64, id 16081, offset 0, flags [DF], proto TCP (6), length 262)
    [54.85.204.196] [stdout]     localhost.37576 > localhost.ndmp: Flags [P.], cksum 0xfefa (incorrect -> 0x301a), seq 2872:3082, ack 6000, win 3411, options [nop,nop,TS val 13037815 ecr 13037811], length 210
    [54.85.204.196] [stdout] 02:34:31.470745 IP (tos 0x0, ttl 64, id 44134, offset 0, flags [DF], proto TCP (6), length 182)
    [54.85.204.196] [stdout]     localhost.ndmp > localhost.37576: Flags [P.], cksum 0xfeaa (incorrect -> 0x3aff), seq 6000:6130, ack 3082, win 467, options [nop,nop,TS val 13037816 ecr 13037815], length 130
    [54.85.204.196] [stdout] 02:34:31.475516 IP (tos 0x0, ttl 64, id 16082, offset 0, flags [DF], proto TCP (6), length 255)
    [54.85.204.196] [stdout]     localhost.37576 > localhost.ndmp: Flags [P.], cksum 0xfef3 (incorrect -> 0x742c), seq 3082:3285, ack 6130, win 3411, options [nop,nop,TS val 13037820 ecr 13037816], length 203
    [54.85.204.196] [stdout] 02:34:31.475670 IP (tos 0x0, ttl 64, id 44135, offset 0, flags [DF], proto TCP (6), length 172)
    [54.85.204.196] [stdout]     localhost.ndmp > localhost.37576: Flags [P.], cksum 0xfea0 (incorrect -> 0x01dd), seq 6130:6250, ack 3285, win 476, options [nop,nop,TS val 13037820 ecr 13037820], length 120
    [54.85.204.196] [stdout] 02:34:31.478184 IP (tos 0x0, ttl 64, id 16083, offset 0, flags [DF], proto TCP (6), length 258)
    [54.85.204.196] [stdout]     localhost.37576 > localhost.ndmp: Flags [P.], cksum 0xfef6 (incorrect -> 0xf528), seq 3285:3491, ack 6250, win 3411, options [nop,nop,TS val 13037823 ecr 13037820], length 206
    [54.85.204.196] [stdout] 02:34:31.485819 IP (tos 0x0, ttl 64, id 44136, offset 0, flags [DF], proto TCP (6), length 172)
    [54.85.204.196] [stdout]     localhost.ndmp > localhost.37576: Flags [P.], cksum 0xfea0 (incorrect -> 0x0081), seq 6250:6370, ack 3491, win 484, options [nop,nop,TS val 13037831 ecr 13037823], length 120
    [54.85.204.196] [stdout] 02:34:31.489047 IP (tos 0x0, ttl 64, id 16084, offset 0, flags [DF], proto TCP (6), length 260)
    [54.85.204.196] [stdout]     localhost.37576 > localhost.ndmp: Flags [P.], cksum 0xfef8 (incorrect -> 0x9658), seq 3491:3699, ack 6370, win 3411, options [nop,nop,TS val 13037834 ecr 13037831], length 208
    [54.85.204.196] [stdout] 02:34:31.494162 IP (tos 0x0, ttl 64, id 44137, offset 0, flags [DF], proto TCP (6), length 178)
    [54.85.204.196] [stdout]     localhost.ndmp > localhost.37576: Flags [P.], cksum 0xfea6 (incorrect -> 0x5b60), seq 6370:6496, ack 3699, win 493, options [nop,nop,TS val 13037839 ecr 13037834], length 126
    [54.85.204.196] [stdout] 02:34:31.496711 IP (tos 0x0, ttl 64, id 16085, offset 0, flags [DF], proto TCP (6), length 263)
    [54.85.204.196] [stdout]     localhost.37576 > localhost.ndmp: Flags [P.], cksum 0xfefb (incorrect -> 0xbaa1), seq 3699:3910, ack 6496, win 3411, options [nop,nop,TS val 13037841 ecr 13037839], length 211
    [54.85.204.196] [stdout] 02:34:31.496907 IP (tos 0x0, ttl 64, id 44138, offset 0, flags [DF], proto TCP (6), length 178)
    [54.85.204.196] [stdout]     localhost.ndmp > localhost.37576: Flags [P.], cksum 0xfea6 (incorrect -> 0x5f0b), seq 6496:6622, ack 3910, win 501, options [nop,nop,TS val 13037842 ecr 13037841], length 126
    [54.85.204.196] [stdout] 02:34:31.501581 IP (tos 0x0, ttl 64, id 16086, offset 0, flags [DF], proto TCP (6), length 264)
    [54.85.204.196] [stdout]     localhost.37576 > localhost.ndmp: Flags [P.], cksum 0xfefc (incorrect -> 0xaf17), seq 3910:4122, ack 6622, win 3411, options [nop,nop,TS val 13037846 ecr 13037842], length 212
    [54.85.204.196] [stdout] 02:34:31.501792 IP (tos 0x0, ttl 64, id 44139, offset 0, flags [DF], proto TCP (6), length 182)
    [54.85.204.196] [stdout]     localhost.ndmp > localhost.37576: Flags [P.], cksum 0xfeaa (incorrect -> 0x3214), seq 6622:6752, ack 4122, win 509, options [nop,nop,TS val 13037847 ecr 13037846], length 130
    [54.85.204.196] [stdout] 02:34:31.506580 IP (tos 0x0, ttl 64, id 16087, offset 0, flags [DF], proto TCP (6), length 262)
    [54.85.204.196] [stdout]     localhost.37576 > localhost.ndmp: Flags [P.], cksum 0xfefa (incorrect -> 0x22ee), seq 4122:4332, ack 6752, win 3411, options [nop,nop,TS val 13037851 ecr 13037847], length 210
    [54.85.204.196] [stdout] 02:34:31.506780 IP (tos 0x0, ttl 64, id 44140, offset 0, flags [DF], proto TCP (6), length 172)
    [54.85.204.196] [stdout]     localhost.ndmp > localhost.37576: Flags [P.], cksum 0xfea0 (incorrect -> 0xfaee), seq 6752:6872, ack 4332, win 518, options [nop,nop,TS val 13037852 ecr 13037851], length 120
    [54.85.204.196] [stdout] 02:34:31.515337 IP (tos 0x0, ttl 64, id 16088, offset 0, flags [DF], proto TCP (6), length 256)
    [54.85.204.196] [stdout]     localhost.37576 > localhost.ndmp: Flags [P.], cksum 0xfef4 (incorrect -> 0x63de), seq 4332:4536, ack 6872, win 3411, options [nop,nop,TS val 13037860 ecr 13037852], length 204
    [54.85.204.196] [stdout] 02:34:31.515579 IP (tos 0x0, ttl 64, id 44141, offset 0, flags [DF], proto TCP (6), length 172)
    [54.85.204.196] [stdout]     localhost.ndmp > localhost.37576: Flags [P.], cksum 0xfea0 (incorrect -> 0xf991), seq 6872:6992, ack 4536, win 526, options [nop,nop,TS val 13037860 ecr 13037860], length 120
    [54.85.204.196] [stdout] 02:34:31.520354 IP (tos 0x0, ttl 64, id 16089, offset 0, flags [DF], proto TCP (6), length 269)
    [54.85.204.196] [stdout]     localhost.37576 > localhost.ndmp: Flags [P.], cksum 0xff01 (incorrect -> 0x4f1f), seq 4536:4753, ack 6992, win 3411, options [nop,nop,TS val 13037865 ecr 13037860], length 217
    [54.85.204.196] [stdout] 02:34:31.520572 IP (tos 0x0, ttl 64, id 44142, offset 0, flags [DF], proto TCP (6), length 172)
    [54.85.204.196] [stdout]     localhost.ndmp > localhost.37576: Flags [P.], cksum 0xfea0 (incorrect -> 0xf82e), seq 6992:7112, ack 4753, win 534, options [nop,nop,TS val 13037865 ecr 13037865], length 120
    [54.85.204.196] [stdout] 02:34:31.525271 IP (tos 0x0, ttl 64, id 16090, offset 0, flags [DF], proto TCP (6), length 272)
    [54.85.204.196] [stdout]     localhost.37576 > localhost.ndmp: Flags [P.], cksum 0xff04 (incorrect -> 0x28cc), seq 4753:4973, ack 7112, win 3411, options [nop,nop,TS val 13037870 ecr 13037865], length 220
    [54.85.204.196] [stdout] 02:34:31.525483 IP (tos 0x0, ttl 64, id 44143, offset 0, flags [DF], proto TCP (6), length 172)
    [54.85.204.196] [stdout]     localhost.ndmp > localhost.37576: Flags [P.], cksum 0xfea0 (incorrect -> 0xf6c7), seq 7112:7232, ack 4973, win 543, options [nop,nop,TS val 13037870 ecr 13037870], length 120
    [54.85.204.196] [stdout] 02:34:31.530190 IP (tos 0x0, ttl 64, id 16091, offset 0, flags [DF], proto TCP (6), length 269)
    [54.85.204.196] [stdout]     localhost.37576 > localhost.ndmp: Flags [P.], cksum 0xff01 (incorrect -> 0x8458), seq 4973:5190, ack 7232, win 3411, options [nop,nop,TS val 13037875 ecr 13037870], length 217
    [54.85.204.196] [stdout] 02:34:31.530420 IP (tos 0x0, ttl 64, id 44144, offset 0, flags [DF], proto TCP (6), length 172)
    [54.85.204.196] [stdout]     localhost.ndmp > localhost.37576: Flags [P.], cksum 0xfea0 (incorrect -> 0xf564), seq 7232:7352, ack 5190, win 551, options [nop,nop,TS val 13037875 ecr 13037875], length 120
    [54.85.204.196] [stdout] 02:34:31.535075 IP (tos 0x0, ttl 64, id 16092, offset 0, flags [DF], proto TCP (6), length 253)
    [54.85.204.196] [stdout]     localhost.37576 > localhost.ndmp: Flags [P.], cksum 0xfef1 (incorrect -> 0xea1a), seq 5190:5391, ack 7352, win 3411, options [nop,nop,TS val 13037880 ecr 13037875], length 201
    [54.85.204.196] [stdout] 02:34:31.535298 IP (tos 0x0, ttl 64, id 44145, offset 0, flags [DF], proto TCP (6), length 174)
    [54.85.204.196] [stdout]     localhost.ndmp > localhost.37576: Flags [P.], cksum 0xfea2 (incorrect -> 0xbed1), seq 7352:7474, ack 5391, win 560, options [nop,nop,TS val 13037880 ecr 13037880], length 122
    [54.85.204.196] [stdout] 02:34:31.539906 IP (tos 0x0, ttl 64, id 16093, offset 0, flags [DF], proto TCP (6), length 253)
    [54.85.204.196] [stdout]     localhost.37576 > localhost.ndmp: Flags [P.], cksum 0xfef1 (incorrect -> 0xf0c3), seq 5391:5592, ack 7474, win 3411, options [nop,nop,TS val 13037885 ecr 13037880], length 201
    [54.85.204.196] [stdout] 02:34:31.540110 IP (tos 0x0, ttl 64, id 44146, offset 0, flags [DF], proto TCP (6), length 174)
    [54.85.204.196] [stdout]     localhost.ndmp > localhost.37576: Flags [P.], cksum 0xfea2 (incorrect -> 0xc184), seq 7474:7596, ack 5592, win 568, options [nop,nop,TS val 13037885 ecr 13037885], length 122
    [54.85.204.196] [stdout] 02:34:31.545113 IP (tos 0x0, ttl 64, id 16094, offset 0, flags [DF], proto TCP (6), length 254)
    [54.85.204.196] [stdout]     localhost.37576 > localhost.ndmp: Flags [P.], cksum 0xfef2 (incorrect -> 0x8d7c), seq 5592:5794, ack 7596, win 3411, options [nop,nop,TS val 13037890 ecr 13037885], length 202
    [54.85.204.196] [stdout] 02:34:31.545328 IP (tos 0x0, ttl 64, id 44147, offset 0, flags [DF], proto TCP (6), length 182)
    [54.85.204.196] [stdout]     localhost.ndmp > localhost.37576: Flags [P.], cksum 0xfeaa (incorrect -> 0x3633), seq 7596:7726, ack 5794, win 576, options [nop,nop,TS val 13037890 ecr 13037890], length 130
    [54.85.204.196] [stdout] 02:34:31.551126 IP (tos 0x0, ttl 64, id 16095, offset 0, flags [DF], proto TCP (6), length 263)
    [54.85.204.196] [stdout]     localhost.37576 > localhost.ndmp: Flags [P.], cksum 0xfefb (incorrect -> 0xab53), seq 5794:6005, ack 7726, win 3411, options [nop,nop,TS val 13037896 ecr 13037890], length 211
    [54.85.204.196] [stdout] 02:34:31.551387 IP (tos 0x0, ttl 64, id 44148, offset 0, flags [DF], proto TCP (6), length 240)
    [54.85.204.196] [stdout]     localhost.ndmp > localhost.37576: Flags [P.], cksum 0xfee4 (incorrect -> 0x103e), seq 7726:7914, ack 6005, win 585, options [nop,nop,TS val 13037896 ecr 13037896], length 188
    [54.85.204.196] [stdout] 02:34:31.556675 IP (tos 0x0, ttl 64, id 16096, offset 0, flags [DF], proto TCP (6), length 268)
    [54.85.204.196] [stdout]     localhost.37576 > localhost.ndmp: Flags [P.], cksum 0xff00 (incorrect -> 0xe44c), seq 6005:6221, ack 7914, win 3411, options [nop,nop,TS val 13037901 ecr 13037896], length 216
    [54.85.204.196] [stdout] 02:34:31.556907 IP (tos 0x0, ttl 64, id 44149, offset 0, flags [DF], proto TCP (6), length 240)
    [54.85.204.196] [stdout]     localhost.ndmp > localhost.37576: Flags [P.], cksum 0xfee4 (incorrect -> 0x0e97), seq 7914:8102, ack 6221, win 593, options [nop,nop,TS val 13037902 ecr 13037901], length 188
    [54.85.204.196] [stdout] 02:34:31.598737 IP (tos 0x0, ttl 64, id 16097, offset 0, flags [DF], proto TCP (6), length 52)
    [54.85.204.196] [stdout]     localhost.37576 > localhost.ndmp: Flags [.], cksum 0xfe28 (incorrect -> 0x0930), seq 6221, ack 8102, win 3411, options [nop,nop,TS val 13037944 ecr 13037902], length 0
    [54.85.204.196] [stdout] 02:34:41.365481 IP (tos 0x0, ttl 64, id 16098, offset 0, flags [DF], proto TCP (6), length 52)
    [54.85.204.196] [stdout]     localhost.37576 > localhost.ndmp: Flags [F.], cksum 0xfe28 (incorrect -> 0xe308), seq 6221, ack 8102, win 3411, options [nop,nop,TS val 13047710 ecr 13037902], length 0
    [54.85.204.196] [stdout] 02:34:41.365543 IP (tos 0x0, ttl 64, id 44150, offset 0, flags [DF], proto TCP (6), length 52)
    [54.85.204.196] [stdout]     localhost.ndmp > localhost.37576: Flags [F.], cksum 0xfe28 (incorrect -> 0xc7b9), seq 8102, ack 6222, win 593, options [nop,nop,TS val 13047710 ecr 13047710], length 0
    [54.85.204.196] [stdout] 02:34:41.365552 IP (tos 0x0, ttl 64, id 16099, offset 0, flags [DF], proto TCP (6), length 52)
    [54.85.204.196] [stdout]     localhost.37576 > localhost.ndmp: Flags [.], cksum 0xfe28 (incorrect -> 0xbcb7), seq 6222, ack 8103, win 3411, options [nop,nop,TS val 13047710 ecr 13047710], length 0
    [54.85.204.196] [stdout] 02:35:32.952324 IP (tos 0x0, ttl 64, id 34916, offset 0, flags [DF], proto TCP (6), length 60)
    [54.85.204.196] [stdout]     localhost.37579 > localhost.ndmp: Flags [S], cksum 0xfe30 (incorrect -> 0xc69f), seq 3649399109, win 43690, options [mss 65495,sackOK,TS val 13099297 ecr 0,nop,wscale 7], length 0
    [54.85.204.196] [stdout] 04:04:12.729985 IP (tos 0x0, ttl 64, id 0, offset 0, flags [DF], proto TCP (6), length 60)
    [54.85.204.196] [stdout]     localhost.ndmp > localhost.37579: Flags [S.], cksum 0xfe30 (incorrect -> 0x9ab2), seq 1617422731, ack 3649399110, win 43690, options [mss 65495,sackOK,TS val 13099297 ecr 13099297,nop,wscale 7], length 0
    [54.85.204.196] [stdout] 02:35:32.952346 IP (tos 0x0, ttl 64, id 34917, offset 0, flags [DF], proto TCP (6), length 52)
    [54.85.204.196] [stdout]     localhost.37579 > localhost.ndmp: Flags [.], cksum 0xfe28 (incorrect -> 0x6cf7), seq 1, ack 1, win 342, options [nop,nop,TS val 13099297 ecr 13099297], length 0
    [54.85.204.196] [stdout] 02:35:32.952441 IP (tos 0x0, ttl 64, id 34918, offset 0, flags [DF], proto TCP (6), length 213)
    [54.85.204.196] [stdout]     localhost.37579 > localhost.ndmp: Flags [P.], cksum 0xfec9 (incorrect -> 0xdedd), seq 1:162, ack 1, win 342, options [nop,nop,TS val 13099297 ecr 13099297], length 161
    [54.85.204.196] [stdout] 02:35:32.952448 IP (tos 0x0, ttl 64, id 2221, offset 0, flags [DF], proto TCP (6), length 52)
    [54.85.204.196] [stdout]     localhost.ndmp > localhost.37579: Flags [.], cksum 0xfe28 (incorrect -> 0x6c4e), seq 1, ack 162, win 350, options [nop,nop,TS val 13099297 ecr 13099297], length 0
    [54.85.204.196] [stdout] 02:35:32.952624 IP (tos 0x0, ttl 64, id 2222, offset 0, flags [DF], proto TCP (6), length 1353)
    [54.85.204.196] [stdout]     localhost.ndmp > localhost.37579: Flags [P.], cksum 0x033e (incorrect -> 0x50fc), seq 1:1302, ack 162, win 350, options [nop,nop,TS val 13099297 ecr 13099297], length 1301
    [54.85.204.196] [stdout] 02:35:32.952648 IP (tos 0x0, ttl 64, id 34919, offset 0, flags [DF], proto TCP (6), length 52)
    [54.85.204.196] [stdout]     localhost.37579 > localhost.ndmp: Flags [.], cksum 0xfe28 (incorrect -> 0x6342), seq 162, ack 1302, win 1365, options [nop,nop,TS val 13099297 ecr 13099297], length 0
    [54.85.204.196] [stdout] 02:35:32.968704 IP (tos 0x0, ttl 64, id 34920, offset 0, flags [DF], proto TCP (6), length 213)
    [54.85.204.196] [stdout]     localhost.37579 > localhost.ndmp: Flags [P.], cksum 0xfec9 (incorrect -> 0xd518), seq 162:323, ack 1302, win 1365, options [nop,nop,TS val 13099313 ecr 13099297], length 161
    [54.85.204.196] [stdout] 02:35:32.968852 IP (tos 0x0, ttl 64, id 2223, offset 0, flags [DF], proto TCP (6), length 1353)
    [54.85.204.196] [stdout]     localhost.ndmp > localhost.37579: Flags [P.], cksum 0x033e (incorrect -> 0x4b1c), seq 1302:2603, ack 323, win 359, options [nop,nop,TS val 13099314 ecr 13099313], length 1301
    [54.85.204.196] [stdout] 02:35:33.004333 IP (tos 0x0, ttl 64, id 34921, offset 0, flags [DF], proto TCP (6), length 240)
    [54.85.204.196] [stdout]     localhost.37579 > localhost.ndmp: Flags [P.], cksum 0xfee4 (incorrect -> 0x5456), seq 323:511, ack 2603, win 2388, options [nop,nop,TS val 13099349 ecr 13099314], length 188
    [54.85.204.196] [stdout] 02:35:33.004422 IP (tos 0x0, ttl 64, id 2224, offset 0, flags [DF], proto TCP (6), length 194)
    [54.85.204.196] [stdout]     localhost.ndmp > localhost.37579: Flags [P.], cksum 0xfeb6 (incorrect -> 0x8e7a), seq 2603:2745, ack 511, win 367, options [nop,nop,TS val 13099349 ecr 13099349], length 142
    [54.85.204.196] [stdout] 02:35:33.012051 IP (tos 0x0, ttl 64, id 34922, offset 0, flags [DF], proto TCP (6), length 279)
    [54.85.204.196] [stdout]     localhost.37579 > localhost.ndmp: Flags [P.], cksum 0xff0b (incorrect -> 0xfef0), seq 511:738, ack 2745, win 2388, options [nop,nop,TS val 13099357 ecr 13099349], length 227
    [54.85.204.196] [stdout] 02:35:33.012561 IP (tos 0x0, ttl 64, id 2225, offset 0, flags [DF], proto TCP (6), length 1926)
    [54.85.204.196] [stdout]     localhost.ndmp > localhost.37579: Flags [P.], cksum 0x057b (incorrect -> 0xf00d), seq 2745:4619, ack 738, win 375, options [nop,nop,TS val 13099357 ecr 13099357], length 1874
    [54.85.204.196] [stdout] 02:35:33.018255 IP (tos 0x0, ttl 64, id 34923, offset 0, flags [DF], proto TCP (6), length 278)
    [54.85.204.196] [stdout]     localhost.37579 > localhost.ndmp: Flags [P.], cksum 0xff0a (incorrect -> 0xdc55), seq 738:964, ack 4619, win 3411, options [nop,nop,TS val 13099363 ecr 13099357], length 226
    [54.85.204.196] [stdout] 02:35:33.018494 IP (tos 0x0, ttl 64, id 2226, offset 0, flags [DF], proto TCP (6), length 308)
    [54.85.204.196] [stdout]     localhost.ndmp > localhost.37579: Flags [P.], cksum 0xff28 (incorrect -> 0x5fb1), seq 4619:4875, ack 964, win 384, options [nop,nop,TS val 13099363 ecr 13099363], length 256
    [54.85.204.196] [stdout] 02:35:33.023902 IP (tos 0x0, ttl 64, id 34924, offset 0, flags [DF], proto TCP (6), length 254)
    [54.85.204.196] [stdout]     localhost.37579 > localhost.ndmp: Flags [P.], cksum 0xfef2 (incorrect -> 0x03f7), seq 964:1166, ack 4875, win 3411, options [nop,nop,TS val 13099369 ecr 13099363], length 202
    [54.85.204.196] [stdout] 02:35:33.024129 IP (tos 0x0, ttl 64, id 2227, offset 0, flags [DF], proto TCP (6), length 182)
    [54.85.204.196] [stdout]     localhost.ndmp > localhost.37579: Flags [P.], cksum 0xfeaa (incorrect -> 0x5d85), seq 4875:5005, ack 1166, win 392, options [nop,nop,TS val 13099369 ecr 13099369], length 130
    [54.85.204.196] [stdout] 02:35:33.028763 IP (tos 0x0, ttl 64, id 34925, offset 0, flags [DF], proto TCP (6), length 256)
    [54.85.204.196] [stdout]     localhost.37579 > localhost.ndmp: Flags [P.], cksum 0xfef4 (incorrect -> 0x9645), seq 1166:1370, ack 5005, win 3411, options [nop,nop,TS val 13099374 ecr 13099369], length 204
    [54.85.204.196] [stdout] 02:35:33.028977 IP (tos 0x0, ttl 64, id 2228, offset 0, flags [DF], proto TCP (6), length 172)
    [54.85.204.196] [stdout]     localhost.ndmp > localhost.37579: Flags [P.], cksum 0xfea0 (incorrect -> 0x2b78), seq 5005:5125, ack 1370, win 400, options [nop,nop,TS val 13099374 ecr 13099374], length 120
    [54.85.204.196] [stdout] 02:35:33.035129 IP (tos 0x0, ttl 64, id 34926, offset 0, flags [DF], proto TCP (6), length 260)
    [54.85.204.196] [stdout]     localhost.37579 > localhost.ndmp: Flags [P.], cksum 0xfef8 (incorrect -> 0xc51a), seq 1370:1578, ack 5125, win 3411, options [nop,nop,TS val 13099380 ecr 13099374], length 208
    [54.85.204.196] [stdout] 02:35:33.035335 IP (tos 0x0, ttl 64, id 2229, offset 0, flags [DF], proto TCP (6), length 173)
    [54.85.204.196] [stdout]     localhost.ndmp > localhost.37579: Flags [P.], cksum 0xfea1 (incorrect -> 0xf915), seq 5125:5246, ack 1578, win 409, options [nop,nop,TS val 13099380 ecr 13099380], length 121
    [54.85.204.196] [stdout] 02:35:33.040367 IP (tos 0x0, ttl 64, id 34927, offset 0, flags [DF], proto TCP (6), length 251)
    [54.85.204.196] [stdout]     localhost.37579 > localhost.ndmp: Flags [P.], cksum 0xfeef (incorrect -> 0x0a49), seq 1578:1777, ack 5246, win 3411, options [nop,nop,TS val 13099385 ecr 13099380], length 199
    [54.85.204.196] [stdout] 02:35:33.040447 IP (tos 0x0, ttl 64, id 2230, offset 0, flags [DF], proto TCP (6), length 173)
    [54.85.204.196] [stdout]     localhost.ndmp > localhost.37579: Flags [P.], cksum 0xfea1 (incorrect -> 0xcb9b), seq 5246:5367, ack 1777, win 417, options [nop,nop,TS val 13099385 ecr 13099385], length 121
    [54.85.204.196] [stdout] 02:35:33.042770 IP (tos 0x0, ttl 64, id 34928, offset 0, flags [DF], proto TCP (6), length 263)
    [54.85.204.196] [stdout]     localhost.37579 > localhost.ndmp: Flags [P.], cksum 0xfefb (incorrect -> 0x1514), seq 1777:1988, ack 5367, win 3411, options [nop,nop,TS val 13099388 ecr 13099385], length 211
    [54.85.204.196] [stdout] 02:35:33.042957 IP (tos 0x0, ttl 64, id 2231, offset 0, flags [DF], proto TCP (6), length 182)
    [54.85.204.196] [stdout]     localhost.ndmp > localhost.37579: Flags [P.], cksum 0xfeaa (incorrect -> 0x4b27), seq 5367:5497, ack 1988, win 426, options [nop,nop,TS val 13099388 ecr 13099388], length 130
    [54.85.204.196] [stdout] 02:35:33.047509 IP (tos 0x0, ttl 64, id 34929, offset 0, flags [DF], proto TCP (6), length 274)
    [54.85.204.196] [stdout]     localhost.37579 > localhost.ndmp: Flags [P.], cksum 0xff06 (incorrect -> 0xba5c), seq 1988:2210, ack 5497, win 3411, options [nop,nop,TS val 13099392 ecr 13099388], length 222
    [54.85.204.196] [stdout] 02:35:33.047732 IP (tos 0x0, ttl 64, id 2232, offset 0, flags [DF], proto TCP (6), length 179)
    [54.85.204.196] [stdout]     localhost.ndmp > localhost.37579: Flags [P.], cksum 0xfea7 (incorrect -> 0x5458), seq 5497:5624, ack 2210, win 434, options [nop,nop,TS val 13099393 ecr 13099392], length 127
    [54.85.204.196] [stdout] 02:35:33.052287 IP (tos 0x0, ttl 64, id 34930, offset 0, flags [DF], proto TCP (6), length 275)
    [54.85.204.196] [stdout]     localhost.37579 > localhost.ndmp: Flags [P.], cksum 0xff07 (incorrect -> 0x79ac), seq 2210:2433, ack 5624, win 3411, options [nop,nop,TS val 13099397 ecr 13099393], length 223
    [54.85.204.196] [stdout] 02:35:33.052490 IP (tos 0x0, ttl 64, id 2233, offset 0, flags [DF], proto TCP (6), length 178)
    [54.85.204.196] [stdout]     localhost.ndmp > localhost.37579: Flags [P.], cksum 0xfea6 (incorrect -> 0x88e2), seq 5624:5750, ack 2433, win 442, options [nop,nop,TS val 13099397 ecr 13099397], length 126
    [54.85.204.196] [stdout] 02:35:33.057161 IP (tos 0x0, ttl 64, id 34931, offset 0, flags [DF], proto TCP (6), length 282)
    [54.85.204.196] [stdout]     localhost.37579 > localhost.ndmp: Flags [P.], cksum 0xff0e (incorrect -> 0x31b6), seq 2433:2663, ack 5750, win 3411, options [nop,nop,TS val 13099402 ecr 13099397], length 230
    [54.85.204.196] [stdout] 02:35:33.057234 IP (tos 0x0, ttl 64, id 2234, offset 0, flags [DF], proto TCP (6), length 172)
    [54.85.204.196] [stdout]     localhost.ndmp > localhost.37579: Flags [P.], cksum 0xfea0 (incorrect -> 0x2317), seq 5750:5870, ack 2663, win 451, options [nop,nop,TS val 13099402 ecr 13099402], length 120
    [54.85.204.196] [stdout] 02:35:33.059579 IP (tos 0x0, ttl 64, id 34932, offset 0, flags [DF], proto TCP (6), length 261)
    [54.85.204.196] [stdout]     localhost.37579 > localhost.ndmp: Flags [P.], cksum 0xfef9 (incorrect -> 0x6ded), seq 2663:2872, ack 5870, win 3411, options [nop,nop,TS val 13099404 ecr 13099402], length 209
    [54.85.204.196] [stdout] 02:35:33.059806 IP (tos 0x0, ttl 64, id 2235, offset 0, flags [DF], proto TCP (6), length 182)
    [54.85.204.196] [stdout]     localhost.ndmp > localhost.37579: Flags [P.], cksum 0xfeaa (incorrect -> 0x5885), seq 5870:6000, ack 2872, win 459, options [nop,nop,TS val 13099405 ecr 13099404], length 130
    [54.85.204.196] [stdout] 02:35:33.064526 IP (tos 0x0, ttl 64, id 34933, offset 0, flags [DF], proto TCP (6), length 262)
    [54.85.204.196] [stdout]     localhost.37579 > localhost.ndmp: Flags [P.], cksum 0xfefa (incorrect -> 0x4e3b), seq 2872:3082, ack 6000, win 3411, options [nop,nop,TS val 13099409 ecr 13099405], length 210
    [54.85.204.196] [stdout] 02:35:33.064768 IP (tos 0x0, ttl 64, id 2236, offset 0, flags [DF], proto TCP (6), length 182)
    [54.85.204.196] [stdout]     localhost.ndmp > localhost.37579: Flags [P.], cksum 0xfeaa (incorrect -> 0x571f), seq 6000:6130, ack 3082, win 467, options [nop,nop,TS val 13099410 ecr 13099409], length 130
    [54.85.204.196] [stdout] 02:35:33.069335 IP (tos 0x0, ttl 64, id 34934, offset 0, flags [DF], proto TCP (6), length 255)
    [54.85.204.196] [stdout]     localhost.37579 > localhost.ndmp: Flags [P.], cksum 0xfef3 (incorrect -> 0x924d), seq 3082:3285, ack 6130, win 3411, options [nop,nop,TS val 13099414 ecr 13099410], length 203
    [54.85.204.196] [stdout] 02:35:33.069442 IP (tos 0x0, ttl 64, id 2237, offset 0, flags [DF], proto TCP (6), length 172)
    [54.85.204.196] [stdout]     localhost.ndmp > localhost.37579: Flags [P.], cksum 0xfea0 (incorrect -> 0x1efc), seq 6130:6250, ack 3285, win 476, options [nop,nop,TS val 13099414 ecr 13099414], length 120
    [54.85.204.196] [stdout] 02:35:33.071925 IP (tos 0x0, ttl 64, id 34935, offset 0, flags [DF], proto TCP (6), length 258)
    [54.85.204.196] [stdout]     localhost.37579 > localhost.ndmp: Flags [P.], cksum 0xfef6 (incorrect -> 0x134a), seq 3285:3491, ack 6250, win 3411, options [nop,nop,TS val 13099417 ecr 13099414], length 206
    [54.85.204.196] [stdout] 02:35:33.072126 IP (tos 0x0, ttl 64, id 2238, offset 0, flags [DF], proto TCP (6), length 172)
    [54.85.204.196] [stdout]     localhost.ndmp > localhost.37579: Flags [P.], cksum 0xfea0 (incorrect -> 0x1da8), seq 6250:6370, ack 3491, win 484, options [nop,nop,TS val 13099417 ecr 13099417], length 120
    [54.85.204.196] [stdout] 02:35:33.077305 IP (tos 0x0, ttl 64, id 34936, offset 0, flags [DF], proto TCP (6), length 260)
    [54.85.204.196] [stdout]     localhost.37579 > localhost.ndmp: Flags [P.], cksum 0xfef8 (incorrect -> 0xb487), seq 3491:3699, ack 6370, win 3411, options [nop,nop,TS val 13099422 ecr 13099417], length 208
    [54.85.204.196] [stdout] 02:35:33.077513 IP (tos 0x0, ttl 64, id 2239, offset 0, flags [DF], proto TCP (6), length 178)
    [54.85.204.196] [stdout]     localhost.ndmp > localhost.37579: Flags [P.], cksum 0xfea6 (incorrect -> 0x7890), seq 6370:6496, ack 3699, win 493, options [nop,nop,TS val 13099422 ecr 13099422], length 126
    [54.85.204.196] [stdout] 02:35:33.082179 IP (tos 0x0, ttl 64, id 34937, offset 0, flags [DF], proto TCP (6), length 263)
    [54.85.204.196] [stdout]     localhost.37579 > localhost.ndmp: Flags [P.], cksum 0xfefb (incorrect -> 0xd8d5), seq 3699:3910, ack 6496, win 3411, options [nop,nop,TS val 13099427 ecr 13099422], length 211
    [54.85.204.196] [stdout] 02:35:33.082401 IP (tos 0x0, ttl 64, id 2240, offset 0, flags [DF], proto TCP (6), length 178)
    [54.85.204.196] [stdout]     localhost.ndmp > localhost.37579: Flags [P.], cksum 0xfea6 (incorrect -> 0x7c3b), seq 6496:6622, ack 3910, win 501, options [nop,nop,TS val 13099427 ecr 13099427], length 126
    [54.85.204.196] [stdout] 02:35:33.086906 IP (tos 0x0, ttl 64, id 34938, offset 0, flags [DF], proto TCP (6), length 264)
    [54.85.204.196] [stdout]     localhost.37579 > localhost.ndmp: Flags [P.], cksum 0xfefc (incorrect -> 0xcd49), seq 3910:4122, ack 6622, win 3411, options [nop,nop,TS val 13099432 ecr 13099427], length 212
    [54.85.204.196] [stdout] 02:35:33.087099 IP (tos 0x0, ttl 64, id 2241, offset 0, flags [DF], proto TCP (6), length 182)
    [54.85.204.196] [stdout]     localhost.ndmp > localhost.37579: Flags [P.], cksum 0xfeaa (incorrect -> 0x4e45), seq 6622:6752, ack 4122, win 509, options [nop,nop,TS val 13099432 ecr 13099432], length 130
    [54.85.204.196] [stdout] 02:35:33.091873 IP (tos 0x0, ttl 64, id 34939, offset 0, flags [DF], proto TCP (6), length 262)
    [54.85.204.196] [stdout]     localhost.37579 > localhost.ndmp: Flags [P.], cksum 0xfefa (incorrect -> 0x4120), seq 4122:4332, ack 6752, win 3411, options [nop,nop,TS val 13099437 ecr 13099432], length 210
    [54.85.204.196] [stdout] 02:35:33.092070 IP (tos 0x0, ttl 64, id 2242, offset 0, flags [DF], proto TCP (6), length 172)
    [54.85.204.196] [stdout]     localhost.ndmp > localhost.37579: Flags [P.], cksum 0xfea0 (incorrect -> 0x181f), seq 6752:6872, ack 4332, win 518, options [nop,nop,TS val 13099437 ecr 13099437], length 120
    [54.85.204.196] [stdout] 02:35:33.100284 IP (tos 0x0, ttl 64, id 34940, offset 0, flags [DF], proto TCP (6), length 256)
    [54.85.204.196] [stdout]     localhost.37579 > localhost.ndmp: Flags [P.], cksum 0xfef4 (incorrect -> 0x8211), seq 4332:4536, ack 6872, win 3411, options [nop,nop,TS val 13099445 ecr 13099437], length 204
    [54.85.204.196] [stdout] 02:35:33.109800 IP (tos 0x0, ttl 64, id 2243, offset 0, flags [DF], proto TCP (6), length 172)
    [54.85.204.196] [stdout]     localhost.ndmp > localhost.37579: Flags [P.], cksum 0xfea0 (incorrect -> 0x16b9), seq 6872:6992, ack 4536, win 526, options [nop,nop,TS val 13099455 ecr 13099445], length 120
    [54.85.204.196] [stdout] 02:35:33.112329 IP (tos 0x0, ttl 64, id 34941, offset 0, flags [DF], proto TCP (6), length 269)
    [54.85.204.196] [stdout]     localhost.37579 > localhost.ndmp: Flags [P.], cksum 0xff01 (incorrect -> 0x6d41), seq 4536:4753, ack 6992, win 3411, options [nop,nop,TS val 13099457 ecr 13099455], length 217
    [54.85.204.196] [stdout] 02:35:33.112526 IP (tos 0x0, ttl 64, id 2244, offset 0, flags [DF], proto TCP (6), length 172)
    [54.85.204.196] [stdout]     localhost.ndmp > localhost.37579: Flags [P.], cksum 0xfea0 (incorrect -> 0x1552), seq 6992:7112, ack 4753, win 534, options [nop,nop,TS val 13099457 ecr 13099457], length 120
    [54.85.204.196] [stdout] 02:35:33.116946 IP (tos 0x0, ttl 64, id 34942, offset 0, flags [DF], proto TCP (6), length 272)
    [54.85.204.196] [stdout]     localhost.37579 > localhost.ndmp: Flags [P.], cksum 0xff04 (incorrect -> 0x46f1), seq 4753:4973, ack 7112, win 3411, options [nop,nop,TS val 13099462 ecr 13099457], length 220
    [54.85.204.196] [stdout] 02:35:33.117157 IP (tos 0x0, ttl 64, id 2245, offset 0, flags [DF], proto TCP (6), length 172)
    [54.85.204.196] [stdout]     localhost.ndmp > localhost.37579: Flags [P.], cksum 0xfea0 (incorrect -> 0x13eb), seq 7112:7232, ack 4973, win 543, options [nop,nop,TS val 13099462 ecr 13099462], length 120
    [54.85.204.196] [stdout] 02:35:33.121847 IP (tos 0x0, ttl 64, id 34943, offset 0, flags [DF], proto TCP (6), length 269)
    [54.85.204.196] [stdout]     localhost.37579 > localhost.ndmp: Flags [P.], cksum 0xff01 (incorrect -> 0xa27d), seq 4973:5190, ack 7232, win 3411, options [nop,nop,TS val 13099467 ecr 13099462], length 217
    [54.85.204.196] [stdout] 02:35:33.122055 IP (tos 0x0, ttl 64, id 2246, offset 0, flags [DF], proto TCP (6), length 172)
    [54.85.204.196] [stdout]     localhost.ndmp > localhost.37579: Flags [P.], cksum 0xfea0 (incorrect -> 0x1288), seq 7232:7352, ack 5190, win 551, options [nop,nop,TS val 13099467 ecr 13099467], length 120
    [54.85.204.196] [stdout] 02:35:33.126569 IP (tos 0x0, ttl 64, id 34944, offset 0, flags [DF], proto TCP (6), length 253)
    [54.85.204.196] [stdout]     localhost.37579 > localhost.ndmp: Flags [P.], cksum 0xfef1 (incorrect -> 0x0841), seq 5190:5391, ack 7352, win 3411, options [nop,nop,TS val 13099471 ecr 13099467], length 201
    [54.85.204.196] [stdout] 02:35:33.126771 IP (tos 0x0, ttl 64, id 2247, offset 0, flags [DF], proto TCP (6), length 174)
    [54.85.204.196] [stdout]     localhost.ndmp > localhost.37579: Flags [P.], cksum 0xfea2 (incorrect -> 0xdbf5), seq 7352:7474, ack 5391, win 560, options [nop,nop,TS val 13099472 ecr 13099471], length 122
    [54.85.204.196] [stdout] 02:35:33.131329 IP (tos 0x0, ttl 64, id 34945, offset 0, flags [DF], proto TCP (6), length 253)
    [54.85.204.196] [stdout]     localhost.37579 > localhost.ndmp: Flags [P.], cksum 0xfef1 (incorrect -> 0x0eea), seq 5391:5592, ack 7474, win 3411, options [nop,nop,TS val 13099476 ecr 13099472], length 201
    [54.85.204.196] [stdout] 02:35:33.131520 IP (tos 0x0, ttl 64, id 2248, offset 0, flags [DF], proto TCP (6), length 174)
    [54.85.204.196] [stdout]     localhost.ndmp > localhost.37579: Flags [P.], cksum 0xfea2 (incorrect -> 0xdea9), seq 7474:7596, ack 5592, win 568, options [nop,nop,TS val 13099476 ecr 13099476], length 122
    [54.85.204.196] [stdout] 02:35:33.136373 IP (tos 0x0, ttl 64, id 34946, offset 0, flags [DF], proto TCP (6), length 254)
    [54.85.204.196] [stdout]     localhost.37579 > localhost.ndmp: Flags [P.], cksum 0xfef2 (incorrect -> 0xaba3), seq 5592:5794, ack 7596, win 3411, options [nop,nop,TS val 13099481 ecr 13099476], length 202
    [54.85.204.196] [stdout] 02:35:33.136588 IP (tos 0x0, ttl 64, id 2249, offset 0, flags [DF], proto TCP (6), length 182)
    [54.85.204.196] [stdout]     localhost.ndmp > localhost.37579: Flags [P.], cksum 0xfeaa (incorrect -> 0x5259), seq 7596:7726, ack 5794, win 576, options [nop,nop,TS val 13099481 ecr 13099481], length 130
    [54.85.204.196] [stdout] 02:35:33.142504 IP (tos 0x0, ttl 64, id 34947, offset 0, flags [DF], proto TCP (6), length 263)
    [54.85.204.196] [stdout]     localhost.37579 > localhost.ndmp: Flags [P.], cksum 0xfefb (incorrect -> 0xc97a), seq 5794:6005, ack 7726, win 3411, options [nop,nop,TS val 13099487 ecr 13099481], length 211
    [54.85.204.196] [stdout] 02:35:33.142760 IP (tos 0x0, ttl 64, id 2250, offset 0, flags [DF], proto TCP (6), length 240)
    [54.85.204.196] [stdout]     localhost.ndmp > localhost.37579: Flags [P.], cksum 0xfee4 (incorrect -> 0x2c63), seq 7726:7914, ack 6005, win 585, options [nop,nop,TS val 13099488 ecr 13099487], length 188
    [54.85.204.196] [stdout] 02:35:33.147924 IP (tos 0x0, ttl 64, id 34948, offset 0, flags [DF], proto TCP (6), length 268)
    [54.85.204.196] [stdout]     localhost.37579 > localhost.ndmp: Flags [P.], cksum 0xff00 (incorrect -> 0x0272), seq 6005:6221, ack 7914, win 3411, options [nop,nop,TS val 13099493 ecr 13099488], length 216
    [54.85.204.196] [stdout] 02:35:33.148156 IP (tos 0x0, ttl 64, id 2251, offset 0, flags [DF], proto TCP (6), length 240)
    [54.85.204.196] [stdout]     localhost.ndmp > localhost.37579: Flags [P.], cksum 0xfee4 (incorrect -> 0x2abc), seq 7914:8102, ack 6221, win 593, options [nop,nop,TS val 13099493 ecr 13099493], length 188
    [54.85.204.196] [stdout] 02:35:33.189769 IP (tos 0x0, ttl 64, id 34949, offset 0, flags [DF], proto TCP (6), length 52)
    [54.85.204.196] [stdout]     localhost.37579 > localhost.ndmp: Flags [.], cksum 0xfe28 (incorrect -> 0x2757), seq 6221, ack 8102, win 3411, options [nop,nop,TS val 13099535 ecr 13099493], length 0
    [54.85.204.196] [stdout]

**Comment by avikivity** [comment]
Where's the .pcap file?

**Comment by amnonh** [comment]
The error you are getting seems like a problem between the API and the JMX.

So it's a bug on either side.
I would have loved to see what the API call for:
http://localhost:10000/column_family/metrics/read_latency/moving_average_
histogram/keyspace1:standard1
returns.

If you can reproduce it, please do and send the result

**Comment by lmr** [comment]
@avikivity and @amnonh:

1) The good news is, as far as I can see the problem is 100% reproducible. Yay.
2) The failure happens after a while, and 'nodetool cfstats keyspace1' works fine until a certain point in the longevity test, failing only later down the road.
3) I instrumented the test suite to generate a .pcap file for when the problem happened, and sent it to your e-mails. I selected the .pcap generated when we get the failure.

**Comment by lmr** [comment]
I figured out I could've zipped the file and github would let me attach it here.

[tcpdump-17415f55-9f46-47eb-9e4c-912b0946c80c.pcap.zip](https://github.com/scylladb/scylla/files/298987/tcpdump-17415f55-9f46-47eb-9e4c-912b0946c80c.pcap.zip)

**Comment by penberg** [comment]
@lmr @avikivity @amnonh Sounds likely that the stats overflow and produce NaN or Inf that gets propagated to the JMX proxy through the API.

**Comment by amnonh** [comment]
It could be something like that or something weird with the double format.
that's why I hope to get the results for the actual API call:

http://localhost:10000/column_family/metrics/read_latency/moving_average_
histogram/keyspace1:standard1

**Comment by amnonh** [comment]
Thanks to lucas help I think I found it, compiling a patch now.

**Comment by lmr** [comment]
Apparently the reply that is breaking the api is

    {"hist": {"count": 0, "min": 0, "max": 0, "sum": 0, "variance": 0, "mean": 0}, "meter": {"count": 0, "mean_rate": 1.38579e-309, "rates": [0,0,0]}}

The 10^-309 here being the super suspicious value (this should've been probably 0).

**Comment by slivne** [comment]
fixed
