### ISSUE TITLE
Node-to-node SSL misleading message

### ISSUE THREAD

**Issue by bobymicroby** [scylladb/scylla#1845]
*Installation details*
Scylla version (or git commit hash): 1.4.1-20161107.5ef3211
Cluster size: 3
OS (RHEL/CentOS/Ubuntu/AWS AMI): CentOS
Platform (physical/VM/cloud instance type/docker):VM

scylla.yaml

``` 
server_encryption_options:
    internode_encryption: all
    certificate: /etc/ssl/scylla/scylladb.pem
    keyfile: /etc/ssl/scylla/scylladb-key.pem
    truststore: /etc/ssl/scylla/scylladb-ca.pem
```
 
/etc/ssl/scylla

```
[root@badge-scylladb-1 scylla]# ls -al
total 20
drwxr-xr-x  2 scylla scylla 4096 Nov 15 10:19 .
drwxr-xr-x. 4 root   root   4096 Nov 15 11:33 ..
-rw-r--r--  1 scylla scylla 1159 Nov 15 10:18 scylladb-ca.pem
-rw-------  1 scylla scylla  227 Nov 15 10:19 scylladb-key.pem
-rw-r--r--  1 scylla scylla  952 Nov 15 10:19 scylladb.pem

```

What we got in the logs is :
```
 Starting Messaging Service on port 7000
```

but according to the guide we should receive this:

``` 
Starting Encrypted Messaging Service on SSL port 7001
```

Anyway, checking the socket shows that it is TLS enabled

``` 
openssl s_client -connect 10.10.10.1:7001 


SSL handshake has read 1052 bytes and written 441 bytes
---
New, TLSv1/SSLv3, Cipher is ECDHE-ECDSA-AES256-GCM-SHA384
Server public key is 256 bit
Secure Renegotiation IS supported
Compression: NONE
Expansion: NONE
SSL-Session:
    Protocol  : TLSv1.2
    Cipher    : ECDHE-ECDSA-AES256-GCM-SHA384
```

I am personally strongly against having ports 7000 and 7001 both opened.  In case encryption is enabled we should open only 7001 and in case isn't - only 7000. This way it will be more easy to check if encryption is enabled/disabled and limits the attack surface by not exposing the not encrypted port.

Good thing is that there is no chatter on 7000

``` 
tcpdump -i eth1 'port 7000'
tcpdump: verbose output suppressed, use -v or -vv for full protocol decode
listening on eth1, link-type EN10MB (Ethernet), capture size 65535 bytes
```

and all node chatter goes trough TLS

```
tcpdump -i eth1 'port 7001'
tcpdump: verbose output suppressed, use -v or -vv for full protocol decode
listening on eth1, link-type EN10MB (Ethernet), capture size 65535 bytes
15:40:43.262936 IP 10.135.36.62.34594 > 10.135.39.46.afs3-callback: Flags [P.], seq 2146249407:2146249583, ack 4260431713, win 243, options [nop,nop,TS val 18913846 ecr 18910454], length 176
15:40:43.263572 IP 10.135.39.46.afs3-callback > 10.135.36.62.34594: Flags [.], ack 176, win 1424, options [nop,nop,TS val 18913459 ecr 18913846], length 0
15:40:43.263802 IP 10.135.39.46.55615 > 10.135.36.62.afs3-callback: Flags [P.], seq 588440345:588440478, ack 2020634550, win 243, options [nop,nop,TS val 18913459 ecr 18910841], length 133

```

**Comment by tzach** [comment]
@slivne I see this commit in 1.7 (not 1.8). is it the case?

**Comment by penberg** [comment]
@tzach The commit in master and also backported to 1.7.
