### ISSUE TITLE
cassandra-stress: it takes a very long time to start sending cql requests with jmx server started

### ISSUE THREAD

**Issue by asias** [scylladb/scylla#378]
### c-s can not connect to JMX and it takes a long time to fail

```
INFO  23:40:54 Using data-center name 'datacenter1' for DCAwareRoundRobinPolicy (if this is incorrect, please provide the correct datacenter name with DCAwareRoundRobinPolicy constructor)
INFO  23:40:54 New Cassandra host /172.31.42.123:9042 added
INFO  23:40:54 New Cassandra host /172.31.42.122:9042 added
Connected to cluster: two
Datatacenter: datacenter1; Host: /172.31.42.123; Rack: rack1
Datatacenter: datacenter1; Host: /172.31.42.122; Rack: rack1
WARN  23:41:04 No schema agreement from live replicas after 10 s. The schema may not be up to date on some nodes.
WARN  23:41:14 No schema agreement from live replicas after 10 s. The schema may not be up to date on some nodes.
Created keyspaces. Sleeping 1s for propagation.
Sleeping 2s...
Running WRITE with 10 threads for 1000 iteration
Failed to connect over JMX; not collecting these stats        -----> It takes long to to fail JMX
type,      total ops,    op/s,    pk/s,   row/s,    mean,     med,     .95,     .99,    .999,     max,   time,   stderr, errors,  gc: #,  max ms,  sum ms,  sdv ms,      mb
total,          1000,    6521,    6521,    6521,     1.0,     0.6,     1.4,    12.4,    15.0,    15.0,    0.2,  0.00000,      0,      0,       0,       0,       0,       0

```
### commits used

[fedora@ip-172-31-42-122 ~]$ rpm -qa|grep scylla
scylla-server-debuginfo-0.8-20150920.1a4c8db.fc22.x86_64
scylla-server-0.8-20150920.1a4c8db.fc22.x86_64
scylla-tools-0.8-20150920.cb4cbcb.fc22.noarch
scylla-jmx-0.8-20150920.197c8c7.fc22.noarch
### to see tcp dump

sudo tshark -i eth0 -f "tcp and port 7199" | tee 7199.log

```

  1   0.000000 172.31.34.168 -> 172.31.42.123 TCP 74 44070→7199 [SYN] Seq=0 Win=26883 Len=0 MSS=8961 SACK_PERM=1 TSval=2879304 TSecr=0 WS=128
  2   0.000201 172.31.42.123 -> 172.31.34.168 TCP 74 7199→44070 [SYN, ACK] Seq=0 Ack=1 Win=26847 Len=0 MSS=8961 SACK_PERM=1 TSval=2929107 TSecr=2879304 WS=128
  3   0.000223 172.31.34.168 -> 172.31.42.123 TCP 66 44070→7199 [ACK] Seq=1 Ack=1 Win=27008 Len=0 TSval=2879304 TSecr=2929107
  4   0.001373 172.31.34.168 -> 172.31.42.123 TCP 73 44070→7199 [PSH, ACK] Seq=1 Ack=1 Win=27008 Len=7 TSval=2879305 TSecr=2929107
  5   0.001536 172.31.42.123 -> 172.31.34.168 TCP 66 7199→44070 [ACK] Seq=1 Ack=8 Win=26880 Len=0 TSval=2929109 TSecr=2879305
  6   0.001583 172.31.42.123 -> 172.31.34.168 TCP 86 7199→44070 [PSH, ACK] Seq=1 Ack=8 Win=26880 Len=20 TSval=2929109 TSecr=2879305
  7   0.001593 172.31.34.168 -> 172.31.42.123 TCP 66 44070→7199 [ACK] Seq=8 Ack=21 Win=27008 Len=0 TSval=2879306 TSecr=2929109
  8   0.002857 172.31.34.168 -> 172.31.42.123 TCP 85 44070→7199 [PSH, ACK] Seq=8 Ack=21 Win=27008 Len=19 TSval=2879307 TSecr=2929109
  9   0.012632 172.31.34.168 -> 172.31.42.123 TCP 116 44070→7199 [PSH, ACK] Seq=27 Ack=21 Win=27008 Len=50 TSval=2879317 TSecr=2929109
 10   0.012779 172.31.42.123 -> 172.31.34.168 TCP 66 7199→44070 [ACK] Seq=21 Ack=77 Win=26880 Len=0 TSval=2929120 TSecr=2879307
 11   0.013088 172.31.42.123 -> 172.31.34.168 TCP 295 7199→44070 [PSH, ACK] Seq=21 Ack=77 Win=26880 Len=229 TSval=2929120 TSecr=2879307
 12   0.052628 172.31.34.168 -> 172.31.42.123 TCP 66 44070→7199 [ACK] Seq=77 Ack=250 Win=28032 Len=0 TSval=2879357 TSecr=2929120
 13  15.025862 172.31.34.168 -> 172.31.42.123 TCP 66 44070→7199 [FIN, ACK] Seq=77 Ack=250 Win=28032 Len=0 TSval=2894330 TSecr=2929120
 14  15.026167 172.31.42.123 -> 172.31.34.168 TCP 66 7199→44070 [FIN, ACK] Seq=250 Ack=78 Win=26880 Len=0 TSval=2944133 TSecr=2894330
 15  15.026226 172.31.34.168 -> 172.31.42.123 TCP 66 44070→7199 [ACK] Seq=78 Ack=251 Win=28032 Len=0 TSval=2894330 TSecr=2944133
 16 127.297410 172.31.34.168 -> 172.31.42.123 TCP 74 44073→7199 [SYN] Seq=0 Win=26883 Len=0 MSS=8961 SACK_PERM=1 TSval=3006601 TSecr=0 WS=128
 17 127.297610 172.31.42.123 -> 172.31.34.168 TCP 74 7199→44073 [SYN, ACK] Seq=0 Ack=1 Win=26847 Len=0 MSS=8961 SACK_PERM=1 TSval=3056400 TSecr=3006601 WS=128
 18 127.297635 172.31.34.168 -> 172.31.42.123 TCP 66 44073→7199 [ACK] Seq=1 Ack=1 Win=27008 Len=0 TSval=3006602 TSecr=3056400
 19 127.297780 172.31.34.168 -> 172.31.42.123 TCP 73 44073→7199 [PSH, ACK] Seq=1 Ack=1 Win=27008 Len=7 TSval=3006602 TSecr=3056400
 20 127.297920 172.31.42.123 -> 172.31.34.168 TCP 66 7199→44073 [ACK] Seq=1 Ack=8 Win=26880 Len=0 TSval=3056400 TSecr=3006602
 21 127.298403 172.31.42.123 -> 172.31.34.168 TCP 86 7199→44073 [PSH, ACK] Seq=1 Ack=8 Win=26880 Len=20 TSval=3056401 TSecr=3006602
 22 127.298430 172.31.34.168 -> 172.31.42.123 TCP 66 44073→7199 [ACK] Seq=8 Ack=21 Win=27008 Len=0 TSval=3006602 TSecr=3056401
 23 127.298661 172.31.34.168 -> 172.31.42.123 TCP 85 44073→7199 [PSH, ACK] Seq=8 Ack=21 Win=27008 Len=19 TSval=3006603 TSecr=3056401
 24 127.298763 172.31.34.168 -> 172.31.42.123 TCP 81 44073→7199 [PSH, ACK] Seq=27 Ack=21 Win=27008 Len=15 TSval=3006603 TSecr=3056401
 25 127.298894 172.31.42.123 -> 172.31.34.168 TCP 66 7199→44073 [ACK] Seq=21 Ack=42 Win=26880 Len=0 TSval=3056401 TSecr=3006603
 26 142.300500 172.31.34.168 -> 172.31.42.123 TCP 66 44073→7199 [FIN, ACK] Seq=42 Ack=21 Win=27008 Len=0 TSval=3021604 TSecr=3056401
 27 142.300840 172.31.42.123 -> 172.31.34.168 TCP 66 7199→44073 [FIN, ACK] Seq=21 Ack=43 Win=26880 Len=0 TSval=3071403 TSecr=3021604
 28 142.300888 172.31.34.168 -> 172.31.42.123 TCP 66 44073→7199 [ACK] Seq=43 Ack=22 Win=27008 Len=0 TSval=3021605 TSecr=3071403
 29 268.832613 172.31.34.168 -> 172.31.42.123 TCP 74 44215→7199 [SYN] Seq=0 Win=26883 Len=0 MSS=8961 SACK_PERM=1 TSval=3148137 TSecr=0 WS=128
 30 268.832807 172.31.42.123 -> 172.31.34.168 TCP 74 7199→44215 [SYN, ACK] Seq=0 Ack=1 Win=26847 Len=0 MSS=8961 SACK_PERM=1 TSval=3197930 TSecr=3148137 WS=128
 31 268.832839 172.31.34.168 -> 172.31.42.123 TCP 66 44215→7199 [ACK] Seq=1 Ack=1 Win=27008 Len=0 TSval=3148137 TSecr=3197930
 32 268.833868 172.31.34.168 -> 172.31.42.123 TCP 73 44215→7199 [PSH, ACK] Seq=1 Ack=1 Win=27008 Len=7 TSval=3148138 TSecr=3197930
 33 268.834034 172.31.42.123 -> 172.31.34.168 TCP 66 7199→44215 [ACK] Seq=1 Ack=8 Win=26880 Len=0 TSval=3197931 TSecr=3148138
 34 268.834113 172.31.42.123 -> 172.31.34.168 TCP 86 7199→44215 [PSH, ACK] Seq=1 Ack=8 Win=26880 Len=20 TSval=3197931 TSecr=3148138
 35 268.834126 172.31.34.168 -> 172.31.42.123 TCP 66 44215→7199 [ACK] Seq=8 Ack=21 Win=27008 Len=0 TSval=3148138 TSecr=3197931
 36 268.835386 172.31.34.168 -> 172.31.42.123 TCP 85 44215→7199 [PSH, ACK] Seq=8 Ack=21 Win=27008 Len=19 TSval=3148139 TSecr=3197931
 37 268.837790 172.31.34.168 -> 172.31.42.123 TCP 74 44216→7199 [SYN] Seq=0 Win=26883 Len=0 MSS=8961 SACK_PERM=1 TSval=3148142 TSecr=0 WS=128
 38 268.837927 172.31.42.123 -> 172.31.34.168 TCP 74 7199→44216 [SYN, ACK] Seq=0 Ack=1 Win=26847 Len=0 MSS=8961 SACK_PERM=1 TSval=3197935 TSecr=3148142 WS=128
 39 268.837959 172.31.34.168 -> 172.31.42.123 TCP 66 44216→7199 [ACK] Seq=1 Ack=1 Win=27008 Len=0 TSval=3148142 TSecr=3197935
 40 268.839013 172.31.34.168 -> 172.31.42.123 TCP 73 44216→7199 [PSH, ACK] Seq=1 Ack=1 Win=27008 Len=7 TSval=3148143 TSecr=3197935
 41 268.839165 172.31.42.123 -> 172.31.34.168 TCP 66 7199→44216 [ACK] Seq=1 Ack=8 Win=26880 Len=0 TSval=3197937 TSecr=3148143
 42 268.839196 172.31.42.123 -> 172.31.34.168 TCP 86 7199→44216 [PSH, ACK] Seq=1 Ack=8 Win=26880 Len=20 TSval=3197937 TSecr=3148143
 43 268.839206 172.31.34.168 -> 172.31.42.123 TCP 66 44216→7199 [ACK] Seq=8 Ack=21 Win=27008 Len=0 TSval=3148143 TSecr=3197937
 44 268.840624 172.31.34.168 -> 172.31.42.123 TCP 85 44216→7199 [PSH, ACK] Seq=8 Ack=21 Win=27008 Len=19 TSval=3148145 TSecr=3197937
 45 268.847291 172.31.34.168 -> 172.31.42.123 TCP 116 44215→7199 [PSH, ACK] Seq=27 Ack=21 Win=27008 Len=50 TSval=3148151 TSecr=3197931
 46 268.847449 172.31.42.123 -> 172.31.34.168 TCP 66 7199→44215 [ACK] Seq=21 Ack=77 Win=26880 Len=0 TSval=3197945 TSecr=3148139
 47 268.847791 172.31.42.123 -> 172.31.34.168 TCP 295 7199→44215 [PSH, ACK] Seq=21 Ack=77 Win=26880 Len=229 TSval=3197945 TSecr=3148139
 48 268.849841 172.31.34.168 -> 172.31.42.123 TCP 116 44216→7199 [PSH, ACK] Seq=27 Ack=21 Win=27008 Len=50 TSval=3148154 TSecr=3197937
 49 268.849997 172.31.42.123 -> 172.31.34.168 TCP 66 7199→44216 [ACK] Seq=21 Ack=77 Win=26880 Len=0 TSval=3197947 TSecr=3148145
 50 268.850213 172.31.42.123 -> 172.31.34.168 TCP 295 7199→44216 [PSH, ACK] Seq=21 Ack=77 Win=26880 Len=229 TSval=3197948 TSecr=3148145
 51 268.850247 172.31.34.168 -> 172.31.42.123 TCP 74 44217→7199 [SYN] Seq=0 Win=26883 Len=0 MSS=8961 SACK_PERM=1 TSval=3148154 TSecr=0 WS=128
 52 268.850400 172.31.42.123 -> 172.31.34.168 TCP 74 7199→44217 [SYN, ACK] Seq=0 Ack=1 Win=26847 Len=0 MSS=8961 SACK_PERM=1 TSval=3197948 TSecr=3148154 WS=128
 53 268.850420 172.31.34.168 -> 172.31.42.123 TCP 66 44217→7199 [ACK] Seq=1 Ack=1 Win=27008 Len=0 TSval=3148154 TSecr=3197948
 54 268.851182 172.31.34.168 -> 172.31.42.123 TCP 73 44217→7199 [PSH, ACK] Seq=1 Ack=1 Win=27008 Len=7 TSval=3148155 TSecr=3197948
 55 268.851320 172.31.42.123 -> 172.31.34.168 TCP 66 7199→44217 [ACK] Seq=1 Ack=8 Win=26880 Len=0 TSval=3197949 TSecr=3148155
 56 268.851355 172.31.42.123 -> 172.31.34.168 TCP 86 7199→44217 [PSH, ACK] Seq=1 Ack=8 Win=26880 Len=20 TSval=3197949 TSecr=3148155
 57 268.851365 172.31.34.168 -> 172.31.42.123 TCP 66 44217→7199 [ACK] Seq=8 Ack=21 Win=27008 Len=0 TSval=3148155 TSecr=3197949
 58 268.852695 172.31.34.168 -> 172.31.42.123 TCP 85 44217→7199 [PSH, ACK] Seq=8 Ack=21 Win=27008 Len=19 TSval=3148157 TSecr=3197949
 59 268.866788 172.31.34.168 -> 172.31.42.123 TCP 116 44217→7199 [PSH, ACK] Seq=27 Ack=21 Win=27008 Len=50 TSval=3148171 TSecr=3197949
 60 268.866945 172.31.42.123 -> 172.31.34.168 TCP 66 7199→44217 [ACK] Seq=21 Ack=77 Win=26880 Len=0 TSval=3197964 TSecr=3148157
 61 268.867197 172.31.42.123 -> 172.31.34.168 TCP 295 7199→44217 [PSH, ACK] Seq=21 Ack=77 Win=26880 Len=229 TSval=3197965 TSecr=3148157
 62 268.887628 172.31.34.168 -> 172.31.42.123 TCP 66 44215→7199 [ACK] Seq=77 Ack=250 Win=28032 Len=0 TSval=3148192 TSecr=3197945
 63 268.889607 172.31.34.168 -> 172.31.42.123 TCP 66 44216→7199 [ACK] Seq=77 Ack=250 Win=28032 Len=0 TSval=3148194 TSecr=3197948
 64 268.896303 172.31.34.168 -> 172.31.42.123 TCP 74 44223→7199 [SYN] Seq=0 Win=26883 Len=0 MSS=8961 SACK_PERM=1 TSval=3148200 TSecr=0 WS=128
 65 268.896456 172.31.42.123 -> 172.31.34.168 TCP 74 7199→44223 [SYN, ACK] Seq=0 Ack=1 Win=26847 Len=0 MSS=8961 SACK_PERM=1 TSval=3197994 TSecr=3148200 WS=128
 66 268.896486 172.31.34.168 -> 172.31.42.123 TCP 66 44223→7199 [ACK] Seq=1 Ack=1 Win=27008 Len=0 TSval=3148200 TSecr=3197994
 67 268.897683 172.31.34.168 -> 172.31.42.123 TCP 73 44223→7199 [PSH, ACK] Seq=1 Ack=1 Win=27008 Len=7 TSval=3148202 TSecr=3197994
 68 268.897826 172.31.42.123 -> 172.31.34.168 TCP 66 7199→44223 [ACK] Seq=1 Ack=8 Win=26880 Len=0 TSval=3197995 TSecr=3148202
 69 268.897846 172.31.42.123 -> 172.31.34.168 TCP 86 7199→44223 [PSH, ACK] Seq=1 Ack=8 Win=26880 Len=20 TSval=3197995 TSecr=3148202
 70 268.897857 172.31.34.168 -> 172.31.42.123 TCP 66 44223→7199 [ACK] Seq=8 Ack=21 Win=27008 Len=0 TSval=3148202 TSecr=3197995
 71 268.899101 172.31.34.168 -> 172.31.42.123 TCP 85 44223→7199 [PSH, ACK] Seq=8 Ack=21 Win=27008 Len=19 TSval=3148203 TSecr=3197995
 72 268.906607 172.31.34.168 -> 172.31.42.123 TCP 66 44217→7199 [ACK] Seq=77 Ack=250 Win=28032 Len=0 TSval=3148211 TSecr=3197965
 73 268.908860 172.31.34.168 -> 172.31.42.123 TCP 116 44223→7199 [PSH, ACK] Seq=27 Ack=21 Win=27008 Len=50 TSval=3148213 TSecr=3197995
 74 268.909009 172.31.42.123 -> 172.31.34.168 TCP 66 7199→44223 [ACK] Seq=21 Ack=77 Win=26880 Len=0 TSval=3198006 TSecr=3148203
 75 268.909221 172.31.42.123 -> 172.31.34.168 TCP 295 7199→44223 [PSH, ACK] Seq=21 Ack=77 Win=26880 Len=229 TSval=3198007 TSecr=3148203
 76 268.909834 172.31.34.168 -> 172.31.42.123 TCP 74 44224→7199 [SYN] Seq=0 Win=26883 Len=0 MSS=8961 SACK_PERM=1 TSval=3148214 TSecr=0 WS=128
 77 268.909975 172.31.42.123 -> 172.31.34.168 TCP 74 7199→44224 [SYN, ACK] Seq=0 Ack=1 Win=26847 Len=0 MSS=8961 SACK_PERM=1 TSval=3198007 TSecr=3148214 WS=128
 78 268.909993 172.31.34.168 -> 172.31.42.123 TCP 66 44224→7199 [ACK] Seq=1 Ack=1 Win=27008 Len=0 TSval=3148214 TSecr=3198007
 79 268.910929 172.31.34.168 -> 172.31.42.123 TCP 73 44224→7199 [PSH, ACK] Seq=1 Ack=1 Win=27008 Len=7 TSval=3148215 TSecr=3198007
 80 268.911070 172.31.42.123 -> 172.31.34.168 TCP 66 7199→44224 [ACK] Seq=1 Ack=8 Win=26880 Len=0 TSval=3198008 TSecr=3148215
 81 268.911110 172.31.42.123 -> 172.31.34.168 TCP 86 7199→44224 [PSH, ACK] Seq=1 Ack=8 Win=26880 Len=20 TSval=3198008 TSecr=3148215
 82 268.911120 172.31.34.168 -> 172.31.42.123 TCP 66 44224→7199 [ACK] Seq=8 Ack=21 Win=27008 Len=0 TSval=3148215 TSecr=3198008
 83 268.912147 172.31.34.168 -> 172.31.42.123 TCP 85 44224→7199 [PSH, ACK] Seq=8 Ack=21 Win=27008 Len=19 TSval=3148216 TSecr=3198008
 84 268.922174 172.31.34.168 -> 172.31.42.123 TCP 116 44224→7199 [PSH, ACK] Seq=27 Ack=21 Win=27008 Len=50 TSval=3148226 TSecr=3198008
 85 268.922320 172.31.42.123 -> 172.31.34.168 TCP 66 7199→44224 [ACK] Seq=21 Ack=77 Win=26880 Len=0 TSval=3198020 TSecr=3148216
 86 268.923472 172.31.42.123 -> 172.31.34.168 TCP 295 7199→44224 [PSH, ACK] Seq=21 Ack=77 Win=26880 Len=229 TSval=3198021 TSecr=3148216
 87 268.948604 172.31.34.168 -> 172.31.42.123 TCP 66 44223→7199 [ACK] Seq=77 Ack=250 Win=28032 Len=0 TSval=3148253 TSecr=3198007
 88 268.951141 172.31.34.168 -> 172.31.42.123 TCP 74 44227→7199 [SYN] Seq=0 Win=26883 Len=0 MSS=8961 SACK_PERM=1 TSval=3148255 TSecr=0 WS=128
 89 268.951308 172.31.42.123 -> 172.31.34.168 TCP 74 7199→44227 [SYN, ACK] Seq=0 Ack=1 Win=26847 Len=0 MSS=8961 SACK_PERM=1 TSval=3198049 TSecr=3148255 WS=128
 90 268.951331 172.31.34.168 -> 172.31.42.123 TCP 66 44227→7199 [ACK] Seq=1 Ack=1 Win=27008 Len=0 TSval=3148255 TSecr=3198049
 91 268.952097 172.31.34.168 -> 172.31.42.123 TCP 73 44227→7199 [PSH, ACK] Seq=1 Ack=1 Win=27008 Len=7 TSval=3148256 TSecr=3198049
 92 268.952240 172.31.42.123 -> 172.31.34.168 TCP 66 7199→44227 [ACK] Seq=1 Ack=8 Win=26880 Len=0 TSval=3198050 TSecr=3148256
 93 268.958548 172.31.42.123 -> 172.31.34.168 TCP 86 7199→44227 [PSH, ACK] Seq=1 Ack=8 Win=26880 Len=20 TSval=3198056 TSecr=3148256
 94 268.958566 172.31.34.168 -> 172.31.42.123 TCP 66 44227→7199 [ACK] Seq=8 Ack=21 Win=27008 Len=0 TSval=3148263 TSecr=3198056
 95 268.958773 172.31.34.168 -> 172.31.42.123 TCP 85 44227→7199 [PSH, ACK] Seq=8 Ack=21 Win=27008 Len=19 TSval=3148263 TSecr=3198056
 96 268.962615 172.31.34.168 -> 172.31.42.123 TCP 66 44224→7199 [ACK] Seq=77 Ack=250 Win=28032 Len=0 TSval=3148267 TSecr=3198021
 97 268.969215 172.31.34.168 -> 172.31.42.123 TCP 116 44227→7199 [PSH, ACK] Seq=27 Ack=21 Win=27008 Len=50 TSval=3148273 TSecr=3198056
 98 268.969379 172.31.42.123 -> 172.31.34.168 TCP 66 7199→44227 [ACK] Seq=21 Ack=77 Win=26880 Len=0 TSval=3198067 TSecr=3148263
 99 268.969596 172.31.42.123 -> 172.31.34.168 TCP 295 7199→44227 [PSH, ACK] Seq=21 Ack=77 Win=26880 Len=229 TSval=3198067 TSecr=3148263
100 268.992890 172.31.34.168 -> 172.31.42.123 TCP 74 44229→7199 [SYN] Seq=0 Win=26883 Len=0 MSS=8961 SACK_PERM=1 TSval=3148297 TSecr=0 WS=128
101 268.993036 172.31.42.123 -> 172.31.34.168 TCP 74 7199→44229 [SYN, ACK] Seq=0 Ack=1 Win=26847 Len=0 MSS=8961 SACK_PERM=1 TSval=3198090 TSecr=3148297 WS=128
102 268.993057 172.31.34.168 -> 172.31.42.123 TCP 66 44229→7199 [ACK] Seq=1 Ack=1 Win=27008 Len=0 TSval=3148297 TSecr=3198090
103 268.993610 172.31.34.168 -> 172.31.42.123 TCP 73 44229→7199 [PSH, ACK] Seq=1 Ack=1 Win=27008 Len=7 TSval=3148298 TSecr=3198090
104 268.993735 172.31.42.123 -> 172.31.34.168 TCP 66 7199→44229 [ACK] Seq=1 Ack=8 Win=26880 Len=0 TSval=3198091 TSecr=3148298
105 268.993765 172.31.42.123 -> 172.31.34.168 TCP 86 7199→44229 [PSH, ACK] Seq=1 Ack=8 Win=26880 Len=20 TSval=3198091 TSecr=3148298
106 268.993773 172.31.34.168 -> 172.31.42.123 TCP 66 44229→7199 [ACK] Seq=8 Ack=21 Win=27008 Len=0 TSval=3148298 TSecr=3198091
107 268.994428 172.31.34.168 -> 172.31.42.123 TCP 85 44229→7199 [PSH, ACK] Seq=8 Ack=21 Win=27008 Len=19 TSval=3148298 TSecr=3198091
108 269.001770 172.31.34.168 -> 172.31.42.123 TCP 116 44229→7199 [PSH, ACK] Seq=27 Ack=21 Win=27008 Len=50 TSval=3148306 TSecr=3198091
109 269.001911 172.31.42.123 -> 172.31.34.168 TCP 66 7199→44229 [ACK] Seq=21 Ack=77 Win=26880 Len=0 TSval=3198099 TSecr=3148298
110 269.002222 172.31.42.123 -> 172.31.34.168 TCP 295 7199→44229 [PSH, ACK] Seq=21 Ack=77 Win=26880 Len=229 TSval=3198100 TSecr=3148298
111 269.009591 172.31.34.168 -> 172.31.42.123 TCP 66 44227→7199 [ACK] Seq=77 Ack=250 Win=28032 Len=0 TSval=3148314 TSecr=3198067
112 269.041621 172.31.34.168 -> 172.31.42.123 TCP 66 44229→7199 [ACK] Seq=77 Ack=250 Win=28032 Len=0 TSval=3148346 TSecr=3198100
113 269.072876 172.31.34.168 -> 172.31.42.123 TCP 74 44231→7199 [SYN] Seq=0 Win=26883 Len=0 MSS=8961 SACK_PERM=1 TSval=3148377 TSecr=0 WS=128
114 269.073027 172.31.42.123 -> 172.31.34.168 TCP 74 7199→44231 [SYN, ACK] Seq=0 Ack=1 Win=26847 Len=0 MSS=8961 SACK_PERM=1 TSval=3198170 TSecr=3148377 WS=128
115 269.073054 172.31.34.168 -> 172.31.42.123 TCP 66 44231→7199 [ACK] Seq=1 Ack=1 Win=27008 Len=0 TSval=3148377 TSecr=3198170
116 269.073944 172.31.34.168 -> 172.31.42.123 TCP 73 44231→7199 [PSH, ACK] Seq=1 Ack=1 Win=27008 Len=7 TSval=3148378 TSecr=3198170
117 269.074097 172.31.42.123 -> 172.31.34.168 TCP 66 7199→44231 [ACK] Seq=1 Ack=8 Win=26880 Len=0 TSval=3198171 TSecr=3148378
118 269.074131 172.31.42.123 -> 172.31.34.168 TCP 86 7199→44231 [PSH, ACK] Seq=1 Ack=8 Win=26880 Len=20 TSval=3198171 TSecr=3148378
119 269.074140 172.31.34.168 -> 172.31.42.123 TCP 66 44231→7199 [ACK] Seq=8 Ack=21 Win=27008 Len=0 TSval=3148378 TSecr=3198171
120 269.075205 172.31.34.168 -> 172.31.42.123 TCP 85 44231→7199 [PSH, ACK] Seq=8 Ack=21 Win=27008 Len=19 TSval=3148379 TSecr=3198171
121 269.086060 172.31.34.168 -> 172.31.42.123 TCP 116 44231→7199 [PSH, ACK] Seq=27 Ack=21 Win=27008 Len=5
```
### jmx cmd

/usr/bin/java -Djava.net.preferIPv4Stack=true -Dcom.sun.management.jmxremote.port=7199 -Dcom.sun.management.jmxremote.local.only=false -Dcom.sun.management.jmxremote.authenticate=false -Dcom.sun.management.jmxremote.ssl=false -jar /usr/lib/scylla/jmx/urchin-mbean-1.0.jar
