### ISSUE TITLE
Slow to connect to docker on Mac

### ISSUE THREAD

**Issue by dahankzter** [scylladb/scylla#1304]
_Installation details_
Scylla version (or git commit hash): Latest from dockerhub

Platform (physical/VM/cloud instance type/docker): docker

It seems to be just connecting. Once connected the writes seem decently fast.
No config done whatsoever. Just running the docker and connecting.

The same program on our RHEL 7 servers connects instantly.

It is not a blocker of course but during development it can be a little frustrating to have to wait ~30 seconds or so.

**Comment by avikivity** [comment]
30 seconds is huge.  Guessing it is DNS related.

Can you provide a packet capture?  Try to capture it on a server, not a workstation, so there aren't tons of HTTP sessions from your browser being tracked by advertisers.

**Comment by dahankzter** [comment]
This happens with the new Mac native docker as well. We only use the docker for local development.

It also happens with the latest Cassandra docker which leads me to believe it is either in the Gosql driver or something else outside of Scylla.

**Comment by avikivity** [comment]
A packet capture would help see what the root cause is.

**Comment by dahankzter** [comment]
I finally got around to take a dump.
It's been a while since I did this properly, hope you can make sense of it.
I can adjust any parameters to tcpdump if you want, no problem.

```bash
tcpdump -i lo0 'port 32770'
tcpdump: verbose output suppressed, use -v or -vv for full protocol decode
listening on lo0, link-type NULL (BSD loopback), capture size 262144 bytes
20:45:13.989519 IP localhost.52197 > localhost.filenet-nch: Flags [S], seq 1600807581, win 65535, options [mss 16344,nop,wscale 5,nop,nop,TS val 742393431 ecr 0,sackOK,eol], length 0
20:45:13.989587 IP localhost.filenet-nch > localhost.52197: Flags [S.], seq 2147308489, ack 1600807582, win 65535, options [mss 16344,nop,wscale 5,nop,nop,TS val 742393431 ecr 742393431,sackOK,eol], length 0
20:45:13.989597 IP localhost.52197 > localhost.filenet-nch: Flags [.], ack 1, win 12759, options [nop,nop,TS val 742393431 ecr 742393431], length 0
20:45:13.989604 IP localhost.filenet-nch > localhost.52197: Flags [.], ack 1, win 12759, options [nop,nop,TS val 742393431 ecr 742393431], length 0
20:45:13.989789 IP localhost.52197 > localhost.filenet-nch: Flags [P.], seq 1:31, ack 1, win 12759, options [nop,nop,TS val 742393431 ecr 742393431], length 30
20:45:13.989804 IP localhost.filenet-nch > localhost.52197: Flags [.], ack 31, win 12758, options [nop,nop,TS val 742393431 ecr 742393431], length 0
20:45:13.990680 IP localhost.filenet-nch > localhost.52197: Flags [P.], seq 1:9, ack 31, win 12758, options [nop,nop,TS val 742393432 ecr 742393431], length 8
20:45:13.990698 IP localhost.52197 > localhost.filenet-nch: Flags [.], ack 9, win 12759, options [nop,nop,TS val 742393432 ecr 742393432], length 0
20:45:13.990755 IP localhost.52197 > localhost.filenet-nch: Flags [P.], seq 31:88, ack 9, win 12759, options [nop,nop,TS val 742393432 ecr 742393432], length 57
20:45:13.990772 IP localhost.filenet-nch > localhost.52197: Flags [.], ack 88, win 12756, options [nop,nop,TS val 742393432 ecr 742393432], length 0
20:45:13.991025 IP localhost.filenet-nch > localhost.52197: Flags [P.], seq 9:17, ack 88, win 12756, options [nop,nop,TS val 742393432 ecr 742393432], length 8
20:45:13.991040 IP localhost.52197 > localhost.filenet-nch: Flags [.], ack 17, win 12758, options [nop,nop,TS val 742393432 ecr 742393432], length 0
20:45:13.991149 IP localhost.52198 > localhost.filenet-nch: Flags [S], seq 1139813809, win 65535, options [mss 16344,nop,wscale 5,nop,nop,TS val 742393432 ecr 0,sackOK,eol], length 0
20:45:13.991190 IP localhost.filenet-nch > localhost.52198: Flags [S.], seq 1480592925, ack 1139813810, win 65535, options [mss 16344,nop,wscale 5,nop,nop,TS val 742393432 ecr 742393432,sackOK,eol], length 0
20:45:13.991197 IP localhost.52198 > localhost.filenet-nch: Flags [.], ack 1, win 12759, options [nop,nop,TS val 742393432 ecr 742393432], length 0
20:45:13.991202 IP localhost.filenet-nch > localhost.52198: Flags [.], ack 1, win 12759, options [nop,nop,TS val 742393432 ecr 742393432], length 0
20:45:13.991255 IP localhost.52198 > localhost.filenet-nch: Flags [P.], seq 1:31, ack 1, win 12759, options [nop,nop,TS val 742393432 ecr 742393432], length 30
20:45:13.991264 IP localhost.filenet-nch > localhost.52198: Flags [.], ack 31, win 12758, options [nop,nop,TS val 742393432 ecr 742393432], length 0
20:45:13.992139 IP localhost.filenet-nch > localhost.52198: Flags [P.], seq 1:9, ack 31, win 12758, options [nop,nop,TS val 742393433 ecr 742393432], length 8
20:45:13.992150 IP localhost.52198 > localhost.filenet-nch: Flags [.], ack 9, win 12759, options [nop,nop,TS val 742393433 ecr 742393433], length 0
20:45:13.992259 IP localhost.52197 > localhost.filenet-nch: Flags [P.], seq 88:142, ack 17, win 12758, options [nop,nop,TS val 742393433 ecr 742393432], length 54
20:45:13.992275 IP localhost.filenet-nch > localhost.52197: Flags [.], ack 142, win 12754, options [nop,nop,TS val 742393433 ecr 742393433], length 0
20:45:13.992340 IP localhost.52199 > localhost.filenet-nch: Flags [SEW], seq 2931083301, win 65535, options [mss 16344,nop,wscale 5,nop,nop,TS val 742393433 ecr 0,sackOK,eol], length 0
20:45:13.992387 IP localhost.filenet-nch > localhost.52199: Flags [S.], seq 3009846739, ack 2931083302, win 65535, options [mss 16344,nop,wscale 5,nop,nop,TS val 742393433 ecr 742393433,sackOK,eol], length 0
20:45:13.992399 IP localhost.52199 > localhost.filenet-nch: Flags [.], ack 1, win 12759, options [nop,nop,TS val 742393433 ecr 742393433], length 0
20:45:13.992406 IP localhost.filenet-nch > localhost.52199: Flags [.], ack 1, win 12759, options [nop,nop,TS val 742393433 ecr 742393433], length 0
20:45:13.992459 IP localhost.52199 > localhost.filenet-nch: Flags [P.], seq 1:31, ack 1, win 12759, options [nop,nop,TS val 742393433 ecr 742393433], length 30
20:45:13.992472 IP localhost.filenet-nch > localhost.52199: Flags [.], ack 31, win 12758, options [nop,nop,TS val 742393433 ecr 742393433], length 0
20:45:13.992990 IP localhost.filenet-nch > localhost.52197: Flags [P.], seq 17:99, ack 142, win 12754, options [nop,nop,TS val 742393433 ecr 742393433], length 82
20:45:13.993003 IP localhost.52197 > localhost.filenet-nch: Flags [.], ack 99, win 12756, options [nop,nop,TS val 742393433 ecr 742393433], length 0
20:45:13.993085 IP localhost.52197 > localhost.filenet-nch: Flags [P.], seq 142:175, ack 99, win 12756, options [nop,nop,TS val 742393433 ecr 742393433], length 33
20:45:13.993096 IP localhost.filenet-nch > localhost.52197: Flags [.], ack 175, win 12753, options [nop,nop,TS val 742393433 ecr 742393433], length 0
20:45:13.993318 IP localhost.filenet-nch > localhost.52199: Flags [P.], seq 1:9, ack 31, win 12758, options [nop,nop,TS val 742393434 ecr 742393433], length 8
20:45:13.993332 IP localhost.52199 > localhost.filenet-nch: Flags [.], ack 9, win 12759, options [nop,nop,TS val 742393434 ecr 742393434], length 0
20:45:13.996843 IP localhost.filenet-nch > localhost.52197: Flags [P.], seq 99:167, ack 175, win 12753, options [nop,nop,TS val 742393437 ecr 742393433], length 68
20:45:13.996860 IP localhost.52197 > localhost.filenet-nch: Flags [.], ack 167, win 12754, options [nop,nop,TS val 742393437 ecr 742393437], length 0
20:45:13.996928 IP localhost.52197 > localhost.filenet-nch: Flags [P.], seq 175:295, ack 167, win 12754, options [nop,nop,TS val 742393437 ecr 742393437], length 120
20:45:13.996947 IP localhost.filenet-nch > localhost.52197: Flags [.], ack 295, win 12750, options [nop,nop,TS val 742393437 ecr 742393437], length 0
20:45:13.997340 IP localhost.filenet-nch > localhost.52197: Flags [P.], seq 167:419, ack 295, win 12750, options [nop,nop,TS val 742393437 ecr 742393437], length 252
20:45:13.997357 IP localhost.52197 > localhost.filenet-nch: Flags [.], ack 419, win 12746, options [nop,nop,TS val 742393437 ecr 742393437], length 0
20:45:13.997419 IP localhost.52197 > localhost.filenet-nch: Flags [P.], seq 295:328, ack 419, win 12746, options [nop,nop,TS val 742393437 ecr 742393437], length 33
20:45:13.997437 IP localhost.filenet-nch > localhost.52197: Flags [.], ack 328, win 12749, options [nop,nop,TS val 742393437 ecr 742393437], length 0
20:45:13.998553 IP localhost.filenet-nch > localhost.52197: Flags [P.], seq 419:6245, ack 328, win 12749, options [nop,nop,TS val 742393438 ecr 742393437], length 5826
20:45:13.998574 IP localhost.52197 > localhost.filenet-nch: Flags [.], ack 6245, win 12564, options [nop,nop,TS val 742393438 ecr 742393438], length 0
20:45:13.998750 IP localhost.52197 > localhost.filenet-nch: Flags [P.], seq 328:429, ack 6245, win 12564, options [nop,nop,TS val 742393438 ecr 742393438], length 101
20:45:13.998764 IP localhost.filenet-nch > localhost.52197: Flags [.], ack 429, win 12746, options [nop,nop,TS val 742393438 ecr 742393438], length 0
20:45:13.999485 IP localhost.filenet-nch > localhost.52197: Flags [P.], seq 6245:6461, ack 429, win 12746, options [nop,nop,TS val 742393438 ecr 742393438], length 216
20:45:13.999509 IP localhost.52197 > localhost.filenet-nch: Flags [.], ack 6461, win 12557, options [nop,nop,TS val 742393438 ecr 742393438], length 0
20:45:13.999543 IP localhost.52197 > localhost.filenet-nch: Flags [P.], seq 429:462, ack 6461, win 12557, options [nop,nop,TS val 742393438 ecr 742393438], length 33
20:45:13.999557 IP localhost.filenet-nch > localhost.52197: Flags [.], ack 462, win 12744, options [nop,nop,TS val 742393439 ecr 742393438], length 0
20:45:14.000721 IP localhost.filenet-nch > localhost.52197: Flags [P.], seq 6461:6655, ack 462, win 12744, options [nop,nop,TS val 742393440 ecr 742393438], length 194
20:45:14.000740 IP localhost.52197 > localhost.filenet-nch: Flags [.], ack 6655, win 12551, options [nop,nop,TS val 742393440 ecr 742393440], length 0
20:45:14.993485 IP localhost.52197 > localhost.filenet-nch: Flags [P.], seq 462:470, ack 6655, win 12551, options [nop,nop,TS val 742394431 ecr 742393440], length 8
20:45:14.993508 IP localhost.filenet-nch > localhost.52197: Flags [.], ack 470, win 12744, options [nop,nop,TS val 742394431 ecr 742394431], length 0
20:45:14.994181 IP localhost.filenet-nch > localhost.52197: Flags [P.], seq 6655:6707, ack 470, win 12744, options [nop,nop,TS val 742394431 ecr 742394431], length 52
20:45:14.994204 IP localhost.52197 > localhost.filenet-nch: Flags [.], ack 6707, win 12549, options [nop,nop,TS val 742394431 ecr 742394431], length 0
20:45:19.997458 IP localhost.52197 > localhost.filenet-nch: Flags [P.], seq 470:478, ack 6707, win 12549, options [nop,nop,TS val 742399421 ecr 742394431], length 8
20:45:19.997494 IP localhost.filenet-nch > localhost.52197: Flags [.], ack 478, win 12744, options [nop,nop,TS val 742399421 ecr 742399421], length 0
20:45:19.998018 IP localhost.filenet-nch > localhost.52197: Flags [P.], seq 6707:6759, ack 478, win 12744, options [nop,nop,TS val 742399421 ecr 742399421], length 52
20:45:19.998043 IP localhost.52197 > localhost.filenet-nch: Flags [.], ack 6759, win 12548, options [nop,nop,TS val 742399421 ecr 742399421], length 0
20:45:25.001055 IP localhost.52197 > localhost.filenet-nch: Flags [P.], seq 478:486, ack 6759, win 12548, options [nop,nop,TS val 742404417 ecr 742399421], length 8
20:45:25.001086 IP localhost.filenet-nch > localhost.52197: Flags [.], ack 486, win 12744, options [nop,nop,TS val 742404417 ecr 742404417], length 0
20:45:25.001653 IP localhost.filenet-nch > localhost.52197: Flags [P.], seq 6759:6811, ack 486, win 12744, options [nop,nop,TS val 742404417 ecr 742404417], length 52
20:45:25.001675 IP localhost.52197 > localhost.filenet-nch: Flags [.], ack 6811, win 12546, options [nop,nop,TS val 742404417 ecr 742404417], length 0
20:45:30.004827 IP localhost.52197 > localhost.filenet-nch: Flags [P.], seq 486:494, ack 6811, win 12546, options [nop,nop,TS val 742409413 ecr 742404417], length 8
20:45:30.004877 IP localhost.filenet-nch > localhost.52197: Flags [.], ack 494, win 12743, options [nop,nop,TS val 742409413 ecr 742409413], length 0
20:45:30.005484 IP localhost.filenet-nch > localhost.52197: Flags [P.], seq 6811:6863, ack 494, win 12743, options [nop,nop,TS val 742409413 ecr 742409413], length 52
20:45:30.005513 IP localhost.52197 > localhost.filenet-nch: Flags [.], ack 6863, win 12544, options [nop,nop,TS val 742409413 ecr 742409413], length 0
20:45:35.008712 IP localhost.52197 > localhost.filenet-nch: Flags [P.], seq 494:502, ack 6863, win 12544, options [nop,nop,TS val 742414352 ecr 742409413], length 8
20:45:35.008751 IP localhost.filenet-nch > localhost.52197: Flags [.], ack 502, win 12743, options [nop,nop,TS val 742414352 ecr 742414352], length 0
20:45:35.009307 IP localhost.filenet-nch > localhost.52197: Flags [P.], seq 6863:6915, ack 502, win 12743, options [nop,nop,TS val 742414352 ecr 742414352], length 52
20:45:35.009327 IP localhost.52197 > localhost.filenet-nch: Flags [.], ack 6915, win 12543, options [nop,nop,TS val 742414352 ecr 742414352], length 0
20:45:40.012542 IP localhost.52197 > localhost.filenet-nch: Flags [P.], seq 502:510, ack 6915, win 12543, options [nop,nop,TS val 742419350 ecr 742414352], length 8
20:45:40.012569 IP localhost.filenet-nch > localhost.52197: Flags [.], ack 510, win 12743, options [nop,nop,TS val 742419350 ecr 742419350], length 0
20:45:40.013134 IP localhost.filenet-nch > localhost.52197: Flags [P.], seq 6915:6967, ack 510, win 12743, options [nop,nop,TS val 742419350 ecr 742419350], length 52
20:45:40.013154 IP localhost.52197 > localhost.filenet-nch: Flags [.], ack 6967, win 12541, options [nop,nop,TS val 742419350 ecr 742419350], length 0
20:45:44.065828 IP localhost.52198 > localhost.filenet-nch: Flags [P.], seq 31:173, ack 9, win 12759, options [nop,nop,TS val 742423393 ecr 742393433], length 142
20:45:44.065856 IP localhost.filenet-nch > localhost.52198: Flags [.], ack 173, win 12754, options [nop,nop,TS val 742423393 ecr 742423393], length 0
20:45:44.075796 IP localhost.filenet-nch > localhost.52198: Flags [P.], seq 9:21, ack 173, win 12754, options [nop,nop,TS val 742423402 ecr 742423393], length 12
20:45:44.075810 IP localhost.52198 > localhost.filenet-nch: Flags [.], ack 21, win 12758, options [nop,nop,TS val 742423402 ecr 742423402], length 0
20:45:44.075876 IP localhost.52199 > localhost.filenet-nch: Flags [F.], seq 31, ack 9, win 12759, options [nop,nop,TS val 742423402 ecr 742393434], length 0
20:45:44.075893 IP localhost.52197 > localhost.filenet-nch: Flags [F.], seq 510, ack 6967, win 12541, options [nop,nop,TS val 742423402 ecr 742419350], length 0
20:45:44.075896 IP localhost.filenet-nch > localhost.52199: Flags [.], ack 32, win 12758, options [nop,nop,TS val 742423402 ecr 742423402], length 0
20:45:44.075903 IP localhost.filenet-nch > localhost.52197: Flags [.], ack 511, win 12743, options [nop,nop,TS val 742423402 ecr 742423402], length 0
20:45:44.075906 IP localhost.52199 > localhost.filenet-nch: Flags [.], ack 9, win 12759, options [nop,nop,TS val 742423402 ecr 742423402], length 0
20:45:44.075909 IP localhost.52197 > localhost.filenet-nch: Flags [.], ack 6967, win 12541, options [nop,nop,TS val 742423402 ecr 742423402], length 0
20:45:44.075940 IP localhost.52198 > localhost.filenet-nch: Flags [F.], seq 173, ack 21, win 12758, options [nop,nop,TS val 742423402 ecr 742423402], length 0
20:45:44.075958 IP localhost.filenet-nch > localhost.52198: Flags [.], ack 174, win 12754, options [nop,nop,TS val 742423402 ecr 742423402], length 0
20:45:44.075963 IP localhost.52198 > localhost.filenet-nch: Flags [.], ack 21, win 12758, options [nop,nop,TS val 742423402 ecr 742423402], length 0
20:45:44.075967 IP localhost.52224 > localhost.filenet-nch: Flags [S], seq 1780310789, win 65535, options [mss 16344,nop,wscale 5,nop,nop,TS val 742423402 ecr 0,sackOK,eol], length 0
20:45:44.076020 IP localhost.filenet-nch > localhost.52224: Flags [S.], seq 2096849032, ack 1780310790, win 65535, options [mss 16344,nop,wscale 5,nop,nop,TS val 742423402 ecr 742423402,sackOK,eol], length 0
20:45:44.076027 IP localhost.52224 > localhost.filenet-nch: Flags [.], ack 1, win 12759, options [nop,nop,TS val 742423402 ecr 742423402], length 0
20:45:44.076031 IP localhost.filenet-nch > localhost.52224: Flags [.], ack 1, win 12759, options [nop,nop,TS val 742423402 ecr 742423402], length 0
20:45:44.076098 IP localhost.52224 > localhost.filenet-nch: Flags [P.], seq 1:31, ack 1, win 12759, options [nop,nop,TS val 742423402 ecr 742423402], length 30
20:45:44.076111 IP localhost.filenet-nch > localhost.52224: Flags [.], ack 31, win 12758, options [nop,nop,TS val 742423402 ecr 742423402], length 0
20:45:44.076311 IP localhost.filenet-nch > localhost.52197: Flags [F.], seq 6967, ack 511, win 12743, options [nop,nop,TS val 742423402 ecr 742423402], length 0
20:45:44.076413 IP localhost.52197 > localhost.filenet-nch: Flags [.], ack 6968, win 12541, options [nop,nop,TS val 742423402 ecr 742423402], length 0
20:45:44.076532 IP localhost.filenet-nch > localhost.52198: Flags [F.], seq 21, ack 174, win 12754, options [nop,nop,TS val 742423402 ecr 742423402], length 0
20:45:44.076570 IP localhost.52198 > localhost.filenet-nch: Flags [.], ack 22, win 12758, options [nop,nop,TS val 742423402 ecr 742423402], length 0
20:45:44.076661 IP localhost.filenet-nch > localhost.52199: Flags [F.], seq 9, ack 32, win 12758, options [nop,nop,TS val 742423402 ecr 742423402], length 0
20:45:44.076694 IP localhost.52199 > localhost.filenet-nch: Flags [.], ack 10, win 12759, options [nop,nop,TS val 742423402 ecr 742423402], length 0
20:45:44.077092 IP localhost.filenet-nch > localhost.52224: Flags [P.], seq 1:9, ack 31, win 12758, options [nop,nop,TS val 742423403 ecr 742423402], length 8
20:45:44.077103 IP localhost.52224 > localhost.filenet-nch: Flags [.], ack 9, win 12759, options [nop,nop,TS val 742423403 ecr 742423403], length 0
20:45:44.077190 IP localhost.52224 > localhost.filenet-nch: Flags [P.], seq 31:88, ack 9, win 12759, options [nop,nop,TS val 742423403 ecr 742423403], length 57
20:45:44.077198 IP localhost.filenet-nch > localhost.52224: Flags [.], ack 88, win 12756, options [nop,nop,TS val 742423403 ecr 742423403], length 0
20:45:44.077388 IP localhost.filenet-nch > localhost.52224: Flags [P.], seq 9:17, ack 88, win 12756, options [nop,nop,TS val 742423403 ecr 742423403], length 8
20:45:44.077401 IP localhost.52224 > localhost.filenet-nch: Flags [.], ack 17, win 12758, options [nop,nop,TS val 742423403 ecr 742423403], length 0
20:45:44.077471 IP localhost.52225 > localhost.filenet-nch: Flags [S], seq 2777634848, win 65535, options [mss 16344,nop,wscale 5,nop,nop,TS val 742423403 ecr 0,sackOK,eol], length 0
20:45:44.077507 IP localhost.filenet-nch > localhost.52225: Flags [S.], seq 394139672, ack 2777634849, win 65535, options [mss 16344,nop,wscale 5,nop,nop,TS val 742423403 ecr 742423403,sackOK,eol], length 0
20:45:44.077513 IP localhost.52225 > localhost.filenet-nch: Flags [.], ack 1, win 12759, options [nop,nop,TS val 742423403 ecr 742423403], length 0
20:45:44.077516 IP localhost.filenet-nch > localhost.52225: Flags [.], ack 1, win 12759, options [nop,nop,TS val 742423403 ecr 742423403], length 0
20:45:44.077559 IP localhost.52225 > localhost.filenet-nch: Flags [P.], seq 1:31, ack 1, win 12759, options [nop,nop,TS val 742423403 ecr 742423403], length 30
20:45:44.077571 IP localhost.filenet-nch > localhost.52225: Flags [.], ack 31, win 12758, options [nop,nop,TS val 742423403 ecr 742423403], length 0
20:45:44.078226 IP localhost.filenet-nch > localhost.52225: Flags [P.], seq 1:9, ack 31, win 12758, options [nop,nop,TS val 742423404 ecr 742423403], length 8
20:45:44.078241 IP localhost.52225 > localhost.filenet-nch: Flags [.], ack 9, win 12759, options [nop,nop,TS val 742423404 ecr 742423404], length 0
20:45:44.078267 IP localhost.52225 > localhost.filenet-nch: Flags [P.], seq 31:71, ack 9, win 12759, options [nop,nop,TS val 742423404 ecr 742423404], length 40
20:45:44.078281 IP localhost.filenet-nch > localhost.52225: Flags [.], ack 71, win 12757, options [nop,nop,TS val 742423404 ecr 742423404], length 0
20:45:44.078492 IP localhost.filenet-nch > localhost.52225: Flags [P.], seq 9:42, ack 71, win 12757, options [nop,nop,TS val 742423404 ecr 742423404], length 33
20:45:44.078503 IP localhost.52225 > localhost.filenet-nch: Flags [.], ack 42, win 12758, options [nop,nop,TS val 742423404 ecr 742423404], length 0
20:45:44.078564 IP localhost.52224 > localhost.filenet-nch: Flags [P.], seq 88:142, ack 17, win 12758, options [nop,nop,TS val 742423404 ecr 742423403], length 54
20:45:44.078570 IP localhost.filenet-nch > localhost.52224: Flags [.], ack 142, win 12754, options [nop,nop,TS val 742423404 ecr 742423404], length 0
20:45:44.078643 IP localhost.52226 > localhost.filenet-nch: Flags [S], seq 4093190826, win 65535, options [mss 16344,nop,wscale 5,nop,nop,TS val 742423404 ecr 0,sackOK,eol], length 0
20:45:44.078677 IP localhost.filenet-nch > localhost.52226: Flags [S.], seq 2869938992, ack 4093190827, win 65535, options [mss 16344,nop,wscale 5,nop,nop,TS val 742423404 ecr 742423404,sackOK,eol], length 0
20:45:44.078683 IP localhost.52226 > localhost.filenet-nch: Flags [.], ack 1, win 12759, options [nop,nop,TS val 742423404 ecr 742423404], length 0
20:45:44.078687 IP localhost.filenet-nch > localhost.52226: Flags [.], ack 1, win 12759, options [nop,nop,TS val 742423404 ecr 742423404], length 0
20:45:44.078724 IP localhost.52226 > localhost.filenet-nch: Flags [P.], seq 1:31, ack 1, win 12759, options [nop,nop,TS val 742423404 ecr 742423404], length 30
20:45:44.078733 IP localhost.filenet-nch > localhost.52226: Flags [.], ack 31, win 12758, options [nop,nop,TS val 742423404 ecr 742423404], length 0
20:45:44.079261 IP localhost.filenet-nch > localhost.52224: Flags [P.], seq 17:99, ack 142, win 12754, options [nop,nop,TS val 742423405 ecr 742423404], length 82
20:45:44.079272 IP localhost.52224 > localhost.filenet-nch: Flags [.], ack 99, win 12756, options [nop,nop,TS val 742423405 ecr 742423405], length 0
20:45:44.079312 IP localhost.52224 > localhost.filenet-nch: Flags [P.], seq 142:175, ack 99, win 12756, options [nop,nop,TS val 742423405 ecr 742423405], length 33
20:45:44.079326 IP localhost.filenet-nch > localhost.52224: Flags [.], ack 175, win 12753, options [nop,nop,TS val 742423405 ecr 742423405], length 0
20:45:44.085266 IP localhost.filenet-nch > localhost.52224: Flags [P.], seq 99:167, ack 175, win 12753, options [nop,nop,TS val 742423411 ecr 742423405], length 68
20:45:44.085280 IP localhost.filenet-nch > localhost.52226: Flags [P.], seq 1:9, ack 31, win 12758, options [nop,nop,TS val 742423411 ecr 742423404], length 8
20:45:44.085282 IP localhost.52224 > localhost.filenet-nch: Flags [.], ack 167, win 12754, options [nop,nop,TS val 742423411 ecr 742423411], length 0
20:45:44.085287 IP localhost.52226 > localhost.filenet-nch: Flags [.], ack 9, win 12759, options [nop,nop,TS val 742423411 ecr 742423411], length 0
20:45:44.085327 IP localhost.52226 > localhost.filenet-nch: Flags [P.], seq 31:71, ack 9, win 12759, options [nop,nop,TS val 742423411 ecr 742423411], length 40
20:45:44.085330 IP localhost.52224 > localhost.filenet-nch: Flags [P.], seq 175:295, ack 167, win 12754, options [nop,nop,TS val 742423411 ecr 742423411], length 120
20:45:44.085341 IP localhost.filenet-nch > localhost.52226: Flags [.], ack 71, win 12757, options [nop,nop,TS val 742423411 ecr 742423411], length 0
20:45:44.085346 IP localhost.filenet-nch > localhost.52224: Flags [.], ack 295, win 12750, options [nop,nop,TS val 742423411 ecr 742423411], length 0
20:45:44.085635 IP localhost.filenet-nch > localhost.52226: Flags [P.], seq 9:42, ack 71, win 12757, options [nop,nop,TS val 742423411 ecr 742423411], length 33
20:45:44.085655 IP localhost.52226 > localhost.filenet-nch: Flags [.], ack 42, win 12758, options [nop,nop,TS val 742423411 ecr 742423411], length 0
20:45:44.085849 IP localhost.filenet-nch > localhost.52224: Flags [P.], seq 167:419, ack 295, win 12750, options [nop,nop,TS val 742423411 ecr 742423411], length 252
20:45:44.085864 IP localhost.52224 > localhost.filenet-nch: Flags [.], ack 419, win 12746, options [nop,nop,TS val 742423411 ecr 742423411], length 0
20:45:44.085905 IP localhost.52224 > localhost.filenet-nch: Flags [P.], seq 295:328, ack 419, win 12746, options [nop,nop,TS val 742423411 ecr 742423411], length 33
20:45:44.085921 IP localhost.filenet-nch > localhost.52224: Flags [.], ack 328, win 12749, options [nop,nop,TS val 742423411 ecr 742423411], length 0
20:45:44.086992 IP localhost.filenet-nch > localhost.52224: Flags [P.], seq 419:6245, ack 328, win 12749, options [nop,nop,TS val 742423412 ecr 742423411], length 5826
20:45:44.087008 IP localhost.52224 > localhost.filenet-nch: Flags [.], ack 6245, win 12564, options [nop,nop,TS val 742423412 ecr 742423412], length 0
20:45:44.087105 IP localhost.52224 > localhost.filenet-nch: Flags [P.], seq 328:429, ack 6245, win 12564, options [nop,nop,TS val 742423412 ecr 742423412], length 101
20:45:44.087120 IP localhost.filenet-nch > localhost.52224: Flags [.], ack 429, win 12746, options [nop,nop,TS val 742423412 ecr 742423412], length 0
20:45:44.087875 IP localhost.filenet-nch > localhost.52224: Flags [P.], seq 6245:6461, ack 429, win 12746, options [nop,nop,TS val 742423412 ecr 742423412], length 216
20:45:44.087891 IP localhost.52224 > localhost.filenet-nch: Flags [.], ack 6461, win 12557, options [nop,nop,TS val 742423412 ecr 742423412], length 0
20:45:44.087926 IP localhost.52224 > localhost.filenet-nch: Flags [P.], seq 429:462, ack 6461, win 12557, options [nop,nop,TS val 742423412 ecr 742423412], length 33
20:45:44.087938 IP localhost.filenet-nch > localhost.52224: Flags [.], ack 462, win 12744, options [nop,nop,TS val 742423412 ecr 742423412], length 0
20:45:44.088450 IP localhost.filenet-nch > localhost.52224: Flags [P.], seq 6461:6655, ack 462, win 12744, options [nop,nop,TS val 742423413 ecr 742423412], length 194
20:45:44.088465 IP localhost.52224 > localhost.filenet-nch: Flags [.], ack 6655, win 12551, options [nop,nop,TS val 742423413 ecr 742423413], length 0
20:45:45.080218 IP localhost.52224 > localhost.filenet-nch: Flags [P.], seq 462:470, ack 6655, win 12551, options [nop,nop,TS val 742424399 ecr 742423413], length 8
20:45:45.080245 IP localhost.filenet-nch > localhost.52224: Flags [.], ack 470, win 12744, options [nop,nop,TS val 742424399 ecr 742424399], length 0
20:45:45.080801 IP localhost.filenet-nch > localhost.52224: Flags [P.], seq 6655:6707, ack 470, win 12744, options [nop,nop,TS val 742424399 ecr 742424399], length 52
20:45:45.080823 IP localhost.52224 > localhost.filenet-nch: Flags [.], ack 6707, win 12549, options [nop,nop,TS val 742424399 ecr 742424399], length 0
20:45:50.081283 IP localhost.52224 > localhost.filenet-nch: Flags [P.], seq 470:478, ack 6707, win 12549, options [nop,nop,TS val 742429376 ecr 742424399], length 8
20:45:50.081305 IP localhost.filenet-nch > localhost.52224: Flags [.], ack 478, win 12744, options [nop,nop,TS val 742429376 ecr 742429376], length 0
20:45:50.081781 IP localhost.filenet-nch > localhost.52224: Flags [P.], seq 6707:6759, ack 478, win 12744, options [nop,nop,TS val 742429376 ecr 742429376], length 52
20:45:50.081807 IP localhost.52224 > localhost.filenet-nch: Flags [.], ack 6759, win 12548, options [nop,nop,TS val 742429376 ecr 742429376], length 0
20:45:55.087061 IP localhost.52224 > localhost.filenet-nch: Flags [P.], seq 478:486, ack 6759, win 12548, options [nop,nop,TS val 742434364 ecr 742429376], length 8
20:45:55.087155 IP localhost.filenet-nch > localhost.52224: Flags [.], ack 486, win 12744, options [nop,nop,TS val 742434364 ecr 742434364], length 0
20:45:55.087921 IP localhost.filenet-nch > localhost.52224: Flags [P.], seq 6759:6811, ack 486, win 12744, options [nop,nop,TS val 742434364 ecr 742434364], length 52
20:45:55.087942 IP localhost.52224 > localhost.filenet-nch: Flags [.], ack 6811, win 12546, options [nop,nop,TS val 742434364 ecr 742434364], length 0
20:46:00.091450 IP localhost.52224 > localhost.filenet-nch: Flags [P.], seq 486:494, ack 6811, win 12546, options [nop,nop,TS val 742439362 ecr 742434364], length 8
20:46:00.091507 IP localhost.filenet-nch > localhost.52224: Flags [.], ack 494, win 12743, options [nop,nop,TS val 742439362 ecr 742439362], length 0
20:46:00.092138 IP localhost.filenet-nch > localhost.52224: Flags [P.], seq 6811:6863, ack 494, win 12743, options [nop,nop,TS val 742439362 ecr 742439362], length 52
20:46:00.092161 IP localhost.52224 > localhost.filenet-nch: Flags [.], ack 6863, win 12544, options [nop,nop,TS val 742439362 ecr 742439362], length 0
20:46:05.095389 IP localhost.52224 > localhost.filenet-nch: Flags [P.], seq 494:502, ack 6863, win 12544, options [nop,nop,TS val 742444353 ecr 742439362], length 8
20:46:05.095415 IP localhost.filenet-nch > localhost.52224: Flags [.], ack 502, win 12743, options [nop,nop,TS val 742444353 ecr 742444353], length 0
20:46:05.095963 IP localhost.filenet-nch > localhost.52224: Flags [P.], seq 6863:6915, ack 502, win 12743, options [nop,nop,TS val 742444353 ecr 742444353], length 52
20:46:05.095987 IP localhost.52224 > localhost.filenet-nch: Flags [.], ack 6915, win 12543, options [nop,nop,TS val 742444353 ecr 742444353], length 0
20:46:10.099106 IP localhost.52224 > localhost.filenet-nch: Flags [P.], seq 502:510, ack 6915, win 12543, options [nop,nop,TS val 742449302 ecr 742444353], length 8
20:46:10.099136 IP localhost.filenet-nch > localhost.52224: Flags [.], ack 510, win 12743, options [nop,nop,TS val 742449302 ecr 742449302], length 0
20:46:10.099672 IP localhost.filenet-nch > localhost.52224: Flags [P.], seq 6915:6967, ack 510, win 12743, options [nop,nop,TS val 742449302 ecr 742449302], length 52
20:46:10.099690 IP localhost.52224 > localhost.filenet-nch: Flags [.], ack 6967, win 12541, options [nop,nop,TS val 742449302 ecr 742449302], length 0
20:46:14.168412 IP localhost.52225 > localhost.filenet-nch: Flags [P.], seq 71:202, ack 42, win 12758, options [nop,nop,TS val 742453364 ecr 742423404], length 131
20:46:14.168443 IP localhost.filenet-nch > localhost.52225: Flags [.], ack 202, win 12753, options [nop,nop,TS val 742453364 ecr 742453364], length 0
20:46:14.169436 IP localhost.filenet-nch > localhost.52225: Flags [P.], seq 42:54, ack 202, win 12753, options [nop,nop,TS val 742453365 ecr 742453364], length 12
20:46:14.169457 IP localhost.52225 > localhost.filenet-nch: Flags [.], ack 54, win 12757, options [nop,nop,TS val 742453365 ecr 742453365], length 0
20:46:15.100653 IP localhost.52224 > localhost.filenet-nch: Flags [P.], seq 510:518, ack 6967, win 12541, options [nop,nop,TS val 742454291 ecr 742449302], length 8
20:46:15.100699 IP localhost.filenet-nch > localhost.52224: Flags [.], ack 518, win 12743, options [nop,nop,TS val 742454291 ecr 742454291], length 0
20:46:15.101486 IP localhost.filenet-nch > localhost.52224: Flags [P.], seq 6967:7019, ack 518, win 12743, options [nop,nop,TS val 742454291 ecr 742454291], length 52
20:46:15.101519 IP localhost.52224 > localhost.filenet-nch: Flags [.], ack 7019, win 12540, options [nop,nop,TS val 742454291 ecr 742454291], length 0
20:46:20.106093 IP localhost.52224 > localhost.filenet-nch: Flags [P.], seq 518:526, ack 7019, win 12540, options [nop,nop,TS val 742459288 ecr 742454291], length 8
20:46:20.106135 IP localhost.filenet-nch > localhost.52224: Flags [.], ack 526, win 12742, options [nop,nop,TS val 742459288 ecr 742459288], length 0
20:46:20.106783 IP localhost.filenet-nch > localhost.52224: Flags [P.], seq 7019:7071, ack 526, win 12742, options [nop,nop,TS val 742459288 ecr 742459288], length 52
20:46:20.106798 IP localhost.52224 > localhost.filenet-nch: Flags [.], ack 7071, win 12538, options [nop,nop,TS val 742459288 ecr 742459288], length 0
20:46:25.107462 IP localhost.52224 > localhost.filenet-nch: Flags [P.], seq 526:534, ack 7071, win 12538, options [nop,nop,TS val 742464275 ecr 742459288], length 8
20:46:25.107488 IP localhost.filenet-nch > localhost.52224: Flags [.], ack 534, win 12742, options [nop,nop,TS val 742464275 ecr 742464275], length 0
20:46:25.108028 IP localhost.filenet-nch > localhost.52224: Flags [P.], seq 7071:7123, ack 534, win 12742, options [nop,nop,TS val 742464275 ecr 742464275], length 52
20:46:25.108055 IP localhost.52224 > localhost.filenet-nch: Flags [.], ack 7123, win 12536, options [nop,nop,TS val 742464275 ecr 742464275], length 0
20:46:30.109711 IP localhost.52224 > localhost.filenet-nch: Flags [P.], seq 534:542, ack 7123, win 12536, options [nop,nop,TS val 742469270 ecr 742464275], length 8
20:46:30.109770 IP localhost.filenet-nch > localhost.52224: Flags [.], ack 542, win 12742, options [nop,nop,TS val 742469270 ecr 742469270], length 0
20:46:30.110526 IP localhost.filenet-nch > localhost.52224: Flags [P.], seq 7123:7175, ack 542, win 12742, options [nop,nop,TS val 742469270 ecr 742469270], length 52
20:46:30.110568 IP localhost.52224 > localhost.filenet-nch: Flags [.], ack 7175, win 12535, options [nop,nop,TS val 742469270 ecr 742469270], length 0
20:46:35.112161 IP localhost.52224 > localhost.filenet-nch: Flags [P.], seq 542:550, ack 7175, win 12535, options [nop,nop,TS val 742474250 ecr 742469270], length 8
20:46:35.112205 IP localhost.filenet-nch > localhost.52224: Flags [.], ack 550, win 12742, options [nop,nop,TS val 742474250 ecr 742474250], length 0
20:46:35.112845 IP localhost.filenet-nch > localhost.52224: Flags [P.], seq 7175:7227, ack 550, win 12742, options [nop,nop,TS val 742474250 ecr 742474250], length 52
20:46:35.112868 IP localhost.52224 > localhost.filenet-nch: Flags [.], ack 7227, win 12533, options [nop,nop,TS val 742474250 ecr 742474250], length 0
20:46:40.113594 IP localhost.52224 > localhost.filenet-nch: Flags [P.], seq 550:558, ack 7227, win 12533, options [nop,nop,TS val 742479185 ecr 742474250], length 8
20:46:40.113636 IP localhost.filenet-nch > localhost.52224: Flags [.], ack 558, win 12741, options [nop,nop,TS val 742479185 ecr 742479185], length 0
20:46:40.114411 IP localhost.filenet-nch > localhost.52224: Flags [P.], seq 7227:7279, ack 558, win 12741, options [nop,nop,TS val 742479185 ecr 742479185], length 52
20:46:40.114449 IP localhost.52224 > localhost.filenet-nch: Flags [.], ack 7279, win 12531, options [nop,nop,TS val 742479185 ecr 742479185], length 0
20:46:45.117429 IP localhost.52224 > localhost.filenet-nch: Flags [P.], seq 558:566, ack 7279, win 12531, options [nop,nop,TS val 742484162 ecr 742479185], length 8
20:46:45.117469 IP localhost.filenet-nch > localhost.52224: Flags [.], ack 566, win 12741, options [nop,nop,TS val 742484162 ecr 742484162], length 0
20:46:45.118249 IP localhost.filenet-nch > localhost.52224: Flags [P.], seq 7279:7331, ack 566, win 12741, options [nop,nop,TS val 742484162 ecr 742484162], length 52
20:46:45.118279 IP localhost.52224 > localhost.filenet-nch: Flags [.], ack 7331, win 12530, options [nop,nop,TS val 742484162 ecr 742484162], length 0
20:46:50.120125 IP localhost.52224 > localhost.filenet-nch: Flags [P.], seq 566:574, ack 7331, win 12530, options [nop,nop,TS val 742489151 ecr 742484162], length 8
20:46:50.120152 IP localhost.filenet-nch > localhost.52224: Flags [.], ack 574, win 12741, options [nop,nop,TS val 742489151 ecr 742489151], length 0
20:46:50.120696 IP localhost.filenet-nch > localhost.52224: Flags [P.], seq 7331:7383, ack 574, win 12741, options [nop,nop,TS val 742489151 ecr 742489151], length 52
20:46:50.120715 IP localhost.52224 > localhost.filenet-nch: Flags [.], ack 7383, win 12528, options [nop,nop,TS val 742489151 ecr 742489151], length 0
20:46:55.122145 IP localhost.52224 > localhost.filenet-nch: Flags [P.], seq 574:582, ack 7383, win 12528, options [nop,nop,TS val 742494136 ecr 742489151], length 8
20:46:55.122180 IP localhost.filenet-nch > localhost.52224: Flags [.], ack 582, win 12741, options [nop,nop,TS val 742494136 ecr 742494136], length 0
20:46:55.122693 IP localhost.filenet-nch > localhost.52224: Flags [P.], seq 7383:7435, ack 582, win 12741, options [nop,nop,TS val 742494136 ecr 742494136], length 52
20:46:55.122707 IP localhost.52224 > localhost.filenet-nch: Flags [.], ack 7435, win 12527, options [nop,nop,TS val 742494136 ecr 742494136], length 0
20:47:00.123432 IP localhost.52224 > localhost.filenet-nch: Flags [P.], seq 582:590, ack 7435, win 12527, options [nop,nop,TS val 742499134 ecr 742494136], length 8
20:47:00.123455 IP localhost.filenet-nch > localhost.52224: Flags [.], ack 590, win 12740, options [nop,nop,TS val 742499134 ecr 742499134], length 0
20:47:00.123852 IP localhost.filenet-nch > localhost.52224: Flags [P.], seq 7435:7487, ack 590, win 12740, options [nop,nop,TS val 742499134 ecr 742499134], length 52
20:47:00.123868 IP localhost.52224 > localhost.filenet-nch: Flags [.], ack 7487, win 12525, options [nop,nop,TS val 742499134 ecr 742499134], length 0
20:47:05.127262 IP localhost.52224 > localhost.filenet-nch: Flags [P.], seq 590:598, ack 7487, win 12525, options [nop,nop,TS val 742504129 ecr 742499134], length 8
20:47:05.127313 IP localhost.filenet-nch > localhost.52224: Flags [.], ack 598, win 12740, options [nop,nop,TS val 742504129 ecr 742504129], length 0
20:47:05.128167 IP localhost.filenet-nch > localhost.52224: Flags [P.], seq 7487:7539, ack 598, win 12740, options [nop,nop,TS val 742504129 ecr 742504129], length 52
20:47:05.128208 IP localhost.52224 > localhost.filenet-nch: Flags [.], ack 7539, win 12523, options [nop,nop,TS val 742504129 ecr 742504129], length 0
20:47:10.129686 IP localhost.52224 > localhost.filenet-nch: Flags [P.], seq 598:606, ack 7539, win 12523, options [nop,nop,TS val 742509100 ecr 742504129], length 8
20:47:10.129735 IP localhost.filenet-nch > localhost.52224: Flags [.], ack 606, win 12740, options [nop,nop,TS val 742509100 ecr 742509100], length 0
20:47:10.130475 IP localhost.filenet-nch > localhost.52224: Flags [P.], seq 7539:7591, ack 606, win 12740, options [nop,nop,TS val 742509100 ecr 742509100], length 52
20:47:10.130507 IP localhost.52224 > localhost.filenet-nch: Flags [.], ack 7591, win 12522, options [nop,nop,TS val 742509100 ecr 742509100], length 0
20:47:15.130996 IP localhost.52224 > localhost.filenet-nch: Flags [P.], seq 606:614, ack 7591, win 12522, options [nop,nop,TS val 742514060 ecr 742509100], length 8
```

**Comment by avikivity** [comment]
We will need a full capture since it's likely a dns problem.  '-i any -w connect.pcap' will capture everything and dump to 'connect.pcap'.

It will really capture everything, so close your browser and other unneeded applications, and don't watch any naughty sites while the capture is running.

**Comment by dahankzter** [comment]
Oh ill watch out! Sec.

**Comment by dahankzter** [comment]
I couldn't find a an upload feature... [connect.pcap](https://www.dropbox.com/s/vuvbcaroo8l5uyv/connect.pcap?dl=0)

Can you take it and ping when its down. I don't think there is anything weird in it but I saw references to my Sonos system so well better safe than sorry.

**Comment by avikivity** [comment]
Got it.  There's a box here ↓ with instructions on how to attach files.

**Comment by dahankzter** [comment]
Oh gosh! It was only across the whole screen... Well what do you know! :D

**Comment by avikivity** [comment]
In this capture, a connection to port 9042 was not established.  I see SYN packets, but no response from the server.

**Comment by dahankzter** [comment]
It takes this long to setup a session. No queries should be executed. Some response should be available though. 

I made a standalone little Go program on a linux box the other day. Super fast connect to the docker instance. Ill try that one since it is so much smaller. Brb.

**Comment by dahankzter** [comment]
This tiny little program has similar issues though it does not take quite as long as the original program but that one establishes 2 sessions in sequence. The first one is mainly there to make sure all keyspaces etc are properly initialized.

```go
package main

import "github.com/gocql/gocql"

func main() {
	cluster := gocql.NewCluster("localhost:32770")
	cluster.Consistency = gocql.Quorum
	cluster.Keyspace = "example"

	session, err := cluster.CreateSession()
	if err != nil {
		panic(err)
	}
	defer session.Close()
}
```

**Comment by dahankzter** [comment]
New dump with the above program [connect2.pcap](https://www.dropbox.com/s/822giusy5cut5c9/connect2.pcap?dl=0)

**Comment by dahankzter** [comment]
It is distinctly faster but it seems a couple of orders slower than on linux.

**Comment by dahankzter** [comment]
The [page](http://www.scylladb.com/doc/getting-started-docker) on how to run docker seems gone too is that by accident?

**Comment by dorlaor** [comment]
It wasn't an accident, the documentation didn't reflect reality so folks
chose
to nuke the page temporary instead of slowly fixing it. We should revive it
asap

**Comment by dahankzter** [comment]
Ok then I know, thx!

**Comment by dahankzter** [comment]
Is there anything else I can try @avikivity ? Do you want the output of "docker inspect"? It doesnt look that strange but stuff like Domain etc (empty btw) and other things related to networking/bridging may be of interest?

**Comment by dahankzter** [comment]
So I seem to have found a clue.

```go
package main

import "github.com/gocql/gocql"

func main() {
    cluster := gocql.NewCluster("localhost:32770")
    cluster.DisableInitialHostLookup = true
    cluster.Consistency = gocql.Quorum
    cluster.Keyspace = "example"

    session, err := cluster.CreateSession()
    if err != nil {
        panic(err)
    }
    defer session.Close()
}
```

Does not suffer from this at all neither for ScyllaDB nor Cassandra dockers.
The key is
```go
cluster.DisableInitialHostLookup = true
```
There seems to be some further discussion here: https://github.com/gocql/gocql/issues/696 
It is not only the drivers fault I think since people creating their own Cassandra images do not seem to be affected.

**Comment by avikivity** [comment]
Got a 404 on that second packet capture.

**Comment by dahankzter** [comment]
Ah I removed it. New [link](https://www.dropbox.com/s/tm1sx73m3z6gpjq/connect2.pcap?dl=0)

**Comment by dahankzter** [comment]
I see references to the internal docker image IP but can't really tell if they are correctly there.
Given the discussion above I looked at the local table:

```bash
cqlsh:system> select rpc_address from local;

 rpc_address
-------------
  172.17.0.2
```

Is that correct?

**Comment by avikivity** [comment]
Doesn't look like a connection to port 9042 was established (there was an attempt, but no response).

I don't know enough about docker networking to comment about `rpc_address`.

**Comment by dahankzter** [comment]
```bash
cqlsh:system> select broadcast_address,rpc_address,listen_address from local;

 broadcast_address | rpc_address | listen_address
-------------------+-------------+----------------
        172.17.0.2 |  172.17.0.2 |     172.17.0.2
```

They are all referring to the internal address.

**Comment by dahankzter** [comment]
That 9042 attempt what IP was used?

**Comment by dahankzter** [comment]
I see this in the tcpdump:

```bash
23:06:53.854686 IP 192.168.1.12.59299 > 172.17.0.2.9042: tcp 0
```

That can't work right? 172.17.0.2:9042 is not reachable right?

**Comment by avikivity** [comment]
Indeed the wrong one.  So we should change `broadcast_address` and `broadcast_rpc_address` to the IP address of the host.

**Comment by avikivity** [comment]
Does docker provide this information in environment variables?

**Comment by dahankzter** [comment]
Oh I really don't know off the bat. Sorry.

**Comment by avikivity** [comment]
https://github.com/docker/docker/issues/7472.  Still open.

**Comment by avikivity** [comment]
What a joke.

**Comment by avikivity** [comment]
Some [hacks](http://stackoverflow.com/questions/22944631/how-to-get-the-ip-address-of-the-docker-host-from-inside-a-docker-container).

**Comment by avikivity** [comment]
@penberg we can use the default gateway hack to supply `--broadcast-rpc-address` and `--broadcast-address`.

**Comment by dahankzter** [comment]
Ugh we have services that registers themselves in Zookeeper and we are thinking of moving most our stuff to docker...

**Comment by dahankzter** [comment]
Let me know when I can test something. Is there an "unstable" or "develop" image? I didn't see it in the Docker Hub directly but most of you guys each have images that perhaps can be used.

**Comment by penberg** [comment]
@dahankzter We don't publish unstable Docker images (not yet anyway), but you can build yourself one:

```shell
cd dist/docker/redhat
docker build -t <image-name> .
```

It uses the RPM repository so you don't need to build Scylla. If you want something more stable than master, just build it from ``branch-1.3``.

**Comment by dahankzter** [comment]
Cool, thx!

That hack Avi suggested can it be applied?

**Comment by penberg** [comment]
@avikivity We use ``hostname -i`` as the IP address for other configuration options. Can we just use that?

**Comment by avikivity** [comment]
In the guest it will return something useless.

On the host there may be multiple IP addresses.

**Comment by penberg** [comment]
OK, so turns out I don't understand the issue...

The Docker IP address (e.g. ``172.17.0.2``) _is_ reachable from the host because Docker sets up a NAT entry for that. For OS X, perhaps the use of ``docker-machine`` complicates things here as you're actually accessing a VM from the host, not the Docker container itself.

Hmm?

**Comment by avikivity** [comment]
What if someone wants to reach it not from the host?

We should set broadcast*address to the host address, so that someone trying to reach it from outside the host, can.

**Comment by avikivity** [comment]
like, say, another node in the cluster, running on another docker host.

**Comment by penberg** [comment]
Uhm, that's why you have things like "multi-host networking":

https://blog.docker.com/2015/11/docker-multi-host-networking-ga/

Or Kubernetes...

AFAICT, we _should_ add a way for people to specify ``broadcast_rpc_address``, but setting to default gateway by default doesn't really make sense.

**Comment by avikivity** [comment]
Why not?  Isn't the default gateway inside the container just the host address?

**Comment by penberg** [comment]
@avikivity, no, it is the address of the _bridge interface_ on the host:

```console
[root@cb601e64edc0 /]# /sbin/ip route|awk '/default/ { print $3 }'
172.17.0.1
```

```console
[penberg@nero ~]$ ifconfig

...

docker0: flags=4163<UP,BROADCAST,RUNNING,MULTICAST>  mtu 1500
        inet 172.17.0.1  netmask 255.255.0.0  broadcast 0.0.0.0
        inet6 fe80::42:5bff:fef0:794b  prefixlen 64  scopeid 0x20<link>
        ether 02:42:5b:f0:79:4b  txqueuelen 0  (Ethernet)
        RX packets 257487  bytes 12738328 (12.1 MiB)
        RX errors 0  dropped 0  overruns 0  frame 0
        TX packets 397497  bytes 788030716 (751.5 MiB)
        TX errors 0  dropped 0 overruns 0  carrier 0  collisions 0
```

Also, even if it was the host address, how would it work if there's multiple Docker containers running?

AFAICT, this is not something we can fix at the Docker image level, but needs to be addressed by Docker. But then again, I don't know anything about Docker.

**Comment by avikivity** [comment]
@penberg, right.

It's not really a docker problem but a kubernetes/mesos problem.  Is there any way to get them to pass the IP address to the container?

**Comment by avikivity** [comment]
http://stackoverflow.com/questions/30746888/how-to-know-a-pods-own-ip-address-from-the-container-in-the-pod

**Comment by penberg** [comment]
Well, this issue is about running Scylla on Docker on OS X, so it's a Docker on Mac problem too.

**Comment by avikivity** [comment]
yeah.  Well why won't it work on a Mac now?  Using the container IP address.

**Comment by penberg** [comment]
Because you don't connect to the container from the host. You connect first to a VM running Docker...

**Comment by avikivity** [comment]
Ugh.  So we really need the VM's IP address.

**Comment by penberg** [comment]
If you have Docker Toolbox installed on OS X, you can use the `docker-machine ip` command to obtain a host accessible IP address to the container for all exposed ports:

https://docs.docker.com/machine/get-started/

Now I don't know if that also has the same problem with broadcast addresses or not. They did some work on virtualization magic so perhaps they also intercept traffic and route it to the container...

https://blog.docker.com/2016/05/docker-unikernels-open-source/

**Comment by avikivity** [comment]
I see this on the [docker-for-mac](https://docs.docker.com/docker-for-mac/) page:

>  Note: Early beta releases used docker as the hostname to build the URL. Now, ports are exposed on the private IP addresses of the VM and forwarded to localhost with no other host name set. See also, Release Notes for Beta 9.

which leads me to believe we should use 127.0.0.1 for broadcast* on a docker-for-mac setup.

@dahankzter, are you using docker-for-mac or virtualbox?

**Comment by dahankzter** [comment]
I am using the native new docker-for-mac rather than the virtualbox old version.

**Comment by duarten** [comment]
With the new docker-for-mac I can access a scylla container by configuring the correct port mappings. For example, with `docker run -p 9042:9042 -p 9160:9160 -d scylla` I can connect with `cqlsh` and `cassandra-cli`.

To connect two containers I do:

```
duarten ~ $  docker run -p 9042:9042 -p 9160:9160 -d scylla
6de6dda2dc89320c265c9891aea2d635647325186ff925016b761b74d8e48842
duarten ~ $ docker ps
CONTAINER ID        IMAGE               COMMAND                  CREATED             STATUS              PORTS                                                                      NAMES
6de6dda2dc89        scylla              "/docker-entrypoint.p"   3 seconds ago       Up 2 seconds        0.0.0.0:9042->9042/tcp, 7000-7001/tcp, 10000/tcp, 0.0.0.0:9160->9160/tcp   big_minsky
duarten ~ $ docker inspect 6de6dda2dc89 | grep IPAddress
            "SecondaryIPAddresses": null,
            "IPAddress": "172.17.0.2",
                    "IPAddress": "172.17.0.2",
docker run -p 9043:9042 -p 9161:9160 -d scylla  --seeds 172.17.0.2
```

The gateway is 172.17.0.1. I tried:

```
duarten ~ $  docker run -p 9043:9042 -p 9161:9160 -d scylla  --seeds 172.17.0.1 --broadcast-address 172.17.0.1
d8076f977112c66d0ef7e83340321f2b754d03fd1a6806747452898e3c8cf30b
duarten ~ $  docker run -p 9043:9041 -p 9160:9160 -d scylla  --seeds 172.17.0.1 --broadcast-address 172.17.0.1
777d90a319dbe57616550fad2b962805671e2be3d98be46588efc0b7aeb4ae2f
```

But couldn't get the two scylla instances to connect; I guess I'm misconfiguring something.

**Comment by dorlaor** [comment]
@dahankzter , care to retest? Our docker images were refreshed couple of time since

**Comment by slivne** [comment]
closing this issue we can reopen if there is still an issue

**Comment by rawteech** [comment]
Did anyone find a work-a-round for this?
