### ISSUE TITLE
Porting ScyllaDB to IBM Linux on z Systems (s390x Big-Endian platform)

### ISSUE THREAD

**Issue by maximmai** [scylladb/scylla#1934]
*Installation details*
Scylla version (or git commit hash): 1.3.4
Cluster size: 3
OS (RHEL/CentOS/Ubuntu/AWS AMI): RHEL7

*Hardware details (for performance issues)*          Delete if unneeded
Platform (physical/VM/cloud instance type/docker): IBM z Systems 
Architecture:          s390x
CPU op-mode(s):        32-bit, 64-bit
Byte Order:            Big Endian
Vendor ID:             IBM/S390
uname -a:              Linux 3.10.0-327.3.1.el7.s390x GNU/Linux
GCC: 5.2
Boost: 1.55

Some known issues:

1) https://github.com/scylladb/scylla/blob/branch-1.3/main.cc#L230
Checks if the CPU has "SSE4.2" feature, this fails on the non-intel platform.

2) https://github.com/scylladb/scylla/blob/branch-1.3/utils/crc.hh#L25
"smmintrin.h" and its _mm_crc32_*() are x86 specific. Need to use either boost's crc32 utitlity, or native (crc32-s390x)[https://github.com/linux-on-ibm-z/crc32-s390x]

**Comment by avikivity** [comment]
@maximmai are you planning to port it?  If so I suggest starting with seastar.

I'll be happy to help, I've had good experience with the s390 guys during my KVM days.

**Comment by maximmai** [comment]
@avikivity Yes, I am planning to port it. I attended a session back in August this year, during LinuxCON 2016, and I was impressed by the performance of Scylla vs Cassandra. 

I have started looking at the code in Seastar and ScyllaDB, and identified places that need code changes. Once I have approvals from my organization, I will then publish the changes and make pull-requests.

**Comment by dorlaor** [comment]
@maximmai how is the port going?

**Comment by maximmai** [comment]
@dorlaor Hi, I have the initial port available.

However, I am only able to get Scylla to work with the Thrift protocol. With the native CQL3 protocol, I am getting this error from cqlsh: 

`Connection error: ('Unable to connect to any servers', {'127.0.0.1': KeyError('cluster_name',)})`

I am stuck at debugging the root cause of it at the moment.

The clients I have tried:
- apache-cassandra-2.1.16
- apache-cassandra-2.1.17
- scylla-tools-java-scylla-1.1.3
- scylla-tools-java-scylla-1.3.0
- scylla-tools-java-scylla-1.3.4

My port is based on version:
commit ef4332ab09774e7c69392706c5d7bc500e3c03fc
Author: Pekka Enberg <penberg@scylladb.com>
Date:   Thu Nov 3 12:09:13 2016 +0200

    release: prepare for 1.3.4

Please let me know if you have any thoughts on this, thank you!

**Comment by avikivity** [comment]
First, very impressive work.

Second, I recommend upstreaming the work you've already done, starting with Scylla.

To debug your connection error, is the server listening on port 9042? Can you provide a packet capture of the traffic on this port?

**Comment by maximmai** [comment]
Yes, I will upstream the code to these 2 repositories, then make a pull-request. https://github.com/linux-on-ibm-z/scylla https://github.com/linux-on-ibm-z/seastar

Good call on examing the packets! The issue is very likely coming from the cksum, as suggested by the tcpdump:

`cksum 0xfe30 (incorrect -> 0x571d)`

Long Version output:

```
lozlnxp.canlab.ibm.com:/localbox/maximmai/scylladb/scylla-1.3.0/cql3 $> sudo tcpdump -vv -x -X -s 1500 -i lo 'port 9042'
tcpdump: listening on lo, link-type EN10MB (Ethernet), capture size 1500 bytes
13:17:56.215114 IP (tos 0x0, ttl 64, id 39635, offset 0, flags [DF], proto TCP (6), length 60)
    localhost.48203 > localhost.9042: Flags [S], cksum 0xfe30 (incorrect -> 0x571d), seq 1290536927, win 43690, options [mss 65495,sackOK,TS val 2090638604 ec
r 0,nop,wscale 7], length 0
        0x0000:  4500 003c 9ad3 4000 4006 a1e6 7f00 0001  E..<..@.@.......
        0x0010:  7f00 0001 bc4b 2352 4cec 07df 0000 0000  .....K#RL.......
        0x0020:  a002 aaaa fe30 0000 0204 ffd7 0402 080a  .....0..........
        0x0030:  7c9c 9d0c 0000 0000 0103 0307            |...........
13:17:56.215125 IP (tos 0x0, ttl 64, id 64468, offset 0, flags [DF], proto TCP (6), length 40)
    localhost.9042 > localhost.48203: Flags [R.], cksum 0x7d64 (correct), seq 0, ack 1290536928, win 0, length 0
        0x0000:  4500 0028 fbd4 4000 4006 40f9 7f00 0001  E..(..@.@.@.....
        0x0010:  7f00 0001 2352 bc4b 0000 0000 4cec 07e0  ....#R.K....L...
        0x0020:  5014 0000 7d64 0000                      P...}d..
13:18:16.318422 IP (tos 0x0, ttl 64, id 54859, offset 0, flags [DF], proto TCP (6), length 60)
    localhost.48204 > localhost.9042: Flags [S], cksum 0xfe30 (incorrect -> 0x5ebd), seq 3533861549, win 43690, options [mss 65495,sackOK,TS val 2090640614 ecr 0,nop,wscale 7], length 0
        0x0000:  4500 003c d64b 4000 4006 666e 7f00 0001  E..<.K@.@.fn....
        0x0010:  7f00 0001 bc4c 2352 d2a2 72ad 0000 0000  .....L#R..r.....
        0x0020:  a002 aaaa fe30 0000 0204 ffd7 0402 080a  .....0..........
        0x0030:  7c9c a4e6 0000 0000 0103 0307            |...........
00:01:52.532423 IP (tos 0x0, ttl 64, id 0, offset 0, flags [DF], proto TCP (6), length 60)
    localhost.9042 > localhost.48204: Flags [S.], cksum 0xfe30 (incorrect -> 0x217e), seq 2139724833, ack 3533861550, win 43690, options [mss 65495,sackOK,TS val 2090640614 ecr 2090640614,nop,wscale 7], length 0
        0x0000:  4500 003c 0000 4000 4006 3cba 7f00 0001  E..<..@.@.<.....
        0x0010:  7f00 0001 2352 bc4c 7f89 9c21 d2a2 72ae  ....#R.L...!..r.
        0x0020:  a012 aaaa fe30 0000 0204 ffd7 0402 080a  .....0..........
        0x0030:  7c9c a4e6 7c9c a4e6 0103 0307            |...|.......
13:18:16.318445 IP (tos 0x0, ttl 64, id 54860, offset 0, flags [DF], proto TCP (6), length 52)
    localhost.48204 > localhost.9042: Flags [.], cksum 0xfe28 (incorrect -> 0xf3c2), seq 1, ack 1, win 342, options [nop,nop,TS val 2090640614 ecr 2090640614], length 0
        0x0000:  4500 0034 d64c 4000 4006 6675 7f00 0001  E..4.L@.@.fu....
        0x0010:  7f00 0001 bc4c 2352 d2a2 72ae 7f89 9c22  .....L#R..r...."
        0x0020:  8010 0156 fe28 0000 0101 080a 7c9c a4e6  ...V.(......|...
        0x0030:  7c9c a4e6                                |...
13:18:16.318818 IP (tos 0x0, ttl 64, id 54861, offset 0, flags [DF], proto TCP (6), length 61)
    localhost.48204 > localhost.9042: Flags [P.], cksum 0xfe31 (incorrect -> 0xebb1), seq 1:10, ack 1, win 342, options [nop,nop,TS val 2090640614 ecr 2090640614], length 9
        0x0000:  4500 003d d64d 4000 4006 666b 7f00 0001  E..=.M@.@.fk....
        0x0010:  7f00 0001 bc4c 2352 d2a2 72ae 7f89 9c22  .....L#R..r...."
        0x0020:  8018 0156 fe31 0000 0101 080a 7c9c a4e6  ...V.1......|...
        0x0030:  7c9c a4e6 0300 0000 0500 0000 00         |............
13:18:16.318831 IP (tos 0x0, ttl 64, id 14532, offset 0, flags [DF], proto TCP (6), length 52)
    localhost.9042 > localhost.48204: Flags [.], cksum 0xfe28 (incorrect -> 0xf3b9), seq 1, ack 10, win 342, options [nop,nop,TS val 2090640614 ecr 2090640614], length 0
        0x0000:  4500 0034 38c4 4000 4006 03fe 7f00 0001  E..48.@.@.......
        0x0010:  7f00 0001 2352 bc4c 7f89 9c22 d2a2 72b7  ....#R.L..."..r.
        0x0020:  8010 0156 fe28 0000 0101 080a 7c9c a4e6  ...V.(......|...
        0x0030:  7c9c a4e6                                |...
13:18:16.319054 IP (tos 0x0, ttl 64, id 14533, offset 0, flags [DF], proto TCP (6), length 105)
    localhost.9042 > localhost.48204: Flags [P.], cksum 0xfe5d (incorrect -> 0xcefd), seq 1:54, ack 10, win 342, options [nop,nop,TS val 2090640614 ecr 2090640614], length 53
        0x0000:  4500 0069 38c5 4000 4006 03c8 7f00 0001  E..i8.@.@.......
        0x0010:  7f00 0001 2352 bc4c 7f89 9c22 d2a2 72b7  ....#R.L..."..r.
        0x0020:  8018 0156 fe5d 0000 0101 080a 7c9c a4e6  ...V.]......|...
        0x0030:  7c9c a4e6 8300 0000 0600 0000 2c00 0200  |...........,...
        0x0040:  0b43 4f4d 5052 4553 5349 4f4e 0001 0003  .COMPRESSION....
        0x0050:  6c7a 3400 0b43 514c 5f56 4552 5349 4f4e  lz4..CQL_VERSION
        0x0060:  0001 0005 332e 322e 31                   ....3.2.1
13:18:16.319061 IP (tos 0x0, ttl 64, id 54862, offset 0, flags [DF], proto TCP (6), length 52)
    localhost.48204 > localhost.9042: Flags [.], cksum 0xfe28 (incorrect -> 0xf384), seq 10, ack 54, win 342, options [nop,nop,TS val 2090640614 ecr 2090640614], length 0
        0x0000:  4500 0034 d64e 4000 4006 6673 7f00 0001  E..4.N@.@.fs....
        0x0010:  7f00 0001 bc4c 2352 d2a2 72b7 7f89 9c57  .....L#R..r....W
        0x0020:  8010 0156 fe28 0000 0101 080a 7c9c a4e6  ...V.(......|...
        0x0030:  7c9c a4e6                                |...
13:18:16.319249 IP (tos 0x0, ttl 64, id 54863, offset 0, flags [DF], proto TCP (6), length 83)
    localhost.48204 > localhost.9042: Flags [P.], cksum 0xfe47 (incorrect -> 0x9e2b), seq 10:41, ack 54, win 342, options [nop,nop,TS val 2090640614 ecr 2090640614], length 31
        0x0000:  4500 0053 d64f 4000 4006 6653 7f00 0001  E..S.O@.@.fS....
        0x0010:  7f00 0001 bc4c 2352 d2a2 72b7 7f89 9c57  .....L#R..r....W
        0x0020:  8018 0156 fe47 0000 0101 080a 7c9c a4e6  ...V.G......|...
        0x0030:  7c9c a4e6 0300 0001 0100 0000 1600 0100  |...............
        0x0040:  0b43 514c 5f56 4552 5349 4f4e 0005 332e  .CQL_VERSION..3.
        0x0050:  322e 31                                  2.1
13:18:16.319312 IP (tos 0x0, ttl 64, id 14534, offset 0, flags [DF], proto TCP (6), length 61)
    localhost.9042 > localhost.48204: Flags [P.], cksum 0xfe31 (incorrect -> 0x6e53), seq 54:63, ack 41, win 342, options [nop,nop,TS val 2090640614 ecr 2090640614], length 9
        0x0000:  4500 003d 38c6 4000 4006 03f3 7f00 0001  E..=8.@.@.......
        0x0010:  7f00 0001 2352 bc4c 7f89 9c57 d2a2 72d6  ....#R.L...W..r.
        0x0020:  8018 0156 fe31 0000 0101 080a 7c9c a4e6  ...V.1......|...
        0x0030:  7c9c a4e6 8300 0001 0200 0000 00         |............
13:18:16.320482 IP (tos 0x0, ttl 64, id 54864, offset 0, flags [DF], proto TCP (6), length 110)
    localhost.48204 > localhost.9042: Flags [P.], cksum 0xfe62 (incorrect -> 0xc6ac), seq 41:99, ack 63, win 342, options [nop,nop,TS val 2090640614 ecr 2090640614], length 58
        0x0000:  4500 006e d650 4000 4006 6637 7f00 0001  E..n.P@.@.f7....
        0x0010:  7f00 0001 bc4c 2352 d2a2 72d6 7f89 9c60  .....L#R..r....`
        0x0020:  8018 0156 fe62 0000 0101 080a 7c9c a4e6  ...V.b......|...
        0x0030:  7c9c a4e6 0300 0002 0b00 0000 3100 0300  |...........1...
        0x0040:  0f54 4f50 4f4c 4f47 595f 4348 414e 4745  .TOPOLOGY_CHANGE
        0x0050:  000d 5354 4154 5553 5f43 4841 4e47 4500  ..STATUS_CHANGE.
        0x0060:  0d53 4348 454d 415f 4348 414e 4745       .SCHEMA_CHANGE
13:18:16.320571 IP (tos 0x0, ttl 64, id 14535, offset 0, flags [DF], proto TCP (6), length 61)
    localhost.9042 > localhost.48204: Flags [P.], cksum 0xfe31 (incorrect -> 0x6e0f), seq 63:72, ack 99, win 342, options [nop,nop,TS val 2090640614 ecr 2090640614], length 9
        0x0000:  4500 003d 38c7 4000 4006 03f2 7f00 0001  E..=8.@.@.......
        0x0010:  7f00 0001 2352 bc4c 7f89 9c60 d2a2 7310  ....#R.L...`..s.
        0x0020:  8018 0156 fe31 0000 0101 080a 7c9c a4e6  ...V.1......|...
        0x0030:  7c9c a4e6 8300 0002 0200 0000 00         |............
13:18:16.321743 IP (tos 0x0, ttl 64, id 54865, offset 0, flags [DF], proto TCP (6), length 153)
    localhost.48204 > localhost.9042: Flags [P.], cksum 0xfe8d (incorrect -> 0x1331), seq 99:200, ack 72, win 342, options [nop,nop,TS val 2090640614 ecr 2090640614], length 101
        0x0000:  4500 0099 d651 4000 4006 660b 7f00 0001  E....Q@.@.f.....
        0x0010:  7f00 0001 bc4c 2352 d2a2 7310 7f89 9c69  .....L#R..s....i
        0x0020:  8018 0156 fe8d 0000 0101 080a 7c9c a4e6  ...V........|...
        0x0030:  7c9c a4e6 0300 0003 0700 0000 5c00 0000  |...........\...
        0x0040:  5553 454c 4543 5420 7065 6572 2c20 6461  USELECT.peer,.da
        0x0050:  7461 5f63 656e 7465 722c 2072 6163 6b2c  ta_center,.rack,
        0x0060:  2074 6f6b 656e 732c 2072 7063 5f61 6464  .tokens,.rpc_add
        0x0070:  7265 7373 2c20 7363 6865 6d61 5f76 6572  ress,.schema_ver
        0x0080:  7369 6f6e 2046 524f 4d20 7379 7374 656d  sion.FROM.system
        0x0090:  2e70 6565 7273 0001 00                   .peers...
13:18:16.322899 IP (tos 0x0, ttl 64, id 14536, offset 0, flags [DF], proto TCP (6), length 77)
    localhost.9042 > localhost.48204: Flags [P.], cksum 0xfe41 (incorrect -> 0x558f), seq 72:97, ack 200, win 342, options [nop,nop,TS val 2090640615 ecr 2090640614], length 25
        0x0000:  4500 004d 38c8 4000 4006 03e1 7f00 0001  E..M8.@.@.......
        0x0010:  7f00 0001 2352 bc4c 7f89 9c69 d2a2 7375  ....#R.L...i..su
        0x0020:  8018 0156 fe41 0000 0101 080a 7c9c a4e7  ...V.A......|...
        0x0030:  7c9c a4e6 8300 0003 0800 0000 1000 0000  |...............
        0x0040:  0200 0000 0000 0000 0000 0000 00         .............
13:18:16.322906 IP (tos 0x0, ttl 64, id 54866, offset 0, flags [DF], proto TCP (6), length 179)
    localhost.48204 > localhost.9042: Flags [P.], cksum 0xfea7 (incorrect -> 0x6107), seq 200:327, ack 97, win 342, options [nop,nop,TS val 2090640615 ecr 2090640615], length 127
        0x0000:  4500 00b3 d652 4000 4006 65f0 7f00 0001  E....R@.@.e.....
        0x0010:  7f00 0001 bc4c 2352 d2a2 7375 7f89 9c82  .....L#R..su....
        0x0020:  8018 0156 fea7 0000 0101 080a 7c9c a4e7  ...V........|...
        0x0030:  7c9c a4e7 0300 0004 0700 0000 7600 0000  |...........v...
        0x0040:  6f53 454c 4543 5420 636c 7573 7465 725f  oSELECT.cluster_
        0x0050:  6e61 6d65 2c20 6461 7461 5f63 656e 7465  name,.data_cente
        0x0060:  722c 2072 6163 6b2c 2074 6f6b 656e 732c  r,.rack,.tokens,
        0x0070:  2070 6172 7469 7469 6f6e 6572 2c20 7363  .partitioner,.sc
        0x0080:  6865 6d61 5f76 6572 7369 6f6e 2046 524f  hema_version.FRO
        0x0090:  4d20 7379 7374 656d 2e6c 6f63 616c 2057  M.system.local.W
        0x00a0:  4845 5245 206b 6579 3d27 6c6f 6361 6c27  HERE.key='local'
        0x00b0:  0001 00                                  ...
13:18:16.324031 IP (tos 0x0, ttl 64, id 14537, offset 0, flags [DF], proto TCP (6), length 77)
    localhost.9042 > localhost.48204: Flags [P.], cksum 0xfe41 (incorrect -> 0x53f5), seq 97:122, ack 327, win 342, options [nop,nop,TS val 2090640615 ecr 2090640615], length 25
        0x0000:  4500 004d 38c9 4000 4006 03e0 7f00 0001  E..M8.@.@.......
        0x0010:  7f00 0001 2352 bc4c 7f89 9c82 d2a2 73f4  ....#R.L......s.
        0x0020:  8018 0156 fe41 0000 0101 080a 7c9c a4e7  ...V.A......|...
        0x0030:  7c9c a4e7 8300 0004 0800 0000 1000 0000  |...............
        0x0040:  0200 0000 0000 0000 0000 0000 01         .............
13:18:16.325215 IP (tos 0x0, ttl 64, id 54867, offset 0, flags [DF], proto TCP (6), length 52)
    localhost.48204 > localhost.9042: Flags [F.], cksum 0xfe28 (incorrect -> 0xf200), seq 327, ack 122, win 342, options [nop,nop,TS val 2090640615 ecr 2090640615], length 0
        0x0000:  4500 0034 d653 4000 4006 666e 7f00 0001  E..4.S@.@.fn....
        0x0010:  7f00 0001 bc4c 2352 d2a2 73f4 7f89 9c9b  .....L#R..s.....
        0x0020:  8011 0156 fe28 0000 0101 080a 7c9c a4e7  ...V.(......|...
        0x0030:  7c9c a4e7                                |...
13:18:16.325342 IP (tos 0x0, ttl 64, id 14538, offset 0, flags [DF], proto TCP (6), length 52)
    localhost.9042 > localhost.48204: Flags [F.], cksum 0xfe28 (incorrect -> 0xf1ff), seq 122, ack 328, win 342, options [nop,nop,TS val 2090640615 ecr 2090640615], length 0
        0x0000:  4500 0034 38ca 4000 4006 03f8 7f00 0001  E..48.@.@.......
        0x0010:  7f00 0001 2352 bc4c 7f89 9c9b d2a2 73f5  ....#R.L......s.
        0x0020:  8011 0156 fe28 0000 0101 080a 7c9c a4e7  ...V.(......|...
        0x0030:  7c9c a4e7                                |...
13:18:16.325348 IP (tos 0x0, ttl 64, id 54868, offset 0, flags [DF], proto TCP (6), length 52)
    localhost.48204 > localhost.9042: Flags [.], cksum 0xfe28 (incorrect -> 0xf1ff), seq 328, ack 123, win 342, options [nop,nop,TS val 2090640615 ecr 2090640615], length 0
        0x0000:  4500 0034 d654 4000 4006 666d 7f00 0001  E..4.T@.@.fm....
        0x0010:  7f00 0001 bc4c 2352 d2a2 73f5 7f89 9c9c  .....L#R..s.....
        0x0020:  8010 0156 fe28 0000 0101 080a 7c9c a4e7  ...V.(......|...
        0x0030:  7c9c a4e7 
```

**Comment by avikivity** [comment]
The checksum is usually incorrect on localhost connections, because it's not computed (or checked) at all.   Can you attach a .pcap file?  It looks like the connection was established and even some queries got through (you can see a SELECT statement in the dump above).

**Comment by maximmai** [comment]
Here is the tcpdump in .pcap format (zipped as github doesnt support .pcap attachment). 
[tcpdump.pcap.zip](https://github.com/scylladb/scylla/files/753194/tcpdump.pcap.zip)

I am examing it with Wireshark now as well, thanks.

**Comment by avikivity** [comment]
If you use a really new version of wireshark, you'll see the last query returns a result with 1 row but 0 columns.  So something got lost.

Recommend running the server with `--default-log-level trace` to see what.

**Comment by maximmai** [comment]
Thanks.

Just curious, are you aware of any performance difference between the native protocol CQL and Thrift?

**Comment by maximmai** [comment]
For your information, this is part of the trace log that of interest.


[scylladb.trace.txt](https://github.com/scylladb/scylla/files/753241/scylladb.trace.txt)

**Comment by maximmai** [comment]
The trace log does show that the result is properly retrieved from the storage_proxy:

...data_center="datacenter1" cluster_name="Test Cluster" partitioner="org.apache.cassandra.dht.Murmur3Partitioner" schema_version="6b3d42b6-ccb3-de0e-ed71-761a092cacb7" 

Longer version:
```
TRACE 2017-02-05 15:45:29,466 [shard 0] query_processor - process: "SELECT cluster_name, data_center, rack, tokens, partitioner, schema_version FROM system.local WHERE key='local'"
TRACE 2017-02-05 15:45:29,466 [shard 0] storage_proxy - query system.local cmd=read_command{cf_id=a635ddbc-9243-d57a-77b3-6078044e1784, version=cc3a9aed-4c2a-ba16-565d-4932c75a1eae, slice={regular_cols=[2, 4, 10, 16, 9, 13], static_cols=[], rows=[(-inf, +inf)], options=0, cql_format=3, partition_row_limit=4294967295}, limit=2147483647, timestamp=1486327529}, partition_limit=4294967295}, ranges={=={-7564491331177403445, pk{00056c6f63616c}}}, id=2977
TRACE 2017-02-05 15:45:29,466 [shard 0] storage_proxy - creating read executor for token -7564491331177403445 with all: {127.0.0.1} targets: {127.0.0.1} rp decision: NONE
TRACE 2017-02-05 15:45:29,467 [shard 0] storage_proxy - query_result id=2977, size=6167
TRACE 2017-02-05 15:45:29,467 [shard 0] query_result - id=2977, { result: rack="rack1" tokens="-1001311531560643709; <ignored some lines here for readability on github> 949447995447490914" data_center="datacenter1" cluster_name="Test Cluster" partitioner="org.apache.cassandra.dht.Murmur3Partitioner" schema_version="6b3d42b6-ccb3-de0e-ed71-761a092cacb7" 
```

**Comment by maximmai** [comment]
@avikivity hi Avi,

It seems that the query result gets sent back to the CQL client as "{}", any thoughts on what might cause this?

**Comment by avikivity** [comment]
You can instrument `cql_server::fmt_visitor::visit(const messages::result_message::rows& m)` (in `transport/server.cc`) and log `rs.size()`, that will tell us if the problem is between storage_proxy and cql_server, or after cql_server.

**Comment by maximmai** [comment]
@avikivity Thanks Avi for the hint.

I am certain now that the result gets lost somewhere between `storage_proxy` and `cql_server`.

From trace log, and extra `logger.trace()` added, it shows that the result was prepared, but somehow, somewhere between `service/storage_proxy.cc` and `transport/server.cc`, the result gets lost.

`[shard 0] storage_proxy - [S390X] query_result id=59, size=6186`

```
[shard 0] query_result - [S390X] id=59, { result: rack="rack1" tokens="-1099126266602451732; ...
982008650722913476" data_center="datacenter1" cluster_name="Test Cluster" partitioner="org.apache.cassandra.dht.Murmur3Partitioner" schema_version="113b8e95-389c-d61f-49b9-c8c29dc3afa3"
 digest: 71 3b e9 4b 60 18 1f c eb fb 6d dc a4 1e 5e d9  }
```

```
[shard 0] cql_server - [S390X] write_int = (2)
[shard 0] cql_server - [S390X] write_int = (0)
[shard 0] cql_server - [S390X] write_int = (0)
[shard 0] cql_server - [S390X] rs.size() = (1)
[shard 0] cql_server - [S390X] compression = (0)
[shard 0] cql_server - [S390X] response = (1)
[shard 0] cql_server - [S390X] _body.data() = ()
```

I have been staring at the log for quite some time, would appreciate if you could give me some pointers:

1) where to look next in terms of the "travel path" of `query_result`;
2) I noticed that Thrift protocol doesn't use `transport/server.cc` to communicate with the client, does that mean Thrift is faster (in terms of performance), if not, are you aware of any performance difference between the native protocol CQL and Thrift?  I found this article [Thrift Support in Scylla 1.3](http://www.scylladb.com/2016/07/25/thrift/). The article concludes that not a significant performance difference found between Thrift and CQL3, is this still true?

Thank you,

**Comment by dorlaor** [comment]
Maxim, the performance difference depends on a lot of factors, on one hand
the storage format
of Thrift is more efficient and thus one can get better results. On the
other, CQL has prepared statement
which is very good too. So there is no conclusive winner across the board.

**Comment by avikivity** [comment]
The main difference between the thrift and cql transports is that cql allows reordering of responses.  In thrift, if you send requests 1, 2, 3 you will receive responses 1, 2, 3.  Using the cql transport, the responses an be reordered.  This means that if you are sensitive to latency, you can use a small number of connections and still get the first query to be computed to return first.

In turn, using a smaller number of connections means better batching and larger packets.

In Cassandra, the thrift implementation required a thread per connection and so was even worse.  In Scylla, we don't need threads for either the cql or thrift transports, so the difference in performance is not as significant.

**Comment by avikivity** [comment]
@maximmai An intermediate data structure between the two is result_set.  You can add traces to the methods of result_set (like result_set::add_row()) and see if they are called or not.

If they aren't (likely) then the next stop is result_set_builder in selection.cc.

**Comment by maximmai** [comment]
@avikivity Hi Avi,

`result_set::add_row()` is off the hook, as I can see the data being added to it, and the size is 6:

```
[shard 0] result_set - [S390X] result_set::add_row row.size() = (6)
[shard 0] result_set - [S390X] result_set::add_row row content = (5465737420436c7573746572)
[shard 0] result_set - [S390X] result_set::add_row row content = (6461746163656e74657231)
[shard 0] result_set - [S390X] result_set::add_row row content = (7261636b31)
[shard 0] result_set - [S390X] result_set::add_row row content = (00000100000000... <more content ignored> ...3331)
[shard 0] result_set - [S390X] result_set::add_row row content = (6f72672e6170616368652e63617373616e6472612e6468742e4d75726d757233506172746974696f6e6572)
[shard 0] result_set - [S390X] result_set::add_row row content = (a108e58930aa37f4a2554cca62f0e1af)
```

In `transport/server.cc`, before sending the result back to the client, `rs.size()` becomes 1:

```
[shard 0] cql_server - [S390X] cql_server::connection::process_query make_result
[shard 0] cql_server - [S390X] write_int = (2)
[shard 0] cql_server - [S390X] response::write metadata
[shard 0] cql_server - [S390X] write_int = (0)
[shard 0] cql_server - [S390X] write_int = (0)
[shard 0] cql_server - [S390X] write_int = (1)
[shard 0] cql_server - [S390X] rs.size() = (1)
[shard 0] cql_server - [S390X] ready to response
[shard 0] cql_server - [S390X] response = (1)
[shard 0] cql_server - [S390X] output _body.size() = (16), _body = ({, , , , , , , , , , , , , , , })
```

I am stuck at tracing where `result_set` goes after exiting `cql3/result_set.cc`. Unfortunately, GDB doesn't work because a bug in GCC crashes the demangler, and ScyllaDB exposed the GCC bug.

**Comment by maximmai** [comment]
I have identified the place where the output _body "becomes" empty:

in `transport/server.cc`, method `visit`:

` for (auto&& cell : row | boost::adaptors::sliced(0, rs.get_metadata().column_count())) `

`rs.get_metadata().column_count()` always returns `0`, this is causing _`response->write_value(cell);` never gets called!

```
1093     virtual void visit(const messages::result_message::rows& m) override {
1094         _response->write_int(0x0002);
1095         auto& rs = m.rs();
1096         _response->write(rs.get_metadata());
1097         _response->write_int(rs.size());
1098         logger.info("[S390X] rs.size() = ({})", rs.size());
1099         for (auto&& row : rs.rows()) {
1100             // value is properly printed at this point.
1101             logger.info("[S390X] visit the rows, current row = ({})", row);
1102             logger.info("[S390X] boost::adators::sliced(0, rs.get_metadata().column_count() = ({})",rs.get_metadata().column_count());
1103             for (auto&& cell : row | boost::adaptors::sliced(0, rs.get_metadata().column_count())) {
1104                 logger.info("[S390X] fmt_visitor::visit write_value ({})", cell);
1105                 _response->write_value(cell);
1106             }   
1107         }   
1108     }  
```

**Comment by avikivity** [comment]
Well, the metadata was prepared a lot earlier.  I think this is in the `selection` class in selection.cc.

**Comment by maximmai** [comment]
hi @avikivity , by just looking at this result, can you tell me the `rows.size()` and `get_columns.size()` this `query_result` from `storage_proxy`:

```
{ result: rack="rack1" 
tokens="-1048324512695572697; ... 935141330248727378" 
data_center="datacenter1" 
cluster_name="Test Cluster" 
partitioner="org.apache.cassandra.dht.Murmur3Partitioner" 
schema_version="a43cf023-2fd9-2735-fd26-ee6fc84f2b9f" }
```

I have a feeling that, somehow the `query_result_builder` mixed the columns and rows, in my case here?

Things that I have traced to make sure the result_set and metadata are properly constructed:

- cql3_selection - column_specification raw_selectors.size() = (6)
- cql3_statement_select_statement - regular_columns.push_back(col->id) = (2)
- cql3_statement_select_statement - regular_columns.push_back(col->id) = (4)
- cql3_statement_select_statement - regular_columns.push_back(col->id) = (10)
- cql3_statement_select_statement - regular_columns.push_back(col->id) = (16)
- cql3_statement_select_statement - regular_columns.push_back(col->id) = (9)
- cql3_statement_select_statement - regular_columns.push_back(col->id) = (13)

**Comment by slivne** [comment]
@maximmai / @avikivity is all the code checked in ?
