### ISSUE TITLE
Scylla cannot be connected from cpp-driver 2.15.1

### ISSUE THREAD

**Issue by jul-stas** [scylladb/scylla#6476]
After negotiating protocol version to v4 client gets a `RESULT` message, which is malformed according to wireshark. The tcpdump from a connection attempt is attached.
Interestingly, everything works with `cpp-driver-2.15.0`.

```
Frame 61: 18481 bytes on wire (147848 bits), 18481 bytes captured (147848 bits)
Ethernet II, Src: 00:00:00_00:00:00 (00:00:00:00:00:00), Dst: 00:00:00_00:00:00 (00:00:00:00:00:00)
Internet Protocol Version 4, Src: 127.0.0.1, Dst: 127.0.0.1
Transmission Control Protocol, Src Port: 9042, Dst Port: 41242, Seq: 10656, Ack: 763, Len: 18415
Cassandra CQL Protocol
    Version: 0x84
    Flags: 0x00
    Stream Identifier: 704
    .000 1000 = Opcode: RESULT (8)
    Message Length: 18406
    [Request in: 46]
    [Response time: 0.002567000 seconds]
    Message RESULT
        Result Kind: Rows (2)
        Rows Result Flags: 0
        .... .... .... .... .... .... .... ...0 = Global tables spec.: False
        .... .... .... .... .... .... .... ..0. = Has More Pages: False
        .... .... .... .... .... .... .... .0.. = No Metadata: False
        Metadata
        Rows
            CQL Result Rows Count: 45
            Data (Columns)
[Malformed Packet: CQL]
    [Expert Info (Error/Malformed): Malformed Packet (Exception occurred)]
        [Malformed Packet (Exception occurred)]
        [Severity level: Error]
        [Group: Malformed]
```
[scylla_pcap.zip](https://github.com/scylladb/scylla/files/4644644/scylla_pcap.zip)

**Comment by slivne** [comment]
the problem is from the client side (driver - in my view) the options packet is not correct

![client_incorrect](https://user-images.githubusercontent.com/3465480/82225535-00d92e80-992e-11ea-8879-60233fba06a5.png)


correct options

![correct_client](https://user-images.githubusercontent.com/3465480/82225555-059de280-992e-11ea-9f01-a99da5df690b.png)

The first byte seems incorrect:

https://github.com/apache/cassandra/blob/trunk/doc/native_protocol_v4.spec#L86

it can ONLY be 0x84 / 0x04 (for v4) 

I expect this will also not succeed with cassandra

**Comment by jul-stas** [comment]
@slivne ouch, confirmed - doesn't work with Cassandra on v4. Closing.

**Comment by slivne** [comment]
open a bug on the cassandr cpp driver for this ... you can kip this open linked to the cpp driver bug

**Comment by jul-stas** [comment]
Issue at cpp-driver's tracker: https://datastax-oss.atlassian.net/browse/CPP-916

**Comment by slivne** [comment]
Looks related to #6099

**Comment by slivne** [comment]
@jul-stas based on your comment it seams CPP Driver 2.15.2 doesn't hang - if this works ok with Scylla as well - please close this and the associated issue

**Comment by jul-stas** [comment]
Yes, the solution is to use 2.15.2 or 2.15.0, so I'm closing.
