### ISSUE TITLE
Upgrade from 1.3.1 --> 1.4-rc2 failing with rpc compression enabled

### ISSUE THREAD

**Issue by slivne** [scylladb/scylla#1767]
1. cluster 3 nodes with AMI: scylladb 1.3.1 (ami-eae2a7fd)
1. update scylla.yaml of all the nodes to have ```internode_compression: all```
1. restart all of the node
1. started a load on the cluster with c-s ```cassandra-stress write duration=60m cl=QUORUM -mode cql3 native -node ```
1. upgrade one of the node to 1.4-rc2 using the following

```
    sudo cp -a /etc/scylla/scylla.yaml /etc/scylla/scylla.yaml.backup-1.3
    sudo rm -rf /etc/yum.repos.d/scylla.repo
    sudo wget https://s3.amazonaws.com/downloads.scylladb.com/rpm/unstable/centos/branch-1.4/10/scylla.repo
    sudo cp scylla.repo /etc/yum.repos.d/
    sudo yum clean all
    sudo yum update scylla scylla-server scylla-jmx scylla-tools scylla-conf scylla-kernel-conf -y
    nodetool drain
    sudo service scylla-server  restart
```

in the journalctl  of the scylla 1.3.1 servers

```
Oct 18 13:52:40 ip-10-169-204-109 scylla[2733]:  [shard 0] rpc - client 10.154.2.97: fail to connect: Connection refused
Oct 18 13:52:41 ip-10-169-204-109 scylla[2733]:  [shard 0] rpc - client 10.154.2.97: fail to connect: Connection refused
Oct 18 13:52:42 ip-10-169-204-109 scylla[2733]:  [shard 0] rpc - client 10.154.2.97: fail to connect: Connection refused
Oct 18 13:52:43 ip-10-169-204-109 scylla[2733]:  [shard 0] rpc - client 10.154.2.97: fail to connect: Connection refused
Oct 18 13:52:44 ip-10-169-204-109 scylla[2733]:  [shard 0] rpc - client 10.154.2.97: fail to connect: Connection refused
Oct 18 13:52:45 ip-10-169-204-109 scylla[2733]:  [shard 0] rpc - client 10.154.2.97: fail to connect: Connection refused
Oct 18 13:52:46 ip-10-169-204-109 scylla[2733]:  [shard 2] rpc - client 10.154.2.97: server connection dropped: RPC frame LZ4 decompression failure
Oct 18 13:52:47 ip-10-169-204-109 scylla[2733]:  [shard 3] rpc - client 10.154.2.97: server connection dropped: RPC frame LZ4 decompression failure
Oct 18 13:52:48 ip-10-169-204-109 scylla[2733]:  [shard 0] rpc - client 10.154.2.97: server connection dropped: RPC frame LZ4 decompression failure
Oct 18 13:52:48 ip-10-169-204-109 scylla[2733]:  [shard 1] rpc - client 10.154.2.97: server connection dropped: RPC frame LZ4 decompression failure
Oct 18 13:52:49 ip-10-169-204-109 scylla[2733]:  [shard 2] rpc - client 10.154.2.97: server connection dropped: RPC frame LZ4 decompression failure
Oct 18 13:52:50 ip-10-169-204-109 scylla[2733]:  [shard 3] rpc - client 10.154.2.97: server connection dropped: RPC frame LZ4 decompression failure
Oct 18 13:52:51 ip-10-169-204-109 scylla[2733]:  [shard 0] rpc - client 10.154.2.97: server connection dropped: RPC frame LZ4 decompression failure
Oct 18 13:52:51 ip-10-169-204-109 scylla[2733]:  [shard 1] rpc - client 10.154.2.97: server connection dropped: RPC frame LZ4 decompression failure
Oct 18 13:52:52 ip-10-169-204-109 scylla[2733]:  [shard 2] rpc - client 10.154.2.97: server connection dropped: RPC frame LZ4 decompression failure
Oct 18 13:52:52 ip-10-169-204-109 scylla[2733]:  [shard 3] rpc - client 10.154.2.97: server connection dropped: RPC frame LZ4 decompression failure
Oct 18 13:52:53 ip-10-169-204-109 scylla[2733]:  [shard 0] rpc - client 10.154.2.97: server connection dropped: RPC frame LZ4 decompression failure
Oct 18 13:52:54 ip-10-169-204-109 scylla[2733]:  [shard 1] rpc - client 10.154.2.97: server connection dropped: RPC frame LZ4 decompression failure
Oct 18 13:52:55 ip-10-169-204-109 scylla[2733]:  [shard 2] rpc - client 10.154.2.97: server connection dropped: RPC frame LZ4 decompression failure
Oct 18 13:52:57 ip-10-169-204-109 scylla[2733]:  [shard 3] rpc - client 10.154.2.97: server connection dropped: RPC frame LZ4 decompression failure
Oct 18 13:52:57 ip-10-169-204-109 scylla[2733]:  [shard 0] rpc - client 10.154.2.97: server connection dropped: RPC frame LZ4 decompression failure
Oct 18 13:52:58 ip-10-169-204-109 scylla[2733]:  [shard 1] rpc - client 10.154.2.97: server connection dropped: RPC frame LZ4 decompression failure
Oct 18 13:52:59 ip-10-169-204-109 scylla[2733]:  [shard 2] rpc - client 10.154.2.97: server connection dropped: RPC frame LZ4 decompression failure
Oct 18 13:53:02 ip-10-169-204-109 scylla[2733]:  [shard 3] rpc - client 10.154.2.97: server connection dropped: RPC frame LZ4 decompression failure
Oct 18 13:53:02 ip-10-169-204-109 scylla[2733]:  [shard 0] rpc - client 10.154.2.97: server connection dropped: RPC frame LZ4 decompression failure
Oct 18 13:53:03 ip-10-169-204-109 scylla[2733]:  [shard 1] rpc - client 10.154.2.97: server connection dropped: RPC frame LZ4 decompression failure
Oct 18 13:53:03 ip-10-169-204-109 scylla[2733]:  [shard 2] rpc - client 10.154.2.97: server connection dropped: RPC frame LZ4 decompression failure
Oct 18 13:53:04 ip-10-169-204-109 scylla[2733]:  [shard 3] rpc - client 10.154.2.97: server connection dropped: RPC frame LZ4 decompression failure
Oct 18 13:53:06 ip-10-169-204-109 scylla[2733]:  [shard 0] rpc - client 10.154.2.97: server connection dropped: RPC frame LZ4 decompression failure
Oct 18 13:53:06 ip-10-169-204-109 scylla[2733]:  [shard 1] rpc - client 10.154.2.97: server connection dropped: RPC frame LZ4 decompression failure
Oct 18 13:53:07 ip-10-169-204-109 scylla[2733]:  [shard 2] rpc - client 10.154.2.97: server connection dropped: RPC frame LZ4 decompression failure
```

on the 1.4-rc2 node  journalctl

```
Oct 18 13:52:54 ip-10-154-2-97 scylla[2675]:  [shard 0] rpc - client 10.169.204.109: client connection dropped: read: Connection reset by peer
Oct 18 13:52:55 ip-10-154-2-97 scylla[2675]:  [shard 0] rpc - client 10.149.74.253: client connection dropped: read: Connection reset by peer
Oct 18 13:52:55 ip-10-154-2-97 scylla[2675]:  [shard 0] rpc - client 10.169.204.109: client connection dropped: read: Connection reset by peer
Oct 18 13:52:55 ip-10-154-2-97 scylla[2675]:  [shard 0] rpc - client 10.149.74.253: client connection dropped: read: Connection reset by peer
Oct 18 13:52:56 ip-10-154-2-97 scylla[2675]:  [shard 0] rpc - client 10.149.74.253: client connection dropped: read: Connection reset by peer
Oct 18 13:52:56 ip-10-154-2-97 scylla[2675]:  [shard 0] rpc - client 10.149.74.253: client connection dropped: read: Connection reset by peer
Oct 18 13:52:57 ip-10-154-2-97 scylla[2675]:  [shard 0] rpc - client 10.169.204.109: client connection dropped: read: Connection reset by peer
Oct 18 13:52:58 ip-10-154-2-97 scylla[2675]:  [shard 0] rpc - client 10.149.74.253: client connection dropped: read: Connection reset by peer
Oct 18 13:52:58 ip-10-154-2-97 scylla[2675]:  [shard 0] rpc - client 10.169.204.109: client connection dropped: read: Connection reset by peer
Oct 18 13:52:58 ip-10-154-2-97 scylla[2675]:  [shard 0] rpc - client 10.149.74.253: client connection dropped: read: Connection reset by peer
Oct 18 13:52:59 ip-10-154-2-97 scylla[2675]:  [shard 0] rpc - client 10.149.74.253: client connection dropped: read: Connection reset by peer
Oct 18 13:52:59 ip-10-154-2-97 scylla[2675]:  [shard 0] rpc - client 10.169.204.109: client connection dropped: read: Connection reset by peer
Oct 18 13:52:59 ip-10-154-2-97 scylla[2675]:  [shard 0] rpc - client 10.149.74.253: client connection dropped: read: Connection reset by peer
Oct 18 13:53:00 ip-10-154-2-97 scylla[2675]:  [shard 0] rpc - client 10.149.74.253: client connection dropped: read: Connection reset by peer
Oct 18 13:53:00 ip-10-154-2-97 scylla[2675]:  [shard 0] rpc - client 10.149.74.253: client connection dropped: read: Connection reset by peer
Oct 18 13:53:01 ip-10-154-2-97 scylla[2675]:  [shard 0] rpc - client 10.149.74.253: client connection dropped: read: Connection reset by peer
Oct 18 13:53:02 ip-10-154-2-97 scylla[2675]:  [shard 0] rpc - client 10.149.74.253: client connection dropped: read: Connection reset by peer
Oct 18 13:53:02 ip-10-154-2-97 scylla[2675]:  [shard 0] rpc - client 10.169.204.109: client connection dropped: read: Connection reset by peer
Oct 18 13:53:02 ip-10-154-2-97 scylla[2675]:  [shard 0] rpc - client 10.169.204.109: client connection dropped: read: Connection reset by peer
Oct 18 13:53:03 ip-10-154-2-97 scylla[2675]:  [shard 0] rpc - client 10.169.204.109: client connection dropped: read: Connection reset by peer
Oct 18 13:53:04 ip-10-154-2-97 scylla[2675]:  [shard 0] rpc - client 10.149.74.253: client connection dropped: read: Connection reset by peer
Oct 18 13:53:04 ip-10-154-2-97 scylla[2675]:  [shard 0] rpc - client 10.169.204.109: client connection dropped: read: Connection reset by peer
Oct 18 13:53:04 ip-10-154-2-97 scylla[2675]:  [shard 0] rpc - client 10.149.74.253: client connection dropped: read: Connection reset by peer
Oct 18 13:53:05 ip-10-154-2-97 scylla[2675]:  [shard 0] rpc - client 10.149.74.253: client connection dropped: read: Connection reset by peer
Oct 18 13:53:06 ip-10-154-2-97 scylla[2675]:  [shard 0] rpc - client 10.149.74.253: client connection dropped: read: Connection reset by peer
```

**Comment by tgrabiec** [comment]
Here's the communication:
```
10:29:56.222673 IP ip-172-31-27-160.43193 > ip-172-31-27-159.afs3-fileserver: Flags [S], seq 680847425, win 26883, options [mss 8961,sackOK,TS val 4410841 ecr 0,nop,wscale 7], length 0
        0x0000:  06b4 0421 5e3d 0669 8bfe 080f 0800 4500  ...!^=.i......E.
        0x0010:  003c a598 4000 4006 05a6 ac1f 1ba0 ac1f  .<..@.@.........
        0x0020:  1b9f a8b9 1b58 2894 e841 0000 0000 a002  .....X(..A......
        0x0030:  6903 0f2e 0000 0204 2301 0402 080a 0043  i.......#......C
        0x0040:  4dd9 0000 0000 0103 0307                 M.........
10:29:56.222686 IP ip-172-31-27-159.afs3-fileserver > ip-172-31-27-160.43193: Flags [S.], seq 1602746077, ack 680847426, win 26847, options [mss 8961,sackOK,TS val 4410845 ecr 4410841,nop,wscale 7], length 0
        0x0000:  0669 8bfe 080f 06b4 0421 5e3d 0800 4500  .i.......!^=..E.
        0x0010:  003c 0000 4000 4006 ab3e ac1f 1b9f ac1f  .<..@.@..>......
        0x0020:  1ba0 1b58 a8b9 5f87 f6dd 2894 e842 a012  ...X.._...(..B..
        0x0030:  68df 8fac 0000 0204 2301 0402 080a 0043  h.......#......C
        0x0040:  4ddd 0043 4dd9 0103 0307                 M..CM.....
10:29:56.222806 IP ip-172-31-27-160.43193 > ip-172-31-27-159.afs3-fileserver: Flags [.], ack 1, win 211, options [nop,nop,TS val 4410841 ecr 4410845], length 0
        0x0000:  06b4 0421 5e3d 0669 8bfe 080f 0800 4500  ...!^=.i......E.
        0x0010:  0034 a599 4000 4006 05ad ac1f 1ba0 ac1f  .4..@.@.........
        0x0020:  1b9f a8b9 1b58 2894 e842 5f87 f6de 8010  .....X(..B_.....
        0x0030:  00d3 1ee1 0000 0101 080a 0043 4dd9 0043  ...........CM..C
        0x0040:  4ddd                                     M.
10:29:56.222846 IP ip-172-31-27-160.43193 > ip-172-31-27-159.afs3-fileserver: Flags [P.], seq 1:32, ack 1, win 211, options [nop,nop,TS val 4410841 ecr 4410845], length 31
        0x0000:  06b4 0421 5e3d 0669 8bfe 080f 0800 4500  ...!^=.i......E.
        0x0010:  0053 a59a 4000 4006 058d ac1f 1ba0 ac1f  .S..@.@.........
        0x0020:  1b9f a8b9 1b58 2894 e842 5f87 f6de 8018  .....X(..B_.....
        0x0030:  00d3 3e34 0000 0101 080a 0043 4dd9 0043  ..>4.......CM..C
        0x0040:  4ddd 5353 5441 5252 5043 1300 0000 0000  M.SSTARRPC......
        0x0050:  0000 0300 0000 4c5a 3401 0000 0000 0000  ......LZ4.......
        0x0060:  00                                       .
10:29:56.222857 IP ip-172-31-27-159.afs3-fileserver > ip-172-31-27-160.43193: Flags [.], ack 32, win 210, options [nop,nop,TS val 4410845 ecr 4410841], length 0
        0x0000:  0669 8bfe 080f 06b4 0421 5e3d 0800 4500  .i.......!^=..E.
        0x0010:  0034 bb03 4000 4006 f042 ac1f 1b9f ac1f  .4..@.@..B......
        0x0020:  1ba0 1b58 a8b9 5f87 f6de 2894 e861 8010  ...X.._...(..a..
        0x0030:  00d2 8fa4 0000 0101 080a 0043 4ddd 0043  ...........CM..C
        0x0040:  4dd9                                     M.
10:29:56.222900 IP ip-172-31-27-159.afs3-fileserver > ip-172-31-27-160.43193: Flags [P.], seq 1:24, ack 32, win 210, options [nop,nop,TS val 4410845 ecr 4410841], length 23
        0x0000:  0669 8bfe 080f 06b4 0421 5e3d 0800 4500  .i.......!^=..E.
        0x0010:  004b bb04 4000 4006 f02a ac1f 1b9f ac1f  .K..@.@..*......
        0x0020:  1ba0 1b58 a8b9 5f87 f6de 2894 e861 8018  ...X.._...(..a..
        0x0030:  00d2 8fbb 0000 0101 080a 0043 4ddd 0043  ...........CM..C
        0x0040:  4dd9 5353 5441 5252 5043 0b00 0000 0000  M.SSTARRPC......
        0x0050:  0000 0300 0000 4c5a 34                   ......LZ4
10:29:56.222985 IP ip-172-31-27-160.43193 > ip-172-31-27-159.afs3-fileserver: Flags [.], ack 24, win 211, options [nop,nop,TS val 4410841 ecr 4410845], length 0
        0x0000:  06b4 0421 5e3d 0669 8bfe 080f 0800 4500  ...!^=.i......E.
        0x0010:  0034 a59b 4000 4006 05ab ac1f 1ba0 ac1f  .4..@.@.........
        0x0020:  1b9f a8b9 1b58 2894 e861 5f87 f6f5 8010  .....X(..a_.....
        0x0030:  00d3 1eab 0000 0101 080a 0043 4dd9 0043  ...........CM..C
        0x0040:  4ddd                                     M.
10:29:56.223024 IP ip-172-31-27-160.43193 > ip-172-31-27-159.afs3-fileserver: Flags [P.], seq 32:61, ack 24, win 211, options [nop,nop,TS val 4410841 ecr 4410845], length 29
        0x0000:  06b4 0421 5e3d 0669 8bfe 080f 0800 4500  ...!^=.i......E.
        0x0010:  0051 a59c 4000 4006 058d ac1f 1ba0 ac1f  .Q..@.@.........
        0x0020:  1b9f a8b9 1b58 2894 e861 5f87 f6f5 8018  .....X(..a_.....
        0x0030:  00d3 2abc 0000 0101 080a 0043 4dd9 0043  ..*........CM..C
        0x0040:  4ddd 1900 0000 2400 0000 1300 0100 1301  M.....$.........
        0x0050:  0800 c008 0000 00a0 1b1f ac00 0000 00    ...............
10:29:56.223041 IP ip-172-31-27-160.43193 > ip-172-31-27-159.afs3-fileserver: Flags [P.], seq 61:190, ack 24, win 211, options [nop,nop,TS val 4410841 ecr 4410845], length 129
        0x0000:  06b4 0421 5e3d 0669 8bfe 080f 0800 4500  ...!^=.i......E.
        0x0010:  00b5 a59d 4000 4006 0528 ac1f 1ba0 ac1f  ....@.@..(......
        0x0020:  1b9f a8b9 1b58 2894 e87e 5f87 f6f5 8018  .....X(..~_.....
        0x0030:  00d3 a77e 0000 0101 080a 0043 4dd9 0043  ...~.......CM..C
        0x0040:  4ddd 7d00 0000 8c00 0000 2206 0001 0012  M.}.......".....
        0x0050:  0207 0023 0070 0400 f345 1500 0000 7467  ...#.p...E....tg
        0x0060:  7261 6269 6563 2d74 6573 742d 636c 7573  rabiec-test-clus
        0x0070:  7465 722b 0000 006f 7267 2e61 7061 6368  ter+...org.apach
        0x0080:  652e 6361 7373 616e 6472 612e 6468 742e  e.cassandra.dht.
        0x0090:  4d75 726d 7572 3350 6172 7469 7469 6f6e  Murmur3Partition
        0x00a0:  6572 0200 0000 1000 0000 9f1b 1fac 6300  er............c.
        0x00b0:  f002 0010 0000 00a0 1b1f ac15 4607 5843  ............F.XC
        0x00c0:  0500 00                                  ...
10:29:56.223063 IP ip-172-31-27-159.afs3-fileserver > ip-172-31-27-160.43193: Flags [.], ack 190, win 219, options [nop,nop,TS val 4410846 ecr 4410841], length 0
        0x0000:  0669 8bfe 080f 06b4 0421 5e3d 0800 4500  .i.......!^=..E.
        0x0010:  0034 bb05 4000 4006 f040 ac1f 1b9f ac1f  .4..@.@..@......
        0x0020:  1ba0 1b58 a8b9 5f87 f6f5 2894 e8ff 8010  ...X.._...(.....
        0x0030:  00db 8fa4 0000 0101 080a 0043 4dde 0043  ...........CM..C
        0x0040:  4dd9                                     M.
10:29:56.223151 IP ip-172-31-27-159.afs3-fileserver > ip-172-31-27-160.43193: Flags [F.], seq 24, ack 190, win 219, options [nop,nop,TS val 4410846 ecr 4410841], length 0
        0x0000:  0669 8bfe 080f 06b4 0421 5e3d 0800 4500  .i.......!^=..E.
        0x0010:  0034 bb06 4000 4006 f03f ac1f 1b9f ac1f  .4..@.@..?......
        0x0020:  1ba0 1b58 a8b9 5f87 f6f5 2894 e8ff 8011  ...X.._...(.....
        0x0030:  00db 8fa4 0000 0101 080a 0043 4dde 0043  ...........CM..C
        0x0040:  4dd9                                     M.
10:29:56.223260 IP ip-172-31-27-160.43193 > ip-172-31-27-159.afs3-fileserver: Flags [F.], seq 190, ack 25, win 211, options [nop,nop,TS val 4410841 ecr 4410846], length 0
        0x0000:  06b4 0421 5e3d 0669 8bfe 080f 0800 4500  ...!^=.i......E.
        0x0010:  0034 a59e 4000 4006 05a8 ac1f 1ba0 ac1f  .4..@.@.........
        0x0020:  1b9f a8b9 1b58 2894 e8ff 5f87 f6f6 8011  .....X(..._.....
        0x0030:  00d3 1e0a 0000 0101 080a 0043 4dd9 0043  ...........CM..C
        0x0040:  4dde                                     M.
10:29:56.223269 IP ip-172-31-27-159.afs3-fileserver > ip-172-31-27-160.43193: Flags [.], ack 191, win 219, options [nop,nop,TS val 4410846 ecr 4410841], length 0
        0x0000:  0669 8bfe 080f 06b4 0421 5e3d 0800 4500  .i.......!^=..E.
        0x0010:  0034 bb07 4000 4006 f03e ac1f 1b9f ac1f  .4..@.@..>......
        0x0020:  1ba0 1b58 a8b9 5f87 f6f6 2894 e900 8010  ...X.._...(.....
        0x0030:  00db 8fa4 0000 0101 080a 0043 4dde 0043  ...........CM..C
        0x0040:  4dd9                                     M.

```

**Comment by tgrabiec** [comment]
I think it's caused by the fact that the uncompressed size as written to the frame doesn't match the size which was passed to `LZ4_compress`.

1.3.1 doesn't negotiate the timeout feature, so we hit the `else` branch here:
```
                        static_assert(snd_buf::chunk_size >= 8, "send buffer chunk size is too small");
                        if (_timeout_negotiated) {
                            auto expire = d.t.get_timeout();
                            uint64_t left = 0;
                            if (expire != typename timer<>::time_point()) {
                                left = std::chrono::duration_cast<std::chrono::milliseconds>(expire - timer<>::clock::now()).count();
                            }
                            write_le<uint64_t>(d.buf.front().get_write(), left);
                        } else {
                            d.buf.front().trim_front(8);
                        }
```

It trims the buffer by 8 bytes, but doesn't update d.buf.size.

`lz4_compressor::compress()` passes real size of the temporary_buffer to `LZ4_compress` but writes `snd_buf::size` to the frame:

```
temporary_buffer<char> src = linearize(data.bufs, data.size);
..
    auto size = LZ4_compress(src.begin(), dst.get_write() + head_space, src.size());
...   
   write_le<uint32_t>(dst.get_write() + (head_space - 4), data.size);
```

I think the fix would be to introduce `snd_buf::trim_front()`, which both trims the buffer and updates its size.

**Comment by avikivity** [comment]
So the bug is in 1.4?  That's good news.

**Comment by tgrabiec** [comment]
Yes. I have confirmed that starting 1.4-rc2 with this patch makes the error go away:

```patch
diff --git a/rpc/rpc.hh b/rpc/rpc.hh
index 6cbc2d7..c895c37 100644
--- a/rpc/rpc.hh
+++ b/rpc/rpc.hh
@@ -196,6 +196,7 @@ class protocol {
                             write_le<uint64_t>(d.buf.front().get_write(), left);
                         } else {
                             d.buf.front().trim_front(8);
+                            d.buf.size -= 8;
                         }
                     }
                     d.buf = compress(std::move(d.buf));
```
